150426201706300102|建筑工程施工许可证|-|-|翁牛特旗住房和城乡建设局|中蒙医院门诊楼病房楼工程
150426201706300101|建筑工程施工许可证|-|-|翁牛特旗住房和城乡建设局|毛山东业务综合楼、附属配套新建工程
内建建公告【2016】36号|关于批准内蒙古滨河水利水电工程有限公司等48家建筑施工企业安全生产许可的公告|-|-|内蒙古住房和城乡建设厅|安全生产许可证
-|食品经营许可证|2017年05月24日|2020年05月23日|赤峰市松山区市场监督管理局|冷食类食品制售***
150426201706300101|建设工程施工许可证|2017年06月30日|-|翁牛特旗住房和城乡建设局|毛山东业务综合楼、附属配套新建工程
150426201706300102|建设工程施工许可证|2017年06月30日|-|翁牛特旗住房和城乡建设局|中蒙医院门诊楼病房楼工程
-|其他许可证（批准文件）|2018年04月25日|9999年12月31日|赤峰市阿鲁科尔沁旗国家税务局税源管理股|增值税专用发票（增值税税控系统）最高开票限额审批
150430201811150102|其它许可证-施工许可|2018年09月14日|2019年08月01日|敖汉旗住房和城乡建设局|建筑工程施工许可证