2017-12-28|伊金霍洛旗国土资源局与内蒙古正能化工集团有限公司建设用地使用权出让合同纠纷一审民事判决书|建设用地使用权出让合同纠纷|被告-内蒙古正能化工集团有限公司|（2017）内0627民初2891号|https://www.tianyancha.com/lawsuit/c9850d3d3d9011e8b0207cd30ae00c08
2017-09-21|伊金霍洛旗国土资源局与内蒙古正能化工集团有限公司一审民事裁定书|-|被告-内蒙古正能化工集团有限公司|（2016）内0627民初6462号|https://www.tianyancha.com/lawsuit/f1a746719e4411e8a8b47cd30ae00894
2016-12-12|江苏省如高高压电器有限公司诉内蒙古正能化工集团有限公司买卖合同纠纷一案一审撤诉民事裁定书|买卖合同纠纷|原告-江苏省如高高压电器有限公司被告-内蒙古正能化工集团有限公司|（2016）内0627民初2032号|https://www.tianyancha.com/lawsuit/a259108e5a62438f9385c8f91b87c4f3
2016-11-05|江苏省如高高压电器有限公司诉内蒙古正能化工集团有限公司买卖合同纠纷一审民事裁定书|买卖合同纠纷|原告-江苏省如高高压电器有限公司被告-内蒙古正能化工集团有限公司|（2016）内0627民初2032号|https://www.tianyancha.com/lawsuit/39fb9e13b4944882b2c62142938d9f5b
2016-08-30|江苏省如高高压电器有限公司诉内蒙古正能化工集团有限公司买卖合同纠纷一审民事判决书|买卖合同纠纷|原告-江苏省如高高压电器有限公司,电器有限公司被告-内蒙古正能化工集团有限公司|（2016）内0627民初2102号|https://www.tianyancha.com/lawsuit/92c3d79857224894b110f31014b208f0
2015-01-20|内蒙古正能化工诉察右中旗兰丰化工有限责任公司买卖合同纠纷一案保全裁定书|买卖合同纠纷|原告-内蒙古正能化工集团有限公司被告-察右中旗兰丰化工有限责任公司|（2015）伊民初字第746号|https://www.tianyancha.com/lawsuit/6fd58706c86f4a3db373ca53f5f8965b
2014-08-04|安丘奥瑞玻璃钢有限公司与内蒙古正能化工集团有限公司承揽合同纠纷一审民事裁定书|承揽合同纠纷|原告-安丘奥瑞玻璃钢有限公司被告-内蒙古正能化工集团有限公司|（2014）安商初字第908号|https://www.tianyancha.com/lawsuit/538ae2201cb911e6b554008cfae40dc0