2018-01-09|内蒙古霍煤通顺碳素有限责任公司与内蒙古霍煤龙兴房地产开发股份有限公司借款合同纠纷一审民事判决书|借款合同纠纷|原告-内蒙古霍煤通顺碳素有限责任公司被告-内蒙古霍煤龙兴房地产开发股份有限公司|（2015）通商初字第5号|https://www.tianyancha.com/lawsuit/3e4454670cb511e881ec008cfaf870e0
2017-11-06|内蒙古霍林河煤业集团有限责任公司与内蒙古霍煤龙兴房地产开发股份有限公司买卖合同纠纷一审民事判决书|买卖合同纠纷|原告-内蒙古霍林河煤业集团有限责任公司被告-内蒙古霍煤龙兴房地产开发股份有限公司|（2015）通商初字第6号|https://www.tianyancha.com/lawsuit/e05426eef2fb11e788a5008cfaf8725a
2017-08-31|内蒙古霍宁碳素有限责任公司与内蒙古霍煤龙兴房地产开发股份有限公司民间借贷纠纷一审民事判决书|民间借贷纠纷|原告-内蒙古霍宁碳素有限责任公司被告-内蒙古霍煤龙兴房地产开发股份有限公司|（2015）科商初字第139号|https://www.tianyancha.com/lawsuit/b24cad1e98e511e788a5008cfaf8725a
2016-02-03|刘长武与通辽市北方投资有限责任公司、侯志敏管辖权异议二审民事裁定书|-|被上诉人-通辽市北方投资有限责任公司|（2016）内05民辖终11号|https://www.tianyancha.com/lawsuit/35226839133d461ab21002b7bdbc93bb
2015-10-08|原告通辽市北方投资有限责任公司诉被告刘长武、第三人侯志敏确认合同无效纠纷民事裁定书|确认合同无效纠纷|原告-通辽市北方投资有限责任公司|（2015）霍民初字第1624号|https://www.tianyancha.com/lawsuit/ae9f66741cb611e6b554008cfae40dc0
2015-09-06|刘长武与北方公司企业借贷纠纷再审审查民事裁定书|企业借贷纠纷|被申请人-通辽市北方投资有限责任公司|（2015）通民申字第31号|https://www.tianyancha.com/lawsuit/7e34e338ecd54136925b4d1049bf7f8b