雨仁研究|冼春雷：银行贷款清收中民刑交叉问题的处理程序|-|商事诉讼仲裁。 从业以来专注于商事争议解决，为北京大唐燃料有限公司、北京华夏建龙矿业科技有限公司、内蒙古大唐国际克什克腾煤制天然气有限责任公司等单位提供常年法律服务。代理了中国黄金集团有限公司|-|微信公众号|-|2019年04月30日|-|https://news.tianyancha.com/detail/acd22ec0bf8c4f00b29864ca4e5ab89a8f3d043f.html
雨仁研究|冼春雷：银行视角下采矿权抵押担保的常见问题及解决对策|-|商事诉讼仲裁。 从业以来专注于商事争议解决，为北京大唐燃料有限公司、北京华夏建龙矿业科技有限公司、内蒙古大唐国际克什克腾煤制天然气有限责任公司等单位提供常年法律服务。代理了中国黄金集团有限公司|-|微信公众号|-|2019年04月29日|-|https://news.tianyancha.com/detail/392937a23494bea1f78f61074180ed57076de0de.html
雨仁研究|冼春雷、潘佳浔：办案札记-银行贷款清收案中成功查到被执行人2亿元财产|-|商事诉讼仲裁。 从业以来专注于商事争议解决，为北京大唐燃料有限公司、北京华夏建龙矿业科技有限公司、内蒙古大唐国际克什克腾煤制天然气有限责任公司等单位提供常年法律服务。代理了中国黄金集团有限公司|-|微信公众号|-|2019年04月28日|-|https://news.tianyancha.com/detail/74a1105d7e23247e3729fc5c4ad6a27bb99a8fa1.html
【公示】公示|-|31 | 国电建投内蒙古能源有限公司 32 | 白音华金山发电有限公司 33 | 内蒙古大唐国际克什克腾煤制天然气有限责任公司 34 | 内蒙古蒙电华能热电股份有限公司丰镇发电厂|-|微信公众号|-|2019年04月18日|-|https://news.tianyancha.com/detail/20df546a099dbd95e08c61212a3ae2d11c165332.html
内蒙古发改委发布重磅公示|-|31 | 国电建投内蒙古能源有限公司 32 | 白音华金山发电有限公司 33 | 内蒙古大唐国际克什克腾煤制天然气有限责任公司 34 | 内蒙古蒙电华能热电股份有限公司丰镇发电厂|-|微信公众号|-|2019年04月18日|-|https://news.tianyancha.com/detail/fc4f2d4b3db9d448b56dccd0f4a971d686281b74.html
群众反映企业环境信息公开不及时，内蒙古环保厅居然……|-|集团）热电有限责任公司| 否 赤峰| 59| 赤峰云铜有色金属有限公司| 否 赤峰| 60| 内蒙古大唐国际克什克腾煤制天然气有限责任公司| 否 赤峰| 62| 赤峰金剑铜业有限责任公司| 否|-|微信公众号|-|2017年06月21日|-|https://news.tianyancha.com/detail/7415e965edfa698f42e85348d139ab98f977830d.html