2018-12-11|大庆市百盛建筑安装工程有限公司与内蒙古森工集团兴安石油有限责任公司、周亮亮等买卖合同纠纷管辖民事裁定书|买卖合同纠纷|上诉人-大庆市百盛建筑安装工程有限公司被上诉人-内蒙古森工集团兴安石油有限责任公司,大庆金达石油科技装备有限公司,安达市天元运输有限责任公司|（2018）内07民辖终40号|https://www.tianyancha.com/lawsuit/91eb4cb301e811e9a8b47cd30ae00894
2018-11-22|内蒙古森工集团兴安石油有限责任公司与周亮亮、孙立达等买卖合同纠纷一审民事判决书|买卖合同纠纷|原告-内蒙古森工集团兴安石油有限责任公司被告-大庆市百盛建筑安装工程有限公司,大庆金达石油科技装备有限公司,安达市天元运输有限责任公司|（2018）内0782民初501号|https://www.tianyancha.com/lawsuit/f1f5959a835d4e4ba1193a81307b5bae
2018-10-30|杨树军与王国卿、曹洋民间借贷纠纷执行裁定书|民间借贷纠纷|被执行人-内蒙古森工集团兴安石油有限责任公司|（2018）内0782执恢90号|https://www.tianyancha.com/lawsuit/c3e259c0dbfb11e8a8b47cd30ae00894
2017-07-27|呼伦贝尔市奕通物流有限公司与内蒙古森工集团兴安石油有限责任公司租赁合同纠纷一审民事裁定书|租赁合同纠纷|原告-呼伦贝尔市奕通物流有限公司被告-内蒙古森工集团兴安石油有限责任公司|（2017）内0782民初436号|https://www.tianyancha.com/lawsuit/307157939da111e788a5008cfaf8725a
2017-02-09|杨树军与王国卿、曹洋民事执行实施类执行裁定书|民事执行|被执行人-内蒙古森工集团兴安石油有限责任公司|（2016）内0782执458号|https://www.tianyancha.com/lawsuit/d31fc3d361d34b75ac6b3ecb8cdd9f0c
2016-04-21|杨树军与王国卿等民间合伙协议纠纷一审民事判决书|合伙协议纠纷|被告-内蒙古森工集团兴安石油有限责任公司|（2016）内0782民初262号|https://www.tianyancha.com/lawsuit/af7f8f92182e42e8bc390cb84cb7fd23
2015-07-23|郑连华与王国卿房屋租赁合同纠纷一审民事判决书|房屋租赁合同纠纷|被告-内蒙古森工集团兴安石油有限责任公司|（2015）牙民初字第911号|https://www.tianyancha.com/lawsuit/4e7e5b5ccd574ebfb40460ca2d2e6604
2014-03-07|内蒙古森工集团兴安石油有限责任公司与牙克石市安兴矿业开发总公司买卖合同纠纷一审民事判决书|买卖合同纠纷|原告-内蒙古森工集团兴安石油有限责任公司被告-牙克石市安兴矿业开发总公司|牙民初字第733号|https://www.tianyancha.com/lawsuit/b9d14e341cbc11e6b554008cfae40dc0