今日多家企业调价，未来市场将会出现“硬缺口”！|-|。 1824元/吨， 下6元/吨 。 内蒙古通辽开鲁玉王玉米折标价格执行1920元/吨。 内蒙古呼伦贝尔东北阜丰生物科技有限公司玉米折标收购价格为1740元/吨。|-|微信公众号|-|6天前|-|https://news.tianyancha.com/detail/478fffeec356b16b2887ef976b1286d702a6a3bd.html
【玉米报价】5月31日玉米价格汇总！每日更新|-|14%水单价1940元/吨. 内蒙古通辽开鲁玉王玉米折标价格执行1920元/吨。 内蒙古呼伦贝尔东北阜丰生物科技有限公司玉米折标收购价格为1740元/吨。|-|微信公众号|-|10天前|-|https://news.tianyancha.com/detail/8f4b4db8b2dc685aab0453456b03e548a2d08b3c.html
【玉米报价】5月30日玉米价格汇总！每日更新|-|14%水单价1940元/吨. 内蒙古通辽开鲁玉王玉米折标价格执行1920元/吨。 内蒙古呼伦贝尔东北阜丰生物科技有限公司玉米折标收购价格为1740元/吨。|-|微信公众号|-|11天前|-|https://news.tianyancha.com/detail/386c25d1eda255936faee9aba9c8e469a7d94925.html
5月29日玉米拍卖成交均价1880元/吨（今日玉米价格）|-|14%水单价1940元/吨. 内蒙古通辽开鲁玉王玉米折标价格执行1920元/吨。 内蒙古呼伦贝尔东北阜丰生物科技有限公司玉米折标收购价格为1740元/吨。|-|微信公众号|-|13天前|-|https://news.tianyancha.com/detail/ae86ba04bc75e7acc038feb973b53097246812ab.html
【玉米】玉米继续上涨，南北玉米价格倒挂！|-|内蒙古通辽开鲁玉王玉米折标价格执行1910元/吨， 下 20元/吨* 。 内蒙古呼伦贝尔东北阜丰生物科技有限公司玉米折标收购价格为1740元/吨。|-|微信公众号|-|13天前|-|https://news.tianyancha.com/detail/785cf134ff574de8a1e5f995567bba9cc49d16cf.html
玉米继续上涨，南北玉米价格倒挂！|-|内蒙古通辽开鲁玉王玉米折标价格执行1910元/吨， 下 20元/吨* 。 内蒙古呼伦贝尔东北阜丰生物科技有限公司玉米折标收购价格为1740元/吨。|-|微信公众号|-|14天前|-|https://news.tianyancha.com/detail/b0733ab3c66f32c28c33ca30d29778fe848eff40.html
【玉米】玉米稳赚不亏，贸易商待价而沽！|-| 上20元/吨. 内蒙古通辽开鲁玉王玉米折标价格执行1930元/吨。 内蒙古呼伦贝尔东北阜丰生物科技有限公司玉米折标收购价格为1740元/吨。|-|微信公众号|-|14天前|-|https://news.tianyancha.com/detail/dece65f7999278472110bc3d49c68f92173071b7.html
深加工大喊“涨价”，山东最高挂牌价2130元/吨！影响上秋玉米价格因素抢先看|-|1950元／吨） 内蒙古通辽开鲁玉王玉米折标价格执行1930元/吨。 内蒙古呼伦贝尔东北阜丰生物科技有限公司玉米折标收购价格为1740元/吨。|-|微信公众号|-|2019年05月27日|-|https://news.tianyancha.com/detail/834a77b79934e2da885174b1e7ceb52462c8ea58.html
贸易商捂粮不卖，深加工大喊“涨价”（今日山东最高挂牌价2130元/吨）|-|1950元／吨） 内蒙古通辽开鲁玉王玉米折标价格执行1930元/吨。 内蒙古呼伦贝尔东北阜丰生物科技有限公司玉米折标收购价格为1740元/吨。|-|微信公众号|-|2019年05月26日|-|https://news.tianyancha.com/detail/1a8e8be56fcda8b2d9e3cb084d10a0a24a2150db.html
贸易商捂粮不卖，深加工大喊“涨价”（今日山东最高挂牌价2130元/吨）|-|1950元／吨） 内蒙古通辽开鲁玉王玉米折标价格执行1930元/吨。 内蒙古呼伦贝尔东北阜丰生物科技有限公司玉米折标收购价格为1740元/吨。|-|微信公众号|-|2019年05月26日|-|https://news.tianyancha.com/detail/5ec6c3b60729a6bb2f35ad48c6bd889ec8918bca.html
【玉米】最新玉米价格！临储玉米成交火爆，有粮的乐了！|-| 今日玉米价格： 内蒙古通辽开鲁玉王玉米折标价格执行1930元/吨。 内蒙古呼伦贝尔东北阜丰生物科技有限公司玉米折标收购价格为1740元/吨。|-|微信公众号|-|2019年05月25日|-|https://news.tianyancha.com/detail/b3d8eb5b0e265df61a42727ff092666f4a585c2e.html
非洲猪瘟疫苗获得重大进展，今日玉米价格突飞猛进，河北2000，山东2120！|-|1950元／吨） 内蒙古通辽开鲁玉王玉米折标价格执行1930元/吨。 内蒙古呼伦贝尔东北阜丰生物科技有限公司玉米折标收购价格为1740元/吨。|-|微信公众号|-|2019年05月25日|-|https://news.tianyancha.com/detail/8dd5c006b829950a64767b875064b241262412c5.html
【玉米】临储玉米成交火爆，有粮的又乐了！|-| 今日玉米价格： 内蒙古通辽开鲁玉王玉米折标价格执行1930元/吨。 内蒙古呼伦贝尔东北阜丰生物科技有限公司玉米折标收购价格为1740元/吨。|-|微信公众号|-|2019年05月23日|-|https://news.tianyancha.com/detail/281ac4705deeaf749343b337c8b1bbf66b072ce5.html
临储玉米成交火爆，有粮的又乐了！|-|请向下翻阅查看↓ ） 今玉米价格： 内蒙古通辽开鲁玉王玉米折标价格执行1930元/吨。 内蒙古呼伦贝尔东北阜丰生物科技有限公司玉米折标收购价格为1740元/吨。|-|微信公众号|-|2019年05月23日|-|https://news.tianyancha.com/detail/876b9793b95cc04749fcf78e5aa5db4e09e8173a.html
轮换粮打样，坐等临储玉米拍卖！|-|） 今玉米价格： 内蒙古通辽开鲁玉王 上20元/吨 ，玉米折标价格执行1910元/吨。 内蒙古呼伦贝尔东北阜丰生物科技有限公司 上40元/吨， 玉米折标收购价格为1740元/吨。|-|微信公众号|-|2019年05月22日|-|https://news.tianyancha.com/detail/b9f0d86bcce874b9c401ee3e203a0fec0b7bcbd5.html
满洲里海关关区企业自助打印首份原产地证书|-|赵莉莉 来源：满洲里海关 经过前期准备，5月20日上午，关区企业呼伦贝尔东北阜丰生物科技有限公司，自助打印出一份输往南非的非优惠原产地证书。这份证书是关区企业足不出户拿到的第一份带有底纹|-|微信公众号|-|2019年05月21日|-|https://news.tianyancha.com/detail/73355be2b253be6b20c33d5c99975d72dd5b805b.html
政策封堵下跌空间，15年临储玉米即将登场！|-|请向下翻阅查看↓ ） 今玉米价格： 内蒙古通辽开鲁玉王玉米折标价格执行1910元/吨。 内蒙古呼伦贝尔东北阜丰生物科技有限公司玉米折标收购价格为1700元/吨。|-|微信公众号|-|2019年05月21日|-|https://news.tianyancha.com/detail/489ca52d1e7a39a84642ba977c0c003ed080fe76.html
玉米出现跳伞行情，上涨结束了？|-|请向下翻阅查看↓ ） 今玉米价格： 内蒙古通辽开鲁玉王玉米折标价格执行1910元/吨。 内蒙古呼伦贝尔东北阜丰生物科技有限公司玉米折标收购价格为1700元/吨。|-|微信公众号|-|2019年05月20日|-|https://news.tianyancha.com/detail/9643440e347950759f344a5df59dc6b54e89b8f3.html
第十六届“阜丰杯”系列体育活动暨五一技术练兵大比武圆满完成|-|呼伦贝尔东北阜丰生物科技有限公司 第十六届“阜丰杯”系列体育活动 暨五一技术练兵大比武 圆满完成 比赛活动中，各单位积极组织，周密安排，确保了活动的顺利进行，全体运动员和参赛人员奋力拼搏，勇争第一,使|-|微信公众号|-|2019年05月10日|-|https://news.tianyancha.com/detail/fe96ddc28edbb750b246eeef435a2994c12a9370.html
市场│2019年第17周畜牧饲料市场一句话新闻|-|4月20日，呼伦贝尔市政府、扎兰屯市政府与阜丰集团成功签订了投资额达百亿元的呼伦贝尔东北阜丰生物科技有限公司三期项目合作意向书，5年内阜丰集团将在我市投资100亿元|-|微信公众号|-|2019年04月28日|-|https://news.tianyancha.com/detail/d56c21424b2a6ce8896c1295a2bb8a683880f041.html
投建│阜丰集团扎兰屯投资百亿元建设50万吨氨基酸项目；嘉吉7.5亿元扩容吉林玉米深加工项目……|-|此次推介会上，呼伦贝尔市政府、扎兰屯市政府与阜丰集团成功签订了投资额达百亿元的呼伦贝尔东北阜丰生物科技有限公司三期项目合作意向书，5年内阜丰集团将在我市投资100亿元|-|微信公众号|-|2019年04月24日|-|https://news.tianyancha.com/detail/9c1ced59a9849ea42a77af196cb69ae80e0a260c.html
呼伦贝尔东北阜丰生物科技有限公司招聘信息|-|70-3265599 15248749066 招邮箱：db_fufeng@163.com 2019年呼伦贝尔东北阜丰生物科技有限公司高校招聘|-|微信公众号|-|2019年03月14日|-|https://news.tianyancha.com/detail/b76095d257ae4e87acdb576e83a637640c691e14.html
群众反映企业环境信息公开不及时，内蒙古环保厅居然……|-|否 呼伦贝尔| 120| 呼伦贝尔安泰热电有限责任公司海拉尔热电厂| 否 呼伦贝尔| 121| 呼伦贝尔东北阜丰生物科技有限公司| 否 呼伦贝尔| 122| 大唐呼伦贝尔化肥有限公司| 否|-|微信公众号|-|2017年06月21日|-|https://news.tianyancha.com/detail/7415e965edfa698f42e85348d139ab98f977830d.html
前三季度西药类商品出口额微跌|-| 前三季度，在我国西药出口额排名前十的企业中，珠海联邦制药销售有限公司、呼伦贝尔东北阜丰生物科技有限公司、阿斯利康制药有限公司和山东新华制药股份有限公司异军突起|-|中国产业经济信息网|-|2016年11月25日|-|https://news.tianyancha.com/detail/aed2cc55b553bb9bc90ca533c7176dc2737853b4.html