2019-01-09|呼和浩特金川资源经济开发总公司与李解房屋买卖合同纠纷一审民事判决书|房屋买卖合同纠纷|原告-呼和浩特金川资源经济开发总公司|（2018）内0103民初795号|https://www.tianyancha.com/lawsuit/eb1d08dbf9af4d51a296057eaac60d94
2019-01-09|呼和浩特金川资源经济开发总公司与呼和浩特市和润工贸有限责任公司、牧仁房屋买卖合同纠纷一审民事判决书|房屋买卖合同纠纷|原告-呼和浩特金川资源经济开发总公司被告-呼和浩特市和润工贸有限责任公司|（2018）内0103民初794号|https://www.tianyancha.com/lawsuit/fabca1fe144411e9a8b47cd30ae00894
2019-01-09|呼和浩特金川资源经济开发总公司与呼和浩特市派奢羊绒制品有限公司房屋买卖合同纠纷一审民事判决书|房屋买卖合同纠纷|原告-呼和浩特金川资源经济开发总公司被告-呼和浩特市派奢羊绒制品有限公司|（2018）内0103民初793号|https://www.tianyancha.com/lawsuit/068a2a6d1903491fac6b3c5d19677ecf
2019-01-09|呼和浩特金川资源经济开发总公司与内蒙古方维电子科技（集团）有限责任公司买卖合同纠纷一审民事判决书|买卖合同纠纷|原告-呼和浩特金川资源经济开发总公司被告-内蒙古方维电子科技（集团）有限责任公司|（2018）内0103民初796号|https://www.tianyancha.com/lawsuit/92813d102bd14cc9964c485068b57b84
2015-04-02|呼和浩特金川资源经济开发总公司变更申请执行人一案执行裁定书|-|申请人-呼和浩特金川资源经济开发总公司,中国长城资产管理公司呼和浩特办事处被申请人-内蒙古金蒙电力创建总公司|（2015）呼执异字第00008号|https://www.tianyancha.com/lawsuit/22d883071cb611e6b554008cfae40dc0
2014-12-30|赵爱鱼与孙德平、呼和浩特金川资源经济开发总公司、中国人寿财产保险股份有限公司内蒙古自治区分公司呼和浩特中心支公司机动车交通事故责任纠纷一案一审民事判决书|机动车交通事故责任纠纷|被告-呼和浩特金川资源经济开发总公司,中国人寿财产保险股份有限公司内蒙古自治区分公司呼和浩特中心支公司|（2014）土左民初字第1111号|https://www.tianyancha.com/lawsuit/8e9b354e708149368f5b0c4d56225c46