内国土资采划字[2017]012号|划定矿区范围批复|-|-|内蒙古自治区国土资源厅|采矿权划定矿区范围申请
内经信投规字
〔2017〕262号|关于核准内蒙古高尔奇矿业有限公司阿巴嘎旗高尔旗矿区银铅锌多金属矿年采选60万吨银铅锌多金属矿石建设项目的通知|-|-|内蒙古自治区经济和信息化委员会|根据企业发展需要和地矿主管部门对内蒙古高尔奇矿业有限公司阿巴嘎旗高尔旗矿区矿权设置状况，内蒙古高尔奇矿业有限公司拟在该矿区域，实施银铅锌多金属矿石采、选建设项目，采矿方法为留矿全面采矿法、房柱采矿法、尾砂胶结充填采矿法，选矿工艺为浮选选矿工艺。主要建设内容为，构建采矿工业场地、选矿工业场地，配套废石场、尾矿库、火工库、仓储运输设施、采暖与通风除尘系统、环境保护设施、节能减排设施、安全生产设施、卫生消防设施，以及办公生活等相关公辅设施。
项目建成后，年采、选银铅锌矿石60万吨（采选2000吨/日）。
蒙H草临许字（2015）第8号|临时作业许可|-|-|生态保护局|探矿
C1500002017044210144330|采矿许可证|-|-|内蒙古自治区国土资源厅|采矿权新立申请
内草审字（2017）第361号|草原征用使用审核同意书|2017年09月12日|-|内蒙古自治区农牧业厅|征用使用草原审核