赤公消审字〔2015〕第0149号|建设工程消防设计审核意见书|-|-|赤峰市公安消防支队|内蒙古大唐国际克什克腾煤制天然气项目化工二期工程消防设计审核
赤公消验字〔2015〕第0161号|建设工程消防验收意见书|-|-|赤峰市公安消防支队|内蒙古大唐国际克什克腾旗煤制天然气项目化工一期建设工程部分项目消防验收
赤公消验字〔2015〕第0112号|建设工程消防验收意见书|-|-|赤峰市公安消防支队|内蒙古大唐国际克什克腾旗煤制天然气项目化工一期建设工程部分项目消防验收
赤公消验字〔2015〕第0007号|建设工程消防验收意见书|-|-|赤峰市公安消防支队|内蒙古大唐国际克什克腾煤制天然气项目动力
区建设工程消防验收
TS9215059-2021|特种设备许可证|2017年06月19日|2021年06月18日|内蒙古质监局|移动式压力容器充装许可
91150425564194197J001P|排污许可证|2017年06月20日|2020年06月19日|赤峰市环境保护局|污染物排放许可
-|关于内蒙古大唐国际克什克腾煤制天然气有限责任公司跨市转移危险废物的批复|2018年05月25日|2018年07月21日|赤峰市环境保护局|经与乌兰察布市环境保护局协商，同意内蒙古大唐国际克什克腾煤制天然气有限责任公司将生产过程中产生的废甲烷化合成催化剂约140吨（危废代码900-037-46）和废甲烷化脱硫槽催化剂约70吨（危废代码261-167-50）转移至内蒙古熙泰再生资源处理有限责任公司进行安全处置，运输单位为河南万里运输集团有限公司周口化学危险品分公司，转移有效期截止至2018年7月21日。
（蒙）WH安许证字［2015 000988号］|安全生产许可证|2015年04月14日|-|内蒙古自治区安全生产监督管理局|煤气、二氧化硫、粗酚、天然气、氧气、硫磺、氮气、石脑油、煤焦油