2018-12-28|鲁瑞花与内蒙古鸿远煤炭集团有限公司案外人执行异议之诉二审民事裁定书|案外人执行异议之诉|被上诉人-内蒙古鸿远煤炭集团有限公司|（2017）内06民终2088号|https://www.tianyancha.com/lawsuit/90a9b6ad140611e9a8b47cd30ae00894
2018-11-21|内蒙古鸿远煤炭集团有限公司孙三沟煤矿、钟现亮非法占用农用地罪一审刑事判决书|非法占用农用地罪|被告-内蒙古鸿远煤炭集团有限公司|（2018）内0622刑初248号|https://www.tianyancha.com/lawsuit/33a8a429ed2911e8a8b47cd30ae00894
2018-10-16|内蒙古鸿远煤炭集团有限公司与吕虎平借款纠纷一案执行裁定书|-|申请执行人-内蒙古鸿远煤炭集团有限公司|（2011）鄂中法执字第222号|https://www.tianyancha.com/lawsuit/31610dfcd88e11e8a8b47cd30ae00894
2018-10-13|中国华融资产管理股份有限公司内蒙古自治区分公司申请执行内蒙古鸿远煤炭集团有限公司、内蒙古伊东煤炭集团有限责任公司、李玉、倪虎兰、李志强、艾彦彤、李志慧裁定书|-|申请执行人-中国华融资产管理股份有限公司内蒙古自治区分公司,中国建设银行股份有限公司准格尔分行被执行人-内蒙古鸿远煤炭集团有限公司,内蒙古伊东煤炭集团有限责任公司|（2016）内06执205号|https://www.tianyancha.com/lawsuit/dec2d91dd8fd11e8a8b47cd30ae00894
2017-08-14|鲁瑞花与郝凌云、杨永生民事执行执行裁定书|民事执行|-|（2016）内0602执异218号|https://www.tianyancha.com/lawsuit/6468bcbc3d6d11e8b0207cd30ae00c08
2016-08-25|案外人鸿远煤炭集团执行异议一案执行裁定书|-|-|（2016）内0602执异218号|https://www.tianyancha.com/lawsuit/425d229e4d274014bcdd0c3e3a975f43
2016-03-07|内蒙古生力中伟爆破集团有限公司与内蒙古鸿远煤炭集团有限公司买卖合同纠纷一审民事判决书|买卖合同纠纷|原告-内蒙古生力中伟爆破集团有限公司被告-内蒙古鸿远煤炭集团有限公司|（2015）准民初字第3648号|https://www.tianyancha.com/lawsuit/ebdba36b361c43c7a17b7d902f76b414