1504005142|排污许可证|-|-|阿旗环保局|二氧化硫排放量0.123吨/年；氮氧化物排放量2.07吨/年.
赤公消审字〔2016〕第0086号|建设工程消防设计审核意见书|-|-|赤峰市公安消防支队|的巴林右旗元易生物质科技有限责
任公司消防审核
1504002016100027|交通行政许可（当场）决定书|-|-|赤峰市运输管理处|危险货物运输（2类1项（压缩天然气、液化天然气））、危险货物运输（3类（柴油））
建字第150421201500036|建设工程规划许可证|-|-|阿鲁科尔沁旗城镇管理局|工程规划许可：内蒙古阿鲁科尔沁旗农林废弃物生产沼气和有机肥循环化利用项目二期
赤公消验字〔2015〕第0113号|建设工程消防验收意见书|-|-|赤峰市公安消防支队|内蒙古阿鲁科尔沁旗农林废弃物生产沼气和有机肥循环利用项目建设工程消防验收
赤字150400010062 号|道路运输经营许可证|2016年10月31日|-|赤峰市运输管理处|危险货物运输（2类1项（压缩天然气（1971））））、冷冻液态天然气（1972））））））
-|消防许可证|2017年07月04日|-|赤峰市公安消防支队|赤峰市阿鲁科尔沁旗农村燃气管网项目胜龙村室内外燃气管道工程消防设计审核
1504969655|中华人民共和国海关报关单位注册登记证书|2017年03月17日|-|中华人民共和国满洲里海关|进出口货物收发货人