172亿！鄂尔多斯又签回大单子！|-|内蒙古东达蒙古王集团有限公司、鄂尔多斯市高新技术产业投资有限责任公司、鄂尔多斯市文化旅游投资集团有限公司负责人围绕各自主打产业依次进行项目推介。 现场我市7个旗区|-|微信公众号|-|2019年05月19日|-|https://news.tianyancha.com/detail/7eacb99f5b95b8284f6b98e9aae3378b812dfad4.html
2019第二届鄂尔多斯草原丝路合唱节通知|-|宁夏同心圆文化产业有限公司 环球合唱汇 协办单位：中国艺术职业教育学会 丝绸之路旅游名城联盟 鄂尔多斯市文化旅游投资集团有限公司 支持单位：鄂尔多斯市音乐家协会 浙江音乐学院|-|大众新闻网|-|2019年05月10日|-|https://news.tianyancha.com/detail/43a78df39ca65777b9507b4e0cbf5c9af1de6b54.html
【通知】2019年第二届鄂尔多斯草原丝路合唱节|-|宁夏同心圆文化产业有限公司 环球合唱汇 协单位 中国艺术职业教育学会 丝绸之路旅游名城联盟 鄂尔多斯市文化旅游投资集团有限公司 支单位 鄂尔多斯市音乐家协会 浙江音乐学院|-|微信公众号|-|2019年05月09日|-|https://news.tianyancha.com/detail/564073e9906ac989284ee5c4ebcf0b50c185b3d9.html
“创新发展我有良策”金点子征集令|-| 公背景 1、鄂尔多斯市文化旅游投资集团有限公司|-|微信公众号|-|2019年04月10日|-|https://news.tianyancha.com/detail/df959bf35a8b1ccea6e1fb66e91dc2bf28da75c8.html
首届鄂尔多斯光影艺术文化节举办|-| 本届活动由"鄂尔多斯市文化旅游投资集团有限公司、鄂尔多斯市东胜区国有资产监督管理委员会、东胜区文明办|-|海外网|-|2018年06月22日|-|https://news.tianyancha.com/detail/f64ad861a2d47cec5f8d19823ed3f29b15cff78b.html
【五四表彰】|-|李 鹏 鄂尔多斯市弘基炜业控股集团有限公司 刘星瑶 鄂尔多斯市弘基炜业控股集团有限公司 于 婷 鄂尔多斯市文化旅游投资集团有限公司 张贺祯 鄂尔多斯市文化旅游投资集团有限公司 帖子曜|-|微信公众号|-|2018年05月04日|-|https://news.tianyancha.com/detail/546855babc9b96decb9ee1a30727a0fc734fb316.html