2019-05-27|内蒙古多蒙德冶金化工集团有限公司与乌兰察布市医疗保险管理局等支付工伤待遇行政裁定书|-|原告-内蒙古多蒙德冶金化工集团有限公司|（2019）内0926行初2号|https://www.tianyancha.com/lawsuit/a41fc4e1c48449229277e7bd50ec0b25
2019-05-27|内蒙古多蒙德冶金化工集团有限公司与乌兰察布市医疗保险管理局、察右前旗医疗保险管理局支付工伤待遇行政裁定书|-|原告-内蒙古多蒙德冶金化工集团有限公司|（2019）内0926行初1号|https://www.tianyancha.com/lawsuit/3bf8620bc1dd4de5b35cae62f5b46e30
2019-05-27|内蒙古多蒙德冶金化工集团有限公司与察右前旗医疗保险管理局等支付工伤待遇行政裁定书|-|原告-内蒙古多蒙德冶金化工集团有限公司|（2019）内0926行初3号|https://www.tianyancha.com/lawsuit/2178d783c3ed46fea9e1b614883e26a5
2018-04-26|内蒙古多蒙德冶金化工集团有限公司与赵继文劳动争议一审民事判决书|劳动争议|原告-内蒙古多蒙德冶金化工集团有限公司|（2017）内0926民初480号|https://www.tianyancha.com/lawsuit/fabede08952911e8a8b47cd30ae00894
2017-09-24|王某交通肇事一审刑事判决书|交通肇事罪|原告-乌兰察布市东宝公路工程有限公司被告-内蒙古多蒙德冶金化工有限责任公司,四平市双龙运输有限公司|（2017）内0902刑初71号|https://www.tianyancha.com/lawsuit/6f6d2367b92e11e788a5008cfaf8725a
2015-10-22|内蒙古多蒙德冶金化工有限责任公司与张励心劳动争议纠纷二审民事判决书|劳动争议|上诉人-内蒙古多蒙德冶金化工有限责任公司|（2015）乌民终字第510号|https://www.tianyancha.com/lawsuit/ad5f172adadb4472ad4612ebfe29cb06
2015-07-06|内蒙古多蒙德冶金化工有限责任公司与张励心劳动争议纠纷一审民事判决书|劳动争议|原告-内蒙古多蒙德冶金化工有限责任公司|〔2015〕察前民初字第69号|https://www.tianyancha.com/lawsuit/abaa801a1cb511e6b554008cfae40dc0
2015-07-06|安徽盛安镜业有限公司申请公示催告一审民事裁定书|申请公示催告|申请人-安徽盛安镜业有限公司,内蒙古多蒙德冶金化工有限责任公司|（2015）无民催字第00003号|https://www.tianyancha.com/lawsuit/0bc998871cb611e6b554008cfae40dc0
2015-05-08|内蒙古多蒙德冶金化工有限责任公司申请公示催告民事判决书|申请公示催告|申请人-内蒙古多蒙德冶金化工有限责任公司|（2015）肥西民催字第00002号|https://www.tianyancha.com/lawsuit/b3aae6791cb911e6b554008cfae40dc0