2019-04-26|翟向民与赤峰诚鑫矿业有限责任公司返还原物纠纷一审民事裁定书|返还原物纠纷|原告-翟向民被告-赤峰诚鑫矿业有限责任公司|（2019）内0426民初292号|https://www.tianyancha.com/lawsuit/0b28d5d6a36a466ca3c0c0931fb52552
2018-12-17|翟向民与赤峰诚鑫矿业有限责任公司排除妨害纠纷二审民事判决书|排除妨害纠纷|被上诉人-赤峰诚鑫矿业有限责任公司|（2018）内04民终4402号|https://www.tianyancha.com/lawsuit/f7f933c6038711e9a8b47cd30ae00894
2018-12-17|翟向民与赤峰诚鑫矿业有限责任公司排除妨害纠纷一审民事判决书|排除妨害纠纷|被告-赤峰诚鑫矿业有限责任公司|（2016）内0426民初4600号|https://www.tianyancha.com/lawsuit/d32b5c0802d011e9a8b47cd30ae00894
2016-12-07|司发东诉张永君等劳务合同纠纷二审民事判决书|劳务合同纠纷|被上诉人-内蒙古亿腾矿山建设工程有限公司,赤峰诚鑫矿业有限责任公司|（2016）内04民终1998号|https://www.tianyancha.com/lawsuit/c5e74f73792643a2aaf5e89e2dfc76ac
2016-08-23|高玉升与翁牛特旗梧桐花镇利民商店等合同、无因管理、不当得利纠纷执行裁定书|不当得利纠纷|被执行人-赤峰诚鑫矿业有限责任公司|（2014）翁法执字第1187号|https://www.tianyancha.com/lawsuit/40b31f1bc180494ba2528cc7532f1e12
-|翁牛特旗梧桐花镇小营子村后窑村民组与赤峰诚鑫矿业有限责任公司土壤污染责任纠纷一审民事裁定书|土壤污染责任纠纷|被告-赤峰诚鑫矿业有限责任公司|（2014）翁民初字第72号|https://www.tianyancha.com/lawsuit/4bedaee54b074fb6a341c0e79b7acf63
-|司发东与内蒙古亿腾矿山建设工程有限公司等三人劳务合同纠纷一审民事判决书|劳务合同纠纷|被告-内蒙古亿腾矿山建设工程有限公司,赤峰诚鑫矿业有限责任公司|（2016）内0426民初630号|https://www.tianyancha.com/lawsuit/7d91d3fd72fd49c2b5afaa7a525ea0eb
-|翁牛特旗梧桐花镇小营子村后窑村 民组与赤峰诚鑫矿业有限责任公司土壤污染责任纠纷一审民事裁定书|土壤污染责任纠纷|被告-赤峰诚鑫矿业有限责任公司|（2014）翁民初字第72号|https://www.tianyancha.com/lawsuit/76ecfa413fc143e79d90803dbad52ffb