“扶贫车间”开启“造血式”增收新模式——先锋镇公庙村村企结对促脱贫见闻|-|先锋镇以提升贫困群众自我发展能力、激发脱贫动力为总抓手，狠抓就业扶贫和劳动力技能培训，积极协调内蒙古春雪羊绒有限公司党支部与公庙村党支部结成“党建联盟”，采取“支部+企业+农户”的模式，创办了|-|微信公众号|-|2019年05月27日|-|https://news.tianyancha.com/detail/12552454068da1afb07427eeb0561052c41edb28.html
【关注】先锋镇：党建引领促脱贫，“扶贫车间”加动能|-|创“党建联盟”，把好脱贫攻坚“方向盘”。 先锋镇党委政府立足资源和区域优势，组织协调公庙村党支部与内蒙古春雪羊绒有限公司党支部以及旗就业局党支部结成“党建联盟”，采取“支部+企业+农户+技能+产销|-|微信公众号|-|2019年05月07日|-|https://news.tianyancha.com/detail/1b2fc7d96f36c82a99c1e93d4b9c94363eaf56e6.html
内蒙古自治区人民政府发布通知|-|426.内蒙古美洋洋食品有限公司 427.内蒙古小肥羊食品有限公司 428.内蒙古春雪羊绒有限公司 429.内蒙古全得妙食品有限责任公司|-|澎湃新闻网|-|2019年05月07日|-|https://news.tianyancha.com/detail/821505ecc310c3a4744dee8287d42c5ddb72c40a.html
临河区：绒毛产业扶贫大有可为|-|其中巴彦淖尔市兴盛工贸有限公司、巴彦淖尔天马羊绒制品有限公司、内蒙古春雪羊绒有限公司、内蒙古圣绒羊绒科技有限公司、维信（内蒙古）羊绒集团有限公司5家企业获此殊荣|-|微信公众号|-|2019年03月28日|-|https://news.tianyancha.com/detail/2484ba1c4f9b558e15d1e5a097332cc3a906c419.html
天赋河套•“绒”通世界——临河区敞开怀抱，接纳四方宾朋|-|内蒙古大兴羊绒制品有限公司、维信羊绒集团、临河区绒纺扶贫产业园、内蒙古浩森羊绒制品有限公司、内蒙古春雪羊绒有限公司、临河区绒纺产业展览馆等地进行现场观摩。临河区委副书记、政府区长张如红|-|微信公众号|-|2019年03月28日|-|https://news.tianyancha.com/detail/765cb3d0768b86de91277a4afed5b603e1ad847f.html
天赋河套“绒”通世界|第二十六届全国绒毛会议在临河区举行|-|巴彦淖尔金天阳纺织科技有限公司、内蒙古大兴羊绒制品有限公司、维信羊绒集团、临河区绒纺扶贫产业园、内蒙古春雪羊绒有限公司、内蒙古浩森羊绒制品有限公司、绒毛展馆、巴彦淖尔市农产品展览馆进行观摩|-|微信公众号|-|2019年03月26日|-|https://news.tianyancha.com/detail/92cf63a2a5914e16713fb908cf8925d156b2a8c4.html
首批“内蒙古名片+价值品牌”企业入围榜单|-|21.杭锦后旗和平面业有限责任公司 22.内蒙古王爷地苁蓉生物有限公司 23.内蒙古春雪羊绒有限公司 24.维信（内蒙古）羊绒集团有限公司 25.内蒙古巴运汽车运输有限责任公司|-|微信公众号|-|2015年09月29日|-|https://news.tianyancha.com/detail/727a2d010ce6ec30632ded8d70b80101f982c703.html