2019-05-14|王海军与方军合伙协议纠纷一审民事判决书|合伙协议纠纷|原告-王海军,证明被告-赵军和,伙食费,误工费,支付,方军|（2018）内0822民初1946号|https://www.tianyancha.com/lawsuit/2bee71a52a2146f2a522d48153767ed6
2019-05-14|王海军与赵军合伙协议纠纷一审民事判决书|合伙协议纠纷|原告-王海军被告-赵军和,赵军,伙食费,误工费,支付|（2018）内0822民初1945号|https://www.tianyancha.com/lawsuit/06b835084aba4727a47b9207cd044c9a
2019-02-14|杨会平与磴口县德音嘉禾农贸专业合作社、巴彦淖尔市圣牧高科生态草业有限公司委托合同纠纷一审民事判决书|委托合同纠纷|被告-磴口县德音嘉禾农贸专业合作社,巴彦淖尔市圣牧高科生态草业有限公司|（2018）内0822民初2166号|https://www.tianyancha.com/lawsuit/8fa8c164b94b4c218cff647e204e3988
2019-02-14|张和羔与磴口县德音嘉禾农贸专业合作社、巴彦淖尔市圣牧高科生态草业有限公司委托合同纠纷一审民事判决书|委托合同纠纷|被告-磴口县德音嘉禾农贸专业合作社,巴彦淖尔市圣牧高科生态草业有限公司|（2018）内0822民初2179号|https://www.tianyancha.com/lawsuit/8885cda8a05e4bda8252127ae2d5ca90
2018-09-14|霍五十一与巴彦淖尔市圣牧高科生态草业有限公司承揽合同纠纷一审民事裁定书|承揽合同纠纷|被告-巴彦淖尔市圣牧高科生态草业有限公司|（2018）内0822民初953号|https://www.tianyancha.com/lawsuit/10d217c0982a43549186960ad207d631
2015-08-12|何兴亮与巴彦淖尔市圣牧高科生态草业有限公司运输合同纠纷一审民事判决书|运输合同纠纷|被告-巴彦淖尔市圣牧高科生态草业有限公司|（2015）磴交初字第101号|https://www.tianyancha.com/lawsuit/49d0b7d61cb611e6b554008cfae40dc0