2018-12-29|申请执行人中国建设银行股份有限公司鄂尔多斯分行与被执行人内蒙古呼铁对外经济技术合作集团有限责任公司执行案件中被执行人内蒙古呼铁对外经济技术合作集团有限责任公司申请执行个异议一案执行裁定书|-|申请人-内蒙古呼铁对外经济技术合作集团有限责任公司被申请人-中国建设银行股份有限公司鄂尔多斯分行,乌审旗蒙能物流有限责任公司,蒙能国际能源开发有限公司,内蒙古宏基路桥投资发展有限公司|（2018）内06执异77号|https://www.tianyancha.com/lawsuit/3a065bdd0c2111e9a8b47cd30ae00894
2018-10-13|中国建设银行股份有限公司鄂尔多斯分行申请执行乌审旗蒙能物流有限责任公司、蒙能国际能源开发有限公司、内蒙古呼铁对外经济技术合作集团有限责任公司、内蒙古宏基路桥投资发展有限公司裁定书|-|申请执行人-中国建设银行股份有限公司鄂尔多斯分行被执行人-乌审旗蒙能物流有限责任公司,蒙能国际能源开发有限公司,内蒙古呼铁对外经济技术合作集团有限责任公司,内蒙古宏基路桥投资发展有限公司|（2016）内06执26号|https://www.tianyancha.com/lawsuit/296d124eda7211e8a8b47cd30ae00894
2018-01-10|王丽与王俊飞、陈瑜民间借贷纠纷一审民事判决书|民间借贷纠纷|-|（2016）内0602民初4489号|https://www.tianyancha.com/lawsuit/3a6513b902c111e881ec008cfaf870e0
2017-11-14|王丽与王俊飞、陈瑜民间借贷纠纷二审民事裁定书|民间借贷纠纷|-|（2017）内06民终1334号|https://www.tianyancha.com/lawsuit/7f98fec90a4a11e881ec008cfaf870e0
2017-06-30|北京中金华泰投资有限公司与内蒙古宏基路桥投资发展有限公司等公证债权文书其他执行裁定书|-|申请执行人-北京中金华泰投资有限公司异议人-北京中加阳光能源技术（集团）有限公司,内蒙古宏基路桥投资发展有限公司,内蒙古宏基房地产开发有限公司,蒙能国际能源开发有限公司,乌审旗蒙能物流有限责任公司|（2015）朝执异字第00124号|https://www.tianyancha.com/lawsuit/6e5145a202b811e881ec008cfaf870e0
2017-03-24|北京中金华泰投资有限公司等与蒙能国际能源开发有限公司等执行裁定书|-|申请执行人-北京中金华泰投资有限公司异议人-北京中加阳光能源技术（集团）有限公司,内蒙古宏基路桥投资发展有限公司,内蒙古宏基房地产开发有限公司,蒙能国际能源开发有限公司,乌审旗蒙能物流有限责任公司|2015年朝执异字第00124号|https://www.tianyancha.com/lawsuit/e880b9086074454986b104e8f3e42466
2016-10-19|北京中金华泰投资有限公司等与北京中加阳光能源技术（集团）有限公司等执行裁定书|-|申请执行人-北京中金华泰投资有限公司异议人-北京中加阳光能源技术（集团）有限公司,内蒙古宏基路桥投资发展有限公司,内蒙古宏基房地产开发有限公司,蒙能国际能源开发有限公司,乌审旗蒙能物流有限责任公司|2015年朝执异字第00121号|https://www.tianyancha.com/lawsuit/ec33a1f6c055415aa88a70256449b66b
2016-04-25|北京中金华泰投资有限公司等公证债权文书一案|-|申请执行人-北京中金华泰投资有限公司异议人-北京中加阳光能源技术（集团）有限公司,内蒙古宏基路桥投资发展有限公司,内蒙古宏基房地产开发有限公司,蒙能国际能源开发有限公司,乌审旗蒙能物流有限责任公司|（2015）朝执异字第00121号|https://www.tianyancha.com/lawsuit/577b7532afd64d2794eea1a02f30a854