2019-03-29|乌兰察布市自来水公司与乌兰察布市集宁区春晖物业服务有限公司供用水合同纠纷一审民事裁定书|供用水合同纠纷|原告-乌兰察布市自来水公司被告-乌兰察布市集宁区春晖物业服务有限公司|（2018）内0902民初2826号|https://www.tianyancha.com/lawsuit/2aed710da4be4133a7f7ad4ca0f47fe5
2018-08-22|乌兰察布市集宁区自来水公司与乌兰察布市锦泓房地产开发有限公司、内蒙古时代佳欣物业服务有限公司供用水合同纠纷一审民事裁定书|供用水合同纠纷|原告-乌兰察布市集宁区自来水公司被告-乌兰察布市锦泓房地产开发有限公司,内蒙古时代佳欣物业服务有限公司|（2018）内0902民初1169号|https://www.tianyancha.com/lawsuit/5a1d5830bd7011e8a8b47cd30ae00894
2018-08-22|集宁区鑫隆源百货超市与乌兰察布市集宁区自来水公司、乌兰察布市乌兰商厦有限责任公司财产损害赔偿纠纷一审民事判决书|财产损害赔偿纠纷|原告-集宁区鑫隆源百货超市被告-乌兰察布市集宁区自来水公司,乌兰察布市乌兰商厦有限责任公司|（2017）内0902民初1510号|https://www.tianyancha.com/lawsuit/600fcdffbd7011e8a8b47cd30ae00894
2017-08-15|冯某危险驾驶刑事一审判决书|危险驾驶罪|被告-乌兰察布市集宁区自来水公司|（2015）集刑初字第186号|https://www.tianyancha.com/lawsuit/220762bf1d6e11e881ec008cfaf870e0
2016-09-07|乌兰察布市集宁区自来水公司与乌兰察布市天筑百利家居有限公司、内蒙古天筑伟业房地产开发有限公司合同纠纷执行裁定书|合同纠纷|申请执行人-乌兰察布市集宁区自来水公司被执行人-开发有限公司,乌兰察布市天筑百利家居有限公司|（2016）内0902执302号|https://www.tianyancha.com/lawsuit/e51ab84f23654721993c3665dbf43892
2015-05-28|冯某危险驾驶一审刑事判决书|危险驾驶罪|被告-乌兰察布市集宁区自来水公司|（2015）集刑初字第186号|https://www.tianyancha.com/lawsuit/06c4ac4c1cb711e6b554008cfae40dc0
2015-01-21|赵立军诈骗案二审刑事裁定书|诈骗罪|上诉人-乌兰察布市集宁区自来水公司|（2014）乌刑终字第77号|https://www.tianyancha.com/lawsuit/a5420b891cbc11e6b554008cfae40dc0