包银监复〔2017〕25号|包头银监分局关于同意固阳县农村信用合作联社白灵淖信用社更名的批复|2017-04-28|-|包头市银监局包头分局|"同意固阳县农村信用合作联社白灵淖信用社变更名称为固阳县农村信用合作联社怀朔信用社。
你联社应自文到之日起10日内将白灵淖信用社的《金融许可证》上缴我分局，并做好金融许可证更换及社会公告工作。
"... 更多
包银监复〔2017〕27号|包头银监分局关于同意固阳县农村信用合作联社诚信储蓄所终止营业的批复|2017-05-05|-|包头市银监局包头分局|"同意固阳县农村信用合作联社诚信储蓄所终止营业，其业务归并至固阳县农村信用合作联社营业部。
你联社应自文到之日起10日内将诚信储蓄所的《金融许可证》上缴我分局，并做好诚信储蓄所终止营业后的业务和人员的合并、移交及社会公告工作。
"... 更多
包银监复〔2017〕28号|包头银监分局关于同意固阳县农村信用合作联社包白路储蓄所终止营业的批复|2017-05-05|-|包头市银监局包头分局|同意固阳县农村信用合作联社包白路储蓄所终止营业，其业务归并至固阳县农村信用合作联社公益民信用社。... 更多
包银监复〔2017〕36号|包头银监分局关于同意固阳县农村信用合作联社变更住所的批复|2017-05-16|-|包头市银监局包头分局|同意固阳县农村信用合作联社变更住所，变更后地址为固阳县新建路北阿拉塔街东广众国际中心金融综合楼。... 更多
包银监复〔2017〕37号|包头银监分局关于同意固阳县农村信用合作联社金马信用社变更住所的批复|2017-05-31|-|包头市银监局包头分局|同意固阳县农村信用合作联社金马信用社搬迁至固阳县农村信用合作联社原营业部。... 更多
包银监复〔2017〕82号|包头银监分局关于核准史永华银行业金融机构高级管理人员任职资格的批复|2017-12-28|-|包头市银监局包头分局|核准史永华固阳县农村信用合作联社理事、理事长任职资格。... 更多
包银监复〔2018〕12号|包头银监分局关于核准史晓东银行业金融机构高级管理人员任职资格的批复|2018-05-22|-|包头市银监局包头分局|核准史晓华固阳县农村信用合作联社主任任职资格。... 更多
00341578|中华人民共和国金融许可证|2009-05-22|-|中国银行业监督管理委员会包头监管分局|许可该机构经营中国银行业监督管理委员会依照有关法律、行政法规和其他规定批准的业务，经营范围以批准文件所列的为准... 更多