2018-10-01|安阳福莱尔钢板仓工程有限公司与赤峰华远酒业有限公司定作合同纠纷一审民事裁定书|定作合同纠纷|原告-安阳福莱尔钢板仓工程有限公司被告-赤峰华远酒业有限公司|（2018）豫0506民初1701号|https://www.tianyancha.com/lawsuit/2779c3f6d79111e8a8b47cd30ae00894
2017-07-14|赤峰华远酒业有限公司与张某2劳动争议二审民事判决书|劳动争议|上诉人-赤峰华远酒业有限公司|（2016）内04民终4452号|https://www.tianyancha.com/lawsuit/75a61e1c37bc11e8b0207cd30ae00c08
2017-07-14|赤峰华远酒业有限公司与于某劳动争议二审民事判决书|劳动争议|上诉人-赤峰华远酒业有限公司|（2016）内04民终4453号|https://www.tianyancha.com/lawsuit/5d408519416411e8b0207cd30ae00c08
2017-07-14|赤峰华远酒业有限公司与周某劳动争议二审民事判决书|劳动争议|上诉人-赤峰华远酒业有限公司|（2016）内04民终4454号|https://www.tianyancha.com/lawsuit/a42f31403ce611e8b0207cd30ae00c08
2017-07-07|赤峰华远酒业有限公司与姚某一审民事裁定书|-|原告-赤峰华远酒业有限公司|（2017）内0426民初946号|https://www.tianyancha.com/lawsuit/54528b1c9e7211e788a5008cfaf8725a
2016-06-24|赤峰华远酒业有限公司与宋国兴、中国人民财产保险股份有限公司翁牛特旗支公司机动车交通事故责任纠纷一审民事判决书|机动车交通事故责任纠纷|原告-赤峰华远酒业有限公司被告-中国人民财产保险股份有限公司翁牛特旗支公司|（2016）内0426民初2641号|https://www.tianyancha.com/lawsuit/fe22994780724e7fb479f6b571ad9197