宜信普惠为酸奶世家提供动力支持，陪伴实体经济共同发展|-|人们一定会想到具有完整的酸奶产业链的现代化企业雪原乳业有限公司。作为乳业的龙头企业，雪原坚持只做好酸奶，打造完整的酸奶产业链，致力于成为专业生产凝固型酸奶的现代化企业。目前|-|大众新闻网|-|3天前|-|https://news.tianyancha.com/detail/1001f651c88e3a8b0748d59216f2a3c899fe70dc.html
辽宁省市场监管局：7批次乳制品样品抽检不合格|-|| 2018/10/29 | 乳制品 | 黑龙江省华测检测技术有限公司 | 547 | 乌兰察布市集宁雪原乳业有限公司 | 内蒙古乌兰察布市集宁区208国道南侧 ||-|中国质量新闻网|-|5天前|-|https://news.tianyancha.com/detail/a7ad1592aa8551bebd1c74e2ea6ab9b6d71ffd72.html
30多年，只为做好一瓶草原酸奶！这家乳企聚焦差异化，打造乳业新格局！|-|除了这次拿到两个大奖，还有四件非常重要的事情： 第一件事是 1998 年，我们成立了乌兰察布市集宁雪原乳业有限公司，这是兰格格乳业的前身，企业正式走上品牌化、公司化的发展道路。 第二件事是|-|微信公众号|-|11天前|-|https://news.tianyancha.com/detail/a1bfc25e5d8c28b3f0e532b61c3f504eecf143bd.html
集宁交管大队组织民警走访排查辖区重点车辆运输企业|-|提高驾驶人安全驾驶意识，5月22日，集宁交管大队副大队长闫挺带领郊区中队民警深入雪原乳业、三星实业等公司进行了走访排查。 在走访过程中，民警与各企业负责人进行座谈|-|微信公众号|-|2019年05月23日|-|https://news.tianyancha.com/detail/833ab36398e7b7b113a519a164ef7d0b963c9113.html
做百年老店，我行你也行！|-|** | 宜信 编 | 宜信君 在乌兰察布市集宁区城北的208国道边，远远就能看到“乌兰察布市集宁雪原乳业有限公司（简称：雪原乳业）”“雪原生态牧场”两个白色建筑群分立在马路两侧。其中|-|微信公众号|-|2019年05月15日|-|https://news.tianyancha.com/detail/feb845b6bdc8d84ac681ab7f55007e1d93cd8aae.html
天津秋糖高端休闲食品专区|赛象酒店，大牌云集，有你好看|-|山东青州顺丰食品有限公司 广东益瑞生物科技有限公司 广东奇能食品厂 广东绿野食品有限公司 内蒙古兰格格乳业有限公司 天津恩来顺食品有限公司 沂水县和润食品厂 乌鲁木齐华美都食品有限公司|-|微信公众号|-|2019年05月15日|-|https://news.tianyancha.com/detail/884848d87e9b994a8500e53fb38b25f9edb1718e.html
乌兰察布市公交部分线路延长营运时间的公告|-|且形成常态化。 延长线路如下： 2 路 起始站：雪原乳业， 终点站：三号地， 途径：民建大街；恩和大街；乌兰路；怀远北路；怀远南路。|-|微信公众号|-|2019年05月09日|-|https://news.tianyancha.com/detail/902a668b42d2ea047cd45b3b611b734c2585c847.html
内蒙古自治区人民政府发布通知|-|310.乌兰察布市宏强养殖有限责任公司 311.内蒙古马志全清真食品有限公司 ※312.内蒙古兰格格乳业有限公司 313.内蒙古嘉恒农业科技有限责任公司 314.内蒙古兴大业（集团|-|澎湃新闻网|-|2019年05月07日|-|https://news.tianyancha.com/detail/821505ecc310c3a4744dee8287d42c5ddb72c40a.html
低脂、代餐，营养健康！蒙牛、光明、兰格格、完达山、同福推新品~|-|上蔬永辉、苏宁小店等平台，在江苏、浙江、上海、安徽等区域均有销售。 兰格 · 蒙餐酸奶 生企业： 内蒙古兰格格乳业有限公司 产规格： 1kg / 桶 产介绍： 由浓郁焦香的蒙古熟酸奶|-|微信公众号|-|2019年05月04日|-|https://news.tianyancha.com/detail/142d7ef04d7efde80ef600e76065fb8026a4f333.html
小长假|时间里的天津卫|-|广东益瑞生物科技有限公司 广东奇能食品厂 江苏茂兴食品有限公司 广东绿野食品有限公司 内蒙古兰格格乳业有限公司 沂水县和润食品厂 乌鲁木齐华美都食品有限公司 汕头市好又佳食品有限公司|-|微信公众号|-|2019年04月30日|-|https://news.tianyancha.com/detail/08ecd7541060eacc6ceda02972f252c9f066d6bb.html
辽宁省抽检4大类食品398批次样品不合格7批次|-|| 2018/9/5 | 乳制品 | 通标标准技术服务有限公司大连分公司 | 379 | 乌兰察布市集宁雪原乳业有限公司 | 内蒙古乌兰察布市集宁区208国道南侧 ||-|中国质量新闻网|-|2019年04月30日|-|https://news.tianyancha.com/detail/8af124da36ca5d99a8206ef680cb2d1d600114c3.html
特邀嘉宾—侯军伟|2019（首届）中国食品供应链大会|-|皇氏乳业、琴牌乳业、佳宝乳业、白帝乳业、雪兰乳业、欧亚乳业、来思尔乳业、益膳房乳业、三色鸽乳业、雪原乳业、海河乳业、菊乐、卫岗、广泽乳业等国内近百家乳品企业。 专注乳品行业品牌战略、产品定位|-|微信公众号|-|2019年04月29日|-|https://news.tianyancha.com/detail/7649eb70a639d068a34fcda62bbcd74176a25ddf.html
2019年内蒙古自治区西部地区退役军人就业专场招聘会现场大会参会企业名录|-|展位210 鄂尔多斯市沣美商业管理有限公司 展位211 内蒙古亿利化学工业有限公司 展位212 内蒙古兰格格乳业有限公司 展位213 鄂尔多斯市金港湾国际赛车城发展有限公司 展位214|-|微信公众号|-|2019年04月24日|-|https://news.tianyancha.com/detail/21fe9344a56d3bd3d8b4ed49d2b025ff409ca5ef.html
金桥商学院公开课预告|-|哆吉客餐饮、中国运酒集团、海坤汽修集团、巴夫乐集团、牧草莉丝、博联晟投集团、中乐古建集团、雪原乳业、中港石油、嘻唰唰餐饮集团、娜兰珍妮服饰等。 课时间 | 2019年4月23日08：30—|-|微信公众号|-|2019年04月15日|-|https://news.tianyancha.com/detail/a5e39b29837ef74b551d7410c609460d4b762dba.html
2019新征程---热烈祝贺北京达尔新材科技有限公司成立|-|食品医药、汽车制造、房地产建筑等，如同方股份、七星集团、京东方、今麦郎、全聚德、北冰洋、雪原乳业、伊利集团、中国航天、北京奔驰、北京现代、万达广场、财富广场等，最近又中标北京新机场项目。|-|微信公众号|-|2019年04月03日|-|https://news.tianyancha.com/detail/630af796aa78d1ad0d578cac28864618d91142a0.html
第三届中国规模化农场营养管理大会暨国际马铃薯大会参会索引！|-|集宁南站 行车约11分钟，距离约5.7公里 步行至南站，乘坐2路（雪原乳业-北京八中），经过8站，在一中西门下车步行至乌兰察布厚德大酒店 集宁站 行车约15分钟|-|微信公众号|-|2019年04月03日|-|https://news.tianyancha.com/detail/a7ca888c87999060dc72c4dbe900ab0475b501dc.html
爱心传递●乌兰察布文化旅游扶贫专场公益晚会精彩再现！观看人数20W+点赞80W+++|-|内蒙古阴山优麦食品有限公司、内蒙古溢源醋业有限责任公司、内蒙古马志全清真食品有限公司、内蒙古兰格格乳业有限公司、内蒙古塞主粮食品科技开发有限公司、内蒙古蒙花生物科技有限责任公司|-|微信公众号|-|2019年03月29日|-|https://news.tianyancha.com/detail/e27078615566b74b9251cda32f3fda041455edfb.html
扎根草原的本土酸奶“兰格格”——回访李克强总理考察集宁区足迹之兰格格乳业|-|总理拿起 "兰格格"酸奶驻足询问。2月12日，笔者一行回访了内蒙古兰格格乳业有限公司。 自家生产的商品能够得到总理的青睐，让兰格格乳业有限公司的员工们兴奋不已|-|中国财经信息网|-|2019年02月28日|-|https://news.tianyancha.com/detail/24bb04c85443f8420f75238d7b12c833ff85b297.html
梯内电视成广告新宠，新潮传媒究竟以何优势引领呼和浩特市场？|-|成为影响城市消费的新势力，已成功为麦当劳、京东、思念食品、金牌厨柜等全国知名品牌，以及呼白甘草酒、雪原乳业、维多利国际、新华联雅园等当地品牌提供社区媒体服务，助力各大品牌在呼和浩特营销。|-|中国产业经济信息网|-|2018年12月19日|-|https://news.tianyancha.com/detail/10558e964db490847ef9912c68ab2bfa07b7731e.html
传承草原品质，振兴酸奶产业首届中国草原酸奶大会在乌兰察布召开|-|新乳业的智慧支持下，由乌兰察布市人民政府、集宁区人民政府主办，乌兰察布市集宁雪原乳业有限公司和乌兰察布市工商业联合会、乌兰察布市总商会共同承办。乌兰察布市委书记杜学军|-|大众新闻网|-|2018年06月26日|-|https://news.tianyancha.com/detail/573b768ebfe6d86fa2a592971c15a65620542898.html
第九届中国乳业营销论坛杭州召开|-|什么样的核心竞争力才不容易被模仿》的报告。他说，首先，抄不走的才是好产品。对优诺酸奶的异军突起、雪原乳业的发展之路、长富乳业的"活路"等成功案例，能够得出一个结论|-|中国产业经济信息网|-|2017年02月07日|-|https://news.tianyancha.com/detail/d0589f8c7fd30130fb61871a732e8c3b9507bb25.html
2016提振中国乳业开拓新路径|-|近两年天香其他高毛利产品开始在北京进行销售，如北京记忆、活润酸牛奶、味蕾游记等；内蒙古雪原乳业2014年凭借差异化产品"兰格格"，实现"零知名度乳企进攻特大城市"|-|中国产业经济信息网|-|2016年01月29日|-|https://news.tianyancha.com/detail/58c7b5893a1ac3f6d54219ebf59cc976b7325c58.html