2018-12-29|鄂托克旗蒙晨投资集团有限责任公司申请执行鄂托克旗海龙农业开发有限责任公司借款合同纠纷一案结案通知书|借款合同纠纷|申请人-鄂托克旗蒙晨投资集团有限责任公司|（2018）内0624执保255号|https://www.tianyancha.com/lawsuit/f68d00b8354f48dd840291335a2ff087
2018-12-29|鄂尔多斯银行申请执行鄂托克旗盛然螺旋藻养殖有限责任公司等借款合同纠纷执行裁定书|借款合同纠纷|申请人-鄂尔多斯银行股份有限公司鄂托克旗支行被执行人-鄂托克旗盛然螺旋藻养殖有限责任公司,鄂托克旗蒙晨投资集团有限责任公司|（2018）内0624执1821号|https://www.tianyancha.com/lawsuit/6e1c0ec20e8111e9a8b47cd30ae00894
2018-10-13|中融国际信托有限公司申请执行鄂托克旗鑫洲供热有限责任公司、鄂托克旗蒙晨投资集团有限责任公司、鄂托克旗蒙晨草原现代农牧业发展有限责任公司裁定书|-|申请执行人-中融国际信托有限公司被执行人-鄂托克旗鑫洲供热有限责任公司,鄂托克旗蒙晨投资集团有限责任公司,鄂托克旗蒙晨草原现代农牧业发展有限责任公司|（2016）内06执222号|https://www.tianyancha.com/lawsuit/b41797e9d85111e8a8b47cd30ae00894
2018-09-25|包商银行股份有限公司乌海分行与鄂托克旗鑫洲供热有限责任公司、鄂托克旗蒙晨投资集团有限责任公司等借款合同纠纷一审民事判决书|借款合同纠纷|原告-包商银行股份有限公司乌海分行被告-鄂托克旗鑫洲供热有限责任公司,鄂托克旗蒙晨投资集团有限责任公司,鄂托克前旗鑫洲供热有限责任公司|（2018）内03民初4号|https://www.tianyancha.com/lawsuit/7a09ec24cfe511e8a8b47cd30ae00894
2017-12-27|包商银行股份有限公司乌海分行与鄂托克前旗鑫洲供热有限责任公司、谢巨荣、罗瑞霞、鄂托克旗蒙晨投资集团有限责任公司借款合同纠纷一案执行裁定书|借款合同纠纷|申请执行人-包商银行股份有限公司乌海分行被执行人-鄂托克前旗鑫洲供热有限责任公司,鄂托克旗蒙晨投资集团有限责任公司|（2017）内0302执1631号|https://www.tianyancha.com/lawsuit/c05bccbb3e5311e8b0207cd30ae00c08
2016-12-16|包商银行股份有限公司乌海分行与鄂托克前旗鑫洲供热有限责任公司、鄂托克旗蒙晨投资集团有限责任公司等借款合同纠纷一审民事判决书|借款合同纠纷|原告-包商银行股份有限公司乌海分行被告-鄂托克前旗鑫洲供热有限责任公司,鄂托克旗蒙晨投资集团有限责任公司|（2016）内0302民初3541号|https://www.tianyancha.com/lawsuit/9d569d4cecef4791a3b9c6c5ba8ff2f5