2019-03-15|刘某甲与王某1交通肇事罪二审刑事裁定书|交通肇事罪|被告-内蒙古坤元太和农业科技有限公司|（2016）内25刑终72号|https://www.tianyancha.com/lawsuit/95604f9eeecc4897890435b2d55bb9e3
2019-01-15|何琦磊与内蒙古坤元太和农业科技有限公司提供劳务者受害责任纠纷二审民事裁定书|提供劳务者受害责任纠纷|被上诉人-内蒙古坤元太和农业科技有限公司|（2016）内25民终1347号|https://www.tianyancha.com/lawsuit/82b6ea70e7294bc3b7c1f150f645a13d
2018-01-08|邢燕东、李长宝与内蒙古坤元太和农业科技有限公司、左玉峰追偿权纠纷一审民事裁定书|追偿权纠纷|被告-内蒙古坤元太和农业科技有限公司|（2017）内2530民初1096号|https://www.tianyancha.com/lawsuit/d859acf10cb511e881ec008cfaf870e0
2017-07-07|内蒙古坤元太和农业科技有限公司与马宪奎、马庆伟等确认劳动关系纠纷一审民事判决书|确认劳动关系纠纷|原告-内蒙古坤元太和农业科技有限公司|（2017）内2530民初38号|https://www.tianyancha.com/lawsuit/15107f169c2211e788a5008cfaf8725a
2016-11-28|刘金宝与内蒙古坤元太和农业科技有限公司买卖合同纠纷一审民事裁定书|买卖合同纠纷|被告-内蒙古坤元太和农业科技有限公司|（2015）蓝民二初字第338号|https://www.tianyancha.com/lawsuit/95e5db170c3d488e9c24afc6d3d48cd2
2016-11-28|叶满乾与内蒙古坤元太和农业科技有限公司买卖合同纠纷一审民事裁定书|买卖合同纠纷|被告-内蒙古坤元太和农业科技有限公司|（2015）蓝民二初字第339号|https://www.tianyancha.com/lawsuit/b4a49060a3df4106b3bc83b132fd03a0
2016-11-28|正蓝旗黒城子示范区兴元种植专业合作社与被告内蒙古坤元太和农业科技有限公司买卖合同纠纷一审民事裁定书|买卖合同纠纷|被告-内蒙古坤元太和农业科技有限公司|（2015）蓝民二初字第341号|https://www.tianyancha.com/lawsuit/a5417d8d55544fa8b72a94085e45eac9
2016-11-24|梁凤瑞与刘艳超、王占凤、内蒙古坤元太和农业科技有限公司机动车交通事故责任纠纷一审民事判决书|机动车交通事故责任纠纷|被告-内蒙古坤元太和农业科技有限公司|（2016）内2530民初524号|https://www.tianyancha.com/lawsuit/efe56c8bbd73447b9a164358106cc0ce