2019-03-26|中国银行股份有限公司巴彦淖尔市分行与内蒙古云海秋林畜牧有限责任公司、内蒙古云海秋林乌兰布和有机农牧业发展股份有限公司等金融借款合同纠纷一审民事判决书|金融借款合同纠纷|原告-中国银行股份有限公司巴彦淖尔市分行被告-内蒙古云海秋林畜牧有限责任公司,内蒙古云海秋林乌兰布和有机农牧业发展股份有限公司,内蒙古三维资源集团有限公司|（2018）内08民初67号|https://www.tianyancha.com/lawsuit/315aa1265c754aa5aa1441e8f339bbb3
2019-02-20|清水河县农村信用合作联社与内蒙古三维资源集团有限公司等借款合同纠纷一审民事判决书|借款合同纠纷|被告-鄂尔多斯市鑫巨冶金有限责任公司,内蒙古三维资源集团有限公司|（2018）渝民初149号|https://www.tianyancha.com/lawsuit/081740318cb344aeb7b129a2b65ad880
2018-12-28|申请执行人满世投资集团有限公司与被执行人内蒙古锋威硅业有限公司执行案件中申请执行人满世投资集团有限公司申请执行异议一案执行裁定书|-|申请人-满世投资集团有限公司被执行人-内蒙古锋威硅业有限公司,内蒙古锋威新能源集团有限公司,内蒙古三维资源集团有限公司,内蒙古三维集团|（2018）内06执异9号|https://www.tianyancha.com/lawsuit/d8aec1940b8b11e9a8b47cd30ae00894
2018-10-22|内蒙古银行股份有限公司呼和浩特师大南门支行申请执行鄂尔多斯市亨坤硅化工有限责任公司、华诚联合融资担保有限公司裁定书|-|申请执行人-内蒙古银行股份有限公司呼和浩特兴安南路支行被执行人-鄂尔多斯市银海生态开发有限责任公司,鄂尔多斯市福海房地产开发有限责任公司,鄂尔多斯市福海家电集团有限责任公司,内蒙古三维资源集团有限公司|（2015）鄂执字第935-12号|https://www.tianyancha.com/lawsuit/6edca74ceac011e8a8b47cd30ae00894
2018-10-22|内蒙古银行股份有限公司呼和浩特兴安南路支行申请执行鄂尔多斯市银海生态开发有限责任公司、鄂尔多斯市福海房地产开发有限责任公司、鄂尔多斯市福海家电集团有限责任公司内蒙古三维资源集团有限公司、孟克达来、萨仁达来、福海、山丹、樊三维、王春蓉、廉晓菲、乌云高娃、乌云达来、阿拉坦裁定书|-|申请执行人-内蒙古银行股份有限公司呼和浩特兴安南路支行被执行人-鄂尔多斯市银海生态开发有限责任公司,鄂尔多斯市福海房地产开发有限责任公司,鄂尔多斯市福海家电集团有限责任公司,内蒙古三维资源集团有限公司|（2015）鄂执字第935-12号|https://www.tianyancha.com/lawsuit/79270317eac111e8a8b47cd30ae00894
2018-10-15|申请执行人鄂尔多斯市维宇物流有限公司执行被执行人内蒙古三维资源集团有限公司终本裁定书|-|申请执行人-鄂尔多斯市维宇物流有限公司被执行人-内蒙古三维资源集团有限公司|（2017）内06执112号|https://www.tianyancha.com/lawsuit/2e62d6c4d6f911e8a8b47cd30ae00894
2018-10-13|内蒙古满世投资集团有限公司申请执行内蒙古三维资源集团有限公司、内蒙古锋威新能源集团有限公司、内蒙古锋威硅业有限公司、李香娃裁定书|-|申请执行人-内蒙古满世投资集团有限公司被执行人-内蒙古锋威硅业有限公司,内蒙古锋威新能源集团有限公司,内蒙古三维资源集团有限公司|（2016）内06执恢49号|https://www.tianyancha.com/lawsuit/c40dda58d2b811e8a8b47cd30ae00894
2018-08-19|中国华融资产管理股份有限公司内蒙古自治区分公司与鄂尔多斯市物流配送中心有限公司、鄂尔多斯市购物中心有限责任公司等债权转让合同纠纷一审民事判决书|债权转让合同纠纷|原告-中国华融资产管理股份有限公司内蒙古自治区分公司被告-鄂尔多斯市物流配送中心有限公司,鄂尔多斯市购物中心有限责任公司,鄂尔多斯市华研房地产开发有限责任公司,内蒙古三维资源集团有限公司|（2016）内01民初116号|https://www.tianyancha.com/lawsuit/4580c5dfbd6911e8a8b47cd30ae00894
2018-08-17|申请执行人色科技股份有限公司与被执行人内蒙古新长江矿业投资有限公司、内蒙古三维资源集团有限公司为合同纠纷一案执行结案通知书|合同纠纷|申请执行人-科技股份有限公司,中色科技股份有限公司被执行人-内蒙古新长江矿业投资有限公司,内蒙古三维资源集团有限公司|（2018）豫0305执1500号|https://www.tianyancha.com/lawsuit/8cf79a86bd7011e8a8b47cd30ae00894
2018-08-16|内蒙古三维资源集团小鱼沟煤炭有限公司、盐城市中物贸易发展有限公司与包头三维资源有限公司、内蒙古三维资源集团有限公司买卖合同纠纷执行裁定书|买卖合同纠纷|申请人-盐城市中物贸易发展有限公司被申请人-包头三维资源有限公司,内蒙古三维资源集团有限公司,内蒙古三维资源集团小鱼沟煤炭有限公司|（2018）苏0903执异37号|https://www.tianyancha.com/lawsuit/a2c8a839bd6b11e8a8b47cd30ae00894
2018-08-14|申请执行人中色科技股份有限公司与被执行人内蒙古新长江矿业投资有限公司、包头市银发项目投资实业有限公司、刘勉诚、安徽新长江投资股份有限公司、第三人内蒙古三维资源集团有限公司合同纠纷一案执行裁定书|合同纠纷|申请执行人-中色科技股份有限公司被执行人-内蒙古新长江矿业投资有限公司|（2018）豫0305执1500号之一|https://www.tianyancha.com/lawsuit/11b83773bd6e11e8a8b47cd30ae00894
2018-07-31|鄂尔多斯市物流配送中心有限公司债权转让合同纠纷二审民事判决书|债权转让合同纠纷|上诉人-鄂尔多斯市物流配送中心有限公司,鄂尔多斯市购物中心有限责任公司,鄂尔多斯市华研房地产开发有限责任公司被上诉人-中国华融资产管理股份有限公司内蒙古自治区分公司,内蒙古三维资源集团有限公司|（2018）内民终137号|https://www.tianyancha.com/lawsuit/8cfe61399f6511e8a8b47cd30ae00894
2018-07-16|申请执行人光大银行股份有限公司呼和浩特分行与内蒙古云海秋林畜牧有限责任公司、内蒙古三维资源集团有限公司、内蒙古秋林羊绒制品有限责任公司、内蒙古生泰森草业有限公司、内蒙古云海秋林乌兰布和有机农牧业发展股份有限公司、李茂等借款合同纠纷一案执行裁定书|借款合同纠纷|申请执行人-中国光大银行股份有限公司呼和浩特分行被执行人-内蒙古云海秋林畜牧有限责任公司,内蒙古三维资源集团有限公司,内蒙古秋林羊绒制品有限责任公司,内蒙古生泰森草业有限公司,内蒙古云海秋林乌兰布和有机农牧业发展股份有限公司|（2017）内08执52号|https://www.tianyancha.com/lawsuit/b3179c38a8064b9aa3203eab1c025174
2018-05-18|内蒙古易高煤化科技有限公司与任宝元劳动合同纠纷一审民事判决书|劳动合同纠纷|原告-内蒙古易高煤化科技有限公司|（2017）内0622民初2968号|https://www.tianyancha.com/lawsuit/c6eab5ca952c11e8a8b47cd30ae00894
2018-05-18|任宝元与内蒙古易高煤化科技有限公司劳动合同纠纷二审民事判决书|劳动合同纠纷|被上诉人-内蒙古易高煤化科技有限公司|（2018）内06民终186号|https://www.tianyancha.com/lawsuit/c635adf3952c11e8a8b47cd30ae00894
2018-03-30|申请执行人光大银行股份有限公司呼和浩特分行与被执行人内蒙古云海秋林畜牧有限责任公司、李茂、李强等借款合同纠纷一案执行裁定书|借款合同纠纷|申请执行人-中国光大银行股份有限公司呼和浩特分行被执行人-内蒙古云海秋林畜牧有限责任公司,内蒙古三维资源集团有限公司,内蒙古秋林羊绒制品有限责任公司,内蒙古生泰森草业有限公司,内蒙古云海秋林乌兰布和有机农牧业发展股份有限公司|（2017）内08执52之一号|https://www.tianyancha.com/lawsuit/07f017c8952e11e8a8b47cd30ae00894
2017-09-21|鄂尔多斯银行股份有限公司东胜支行与鄂尔多斯市远捷再生能源有限公司、内蒙古三维资源集团有限公司等金融借款合同纠纷一审民事判决书|金融借款合同纠纷|原告-鄂尔多斯银行股份有限公司东胜支行被告-鄂尔多斯市远捷再生能源有限公司,内蒙古三维资源集团有限公司,内蒙古锋威新能源集团有限公司|（2017）内0627民初160号|https://www.tianyancha.com/lawsuit/f99893613fce11e8b0207cd30ae00c08
2016-12-06|中国农业银行股份有限公司鄂尔多斯天赋支行诉内蒙古三维资源集团有限公司、内蒙古双欣能源化工有限公司金融借款合同纠纷一案一审民事裁定书|金融借款合同纠纷|原告-中国农业银行股份有限公司鄂尔多斯天赋支行被告-内蒙古三维资源集团有限公司,内蒙古双欣能源化工有限公司|（2016）内0627民初6320号|https://www.tianyancha.com/lawsuit/ef2202a0335e4b0297078c2d8e3b6f8d
2016-10-24|唐港铁路有限责任公司与内蒙古三维资源集团有限公司铁路货物运输合同纠纷一审民事裁定书|铁路货物运输合同纠纷|原告-唐港铁路有限责任公司被告-内蒙古三维资源集团有限公司|（2016）晋7103民初8号|https://www.tianyancha.com/lawsuit/86c7a228ec5c4e3d92c78db3e15b3064
2016-07-25|郭全生申请执行李军内蒙古三维资源集团有限公司终本执行裁定书|-|被执行人-内蒙古三维资源集团有限公司|（2016）内0105执00027号|https://www.tianyancha.com/lawsuit/cd249fe5961a11e8a8b47cd30ae00894
2016-06-21|郭全生申请执行内蒙古三维资源集团有限公司、李军终本执行裁定书|-|被执行人-内蒙古三维资源集团有限公司|（2016）内0105执00027号|https://www.tianyancha.com/lawsuit/a70da7cec6cb40bbb9e183e25d4846de
2015-10-26|盐城市中物贸易发展有限公司与天津地博煤业有限公司、内蒙古三维资源集团有限公司等申请诉前财产保全民事诉讼保全裁定书|申请诉前财产保全|申请人-盐城市中物贸易发展有限公司被申请人-天津地博煤业有限公司,内蒙古三维资源集团有限公司,包头三维资源有限公司|（2015）盐商诉保字第00044号|https://www.tianyancha.com/lawsuit/121dadd35f99428086bf1fd80b6816c0
2015-07-21|中国民生银行股份有限公司呼和浩特分行与伊金霍洛旗众盛煤炭销售有限责任公司、内蒙古三维资源集团有限公司、陈为田、牛艳芳金融借款合同诉前财产保全裁定书|-|申请人-中国民生银行股份有限公司呼和浩特分行被申请人-伊金霍洛旗众盛煤炭销售有限责任公司,内蒙古三维资源集团有限公司|（2015）呼民保字第00009号|https://www.tianyancha.com/lawsuit/ef509be31cbb11e6b554008cfae40dc0