2019-03-18|中信银行股份有限公司呼和浩特分行与内蒙古奈伦农业科技股份有限公司、土豆集（内蒙古）农业科技有限公司等金融借款合同纠纷一审民事判决书|金融借款合同纠纷|原告-中信银行股份有限公司呼和浩特分行被告-内蒙古奈伦农业科技股份有限公司,土豆集（内蒙古）农业科技有限公司,内蒙古乌兰浩特奈伦淀粉工业有限公司,内蒙古奈伦集团股份有限公司|（2018）内01民初308号|https://www.tianyancha.com/lawsuit/cd8082af1ca34f2d93b95c34b7662226
2019-03-18|中信银行股份有限公司呼和浩特分行与内蒙古奈伦农业科技股份有限公司、土豆集（内蒙古）农业科技有限公司等一审民事裁定书|-|申请人-中信银行股份有限公司呼和浩特分行被申请人-内蒙古奈伦农业科技股份有限公司,土豆集（内蒙古）农业科技有限公司,内蒙古乌兰浩特奈伦淀粉工业有限公司,内蒙古奈伦集团股份有限公司|（2018）内01民初308号|https://www.tianyancha.com/lawsuit/717b94d614b7477f8382a959ff193091
2018-12-29|中信富通融资租赁有限公司与郭秀英等融资租赁合同纠纷一审民事判决书|融资租赁合同纠纷|原告-中信富通融资租赁有限公司被告-内蒙古奈伦农业科技股份有限公司,内蒙古阿荣旗奈伦淀粉工业有限公司,阿荣旗奈伦农业发展有限公司,土豆集（内蒙古）农业科技有限公司,乌兰察布市集宁区奈伦农业种植有限公司,内蒙古乌兰浩特奈伦淀粉工业有限公司,乌兰浩特奈伦农业种植有限公司,内蒙古奈伦集团股份有限公司|（2018）京0101民初4322号|https://www.tianyancha.com/lawsuit/d72ced190c2011e9a8b47cd30ae00894
2018-04-25|内蒙古奈伦农业科技股份有限公司与中信银行股份有限公司呼和浩特分行、内蒙古阿荣旗奈伦淀粉工业有限公司等金融借款合同纠纷二审民事裁定书|金融借款合同纠纷|上诉人-内蒙古奈伦农业科技股份有限公司被上诉人-中信银行股份有限公司呼和浩特分行,内蒙古阿荣旗奈伦淀粉工业有限公司,内蒙古乌兰浩特奈伦淀粉工业有限公司,内蒙古奈伦集团股份有限公司,土豆集（内蒙古）农业科技有限公司|（2018）内民终3号|https://www.tianyancha.com/lawsuit/f7c2a3dd906211e8a8b47cd30ae00894
2017-09-27|中信银行股份有限公司呼和浩特分行与内蒙古奈伦农业科技股份有限公司、内蒙古阿荣旗奈伦淀粉工业有限公司等金融借款合同纠纷一审民事判决书|金融借款合同纠纷|原告-中信银行股份有限公司呼和浩特分行被告-内蒙古奈伦农业科技股份有限公司,内蒙古阿荣旗奈伦淀粉工业有限公司,内蒙古乌兰浩特奈伦淀粉工业有限公司,内蒙古奈伦集团股份有限公司,土豆集（内蒙古）农业科技有限公司|（2017）内01民初80号|https://www.tianyancha.com/lawsuit/95bfa879b56b11e788a5008cfaf8725a
2016-11-11|中信银行股份有限公司呼和浩特分行与内蒙古奈伦农业科技股份有限公司等非诉财产保全一审民事裁定书|-|申请人-中信银行股份有限公司呼和浩特分行被申请人-内蒙古奈伦农业科技股份有限公司,内蒙古阿荣旗奈伦淀粉工业有限公司,土豆集（内蒙古）农业科技有限公司,内蒙古乌兰浩特奈伦淀粉工业有限公司,内蒙古奈伦集团股份有限公司|（2016）内01财保26号|https://www.tianyancha.com/lawsuit/963d8f2d564c47d2afd38453b430c21b
2015-04-02|兴和县农村信用合作联社与内蒙古集宁奈伦淀粉工业有限公司等人金融借款合同纠纷一审民事判决书|金融借款合同纠纷|被告-内蒙古集宁奈伦淀粉工业有限公司,内蒙古奈伦集团股份有限公司|（2015）兴民初字第229号|https://www.tianyancha.com/lawsuit/09d647de1cbb11e6b554008cfae40dc0