T15120080502007395|勘查许可证|-|-|内蒙古自治区国土资源厅|盟市探矿权变更申请
152223201600009(村)|建设用地规划许可证(乡村)|-|-|扎赉特旗住房与城乡规划建设局|建设用地许可
(蒙)FM安许证字[2015]005718号|非煤矿山安全生产许可证|-|-|兴安盟安全生产监督管理局|尾矿库运行
15222320160008（村）|建设工程规划许可证|-|-|扎赉特旗住房和城乡规划建设局|工程规划许可
152223201600009（村）|建设用地规划许可证|-|-|扎赉特旗住房和城乡规划建设局|用地规划许可
兴环审字（2014）43号|兴安盟神马矿业有限责任公司扎赉特旗神山矿区年采8万吨铁多金属矿石及14万吨选矿项目环境影响报告书批复|-|-|兴安盟环境保护局|同意兴安盟神马矿业有限责任公司扎赉特旗神山矿区年采8万吨铁多金属矿石及14万吨选矿项目
T15120080502007395|勘察许可证|2018年05月13日|2020年05月12日|内蒙古自治区国土资源厅|盟市探矿权保留申请
c1500002014082210135192|采矿许可证|2018年08月12日|2021年08月12日|兴安盟国土资源局|延续