2015-05-18|110106001093128_0003|牛永利|北京鑫顺融资担保有限公司|无效|885
2015-05-18|110106001093128_0004|王桂芝|北京鑫顺融资担保有限公司|无效|615
2018-02-08|91110113101496703C_0|阚冬|中电投融和融资租赁有限公司|无效|150
2018-02-08|91110113101496703C_0|贰零四玖投资集团有限公司|中电投融和融资租赁有限公司|无效|1350
2018-11-28|91110113MA002XAA3Y_0|北京顺诚彩色印刷有限公司|平安银行股份有限公司北京分行|有效|10000
2018-11-28|91110113101496703C_0|宁波梅山保税港区德昂投资合伙企业（有限合伙）|平安银行股份有限公司北京分行|有效|5340
2018-11-28|91110113101496703C_0|宁波梅山保税港区德昂投资合伙企业（有限合伙）|北京东方国信科技股份有限公司|有效|21360
2018-11-28|91110105MA007H5L5G_0|北京顺诚彩色印刷有限公司|平安银行股份有限公司北京分行|有效|5000