扎国 许准 （2017） 82号|《准予税务行政许可决定书》|-|-|内蒙古自治区扎赉特旗国家税务局|对增值税防伪税控系统最高开票限额的审批
扎（兴）烟专[2017]第7号|烟草专卖零售许可证|-|-|扎赉特旗烟草专卖局|卷烟零售，雪茄烟零售
新-2009-135|文化经营许可证|-|-|扎赉特旗文化体育广播电影电视局|音像制品零售、出租。
扎公消安检字[2015]第34号|公众聚集场所投入使用、营业前消防安全检查合格证|-|-|扎赉特旗公安消防大队|场所投入使用、营业前经消防安全检查合格
内卫环证字（2015）第2015200246号|公共场所卫生许可证|2015年12月08日|-|扎赉特旗卫生局|市场摊位租赁、纺织、服装、日用品、珠宝首饰、工艺美术品、体育用品及器材、照相器材、家具、图书、电脑、音像制品，室内娱乐活动。
新出发零字第201515FZ00002|中华人民共和国出版物经营许可证|2015年01月27日|-|扎赉特旗文化体育广播电视局|音像制品、图书、零售
SP152223111000029X|食品流通许可证|2014年05月30日|-|扎赉特旗食品药品监督管理局|零售；预包装食品兼散装食品乳制品（不含婴幼儿配方乳粉）