2019-05-27|赵大生与内蒙古科利昇生物科技有限公司、马满元民间借贷纠纷一审民事判决书|民间借贷纠纷|原告-赵大生被告-马满元,内蒙古科利昇生物科技有限公司|（2018）内0102民初212号|https://www.tianyancha.com/lawsuit/653fbe72213242a08178f5ac261e5717
2019-05-27|马满元与赵大生、内蒙古科利昇生物科技有限公司民间借贷纠纷二审民事裁定书|民间借贷纠纷|上诉人-马满元被上诉人-赵大生,内蒙古科利昇生物科技有限公司|（2019）内01民终1961号|https://www.tianyancha.com/lawsuit/bd363178c04d444f86e9de49bd145cad
2019-03-18|内蒙古科利昇生物科技有限公司与朱岩山买卖合同纠纷管辖民事裁定书|买卖合同纠纷|上诉人-内蒙古科利昇生物科技有限公司|（2018）内02民辖终167号|https://www.tianyancha.com/lawsuit/f5797f7d354c4fb5b5ed61246adbbfc2
2018-12-17|内蒙古科利昇生物科技有限公司与赵国军财产损害赔偿纠纷一审民事裁定书|财产损害赔偿纠纷|原告-内蒙古科利昇生物科技有限公司|（2017）内0821民初3548号|https://www.tianyancha.com/lawsuit/52d7ba68035d11e9a8b47cd30ae00894
2018-12-13|廊坊通用机械制造有限公司与内蒙古科利昇生物科技有限公司买卖合同纠纷一案执行裁定书|买卖合同纠纷|申请执行人-廊坊通用机械制造有限公司被执行人-内蒙古科利昇生物科技有限公司|（2018）内0821执781号|https://www.tianyancha.com/lawsuit/8b3c9d258b794795b8314191fe59b435
2018-10-22|赵大生与内蒙古科利昇生物科技有限公司、马满元民间借贷纠纷一审民事裁定书|民间借贷纠纷|被告-内蒙古科利昇生物科技有限公司|（2018）内0102民初212号|https://www.tianyancha.com/lawsuit/bbd86d18196b436f8c1bfbc0700d878a
2018-06-21|内蒙古科利昇生物科技有限公司与廊坊通用机械制造有限公司买卖合同纠纷二审民事裁定书|买卖合同纠纷|上诉人-内蒙古科利昇生物科技有限公司被上诉人-廊坊通用机械制造有限公司|（2018）内08民终229号|https://www.tianyancha.com/lawsuit/976756ca964c11e8a8b47cd30ae00894
2015-07-02|张秀兰、刘宝元与内蒙古科力森买卖合同纠纷执行裁定书|买卖合同纠纷|被执行人-内蒙古科力森玉米淀粉有限公司|（2012）托执字第74-1号|https://www.tianyancha.com/lawsuit/2f6a9dee1cb611e6b554008cfae40dc0