赤公消审字〔2016〕第0149号|建设工程消防设计审核意见书|-|-|赤峰市公安消防支队|高性能硅橡胶系列产品循环经济
示范项目（ 一） 工程消防设计审核
内林资许准[2016]670号|赤峰盛森硅业科技发展有限公司高性能硅橡胶系列产品循环经济示范建设项目|-|-|内蒙古自治区林业厅|使用林地
取水许可证：取水（蒙元）字[2012]第050号|中华人民共和国取水许可证|-|-|赤峰市元宝山区水利局|年许可取水量30万立方米
元发改发（2016）47号|赤峰盛森硅业科技发展有限公司高性能硅橡胶系列产品循环经济示范项目备案确认书|-|-|元宝山区发展和改革局|年产4万吨沸腾氯化法高纯氧氯化锆联产2万吨气相法二氧化硅，盐酸电解18万吨，合成苯基硅橡胶系列产品2万吨。新建建构筑物面积46386平方米。建设苯基硅橡胶系列装置、气相法二氧化硅装置氧氯化锆装置盐酸电解装置及公用工程。购置生产设备1043套。
0403261404|排污许可证|-|-|赤峰市元宝山区环境保护局|二氧化硫、
氮氧化物、烟尘排污许可
赤环审字[2016]25号|关于赤峰盛森硅业科技发展有限公司高性能硅橡胶系列产品循环经济示范项目环境影响报告书的批复|-|-|赤峰市环境保护局|赤峰盛森硅业科技发展有限公司高性能硅橡胶系列产品循环经济示范项目环境影响评价文件报批许可
(蒙)3S15043000002|非药品类易制毒危险化学品生产备案证明|2018年08月24日|2021年08月24日|赤峰市安全生产监督管理局|盐酸 2.4万吨/年