2019-03-20|扎鲁特旗正达粮油贸易有限公司、郑州万谷机械有限公司买卖合同纠纷再审审查与审判监督民事裁定书|买卖合同纠纷|再审申请人-扎鲁特旗正达粮油贸易有限公司被申请人-郑州万谷机械有限公司|（2019）豫01民申350号|https://www.tianyancha.com/lawsuit/c5cde6b094c44c2b90725f1768d06d78
2019-03-18|扎鲁特旗正达粮油贸易有限公司与内蒙古邦杰食品有限公司民间借贷纠纷一审民事判决书|民间借贷纠纷|原告-扎鲁特旗正达粮油贸易有限公司被告-内蒙古邦杰食品有限公司|（2018）内0526民初5051号|https://www.tianyancha.com/lawsuit/c1e108b971434cfabe2551820739cb49
2018-12-17|松原新创生物技术有限公司与扎鲁特旗正达粮油贸易有限公司管辖民事裁定书|-|上诉人-松原新创生物技术有限公司被上诉人-扎鲁特旗正达粮油贸易有限公司|（2018）内05民辖终40号|https://www.tianyancha.com/lawsuit/ebcd8d7404f211e9a8b47cd30ae00894
2018-11-28|郑州万谷机械有限公司与扎鲁特旗正达粮油贸易有限公司买卖合同纠纷一审执行裁定书|买卖合同纠纷|申请执行人-郑州万谷机械有限公司被执行人-扎鲁特旗正达粮油贸易有限公司|（2018）豫0103执3159号|https://www.tianyancha.com/lawsuit/44817bff132011e9a8b47cd30ae00894
2017-12-25|郑州万谷机械有限公司与扎鲁特旗正达粮油贸易有限公司管辖民事裁定书|-|上诉人-郑州万谷机械有限公司被上诉人-扎鲁特旗正达粮油贸易有限公司|（2017）内05民辖终58号|https://www.tianyancha.com/lawsuit/a2cb42593cfe11e8b0207cd30ae00c08
2017-12-04|郑州万谷机械有限公司与扎鲁特旗正达粮油贸易有限公司买卖合同纠纷一审民事判决书|买卖合同纠纷|原告-郑州万谷机械有限公司被告-扎鲁特旗正达粮油贸易有限公司|（2017）豫0103民初4598号|https://www.tianyancha.com/lawsuit/5ec7f6af40f911e8b0207cd30ae00c08
2017-08-14|扎鲁特旗正达粮油贸易有限公司买卖合同纠纷一审民事裁定书|买卖合同纠纷|原告-扎鲁特旗正达粮油贸易有限公司被告-郑州万谷机械有限公司|（2017）内0526民初1982号|https://www.tianyancha.com/lawsuit/b2212528c89411e788a5008cfaf8725a