2019-04-24|万正萍；呼伦贝尔友谊乳业（集团）有限责任公司诉前申请停止侵权、财产保全其他民事裁定书|-|被申请人-呼伦贝尔友谊乳业（集团）有限责任公司|（2019）内0782财保5号|https://www.tianyancha.com/lawsuit/a72160d3f7c94bb3a50a0adab976c358
2019-04-24|万正萍；呼伦贝尔友谊乳业（集团）有限责任公司申请诉前证据保全其他民事裁定书|申请诉前证据保全|被申请人-呼伦贝尔友谊乳业（集团）有限责任公司|（2019）内0782证保1号|https://www.tianyancha.com/lawsuit/acadfe1f37db4c43a94a1ffbe2207058
2017-12-29|内蒙古自治区食品药品监督管理局与呼伦贝尔友谊乳业（集团）有限责任公司行政处罚非诉执行审查行政裁定书|-|被执行人-呼伦贝尔友谊乳业（集团）有限责任公司|（2017）内0105行审45号|https://www.tianyancha.com/lawsuit/eed7bf5391cc11e8a8b47cd30ae00894
2017-09-25|黑龙江恒事达建筑安装工程有限公司与呼伦贝尔友谊乳业（集团）有限责任公司再审审查与审判监督民事裁定书|-|申诉人-黑龙江恒事达建筑安装工程有限公司被申诉人-呼伦贝尔友谊乳业（集团）有限责任公司|（2017）内07民抗2号|https://www.tianyancha.com/lawsuit/03e32575c1e711e788a5008cfaf8725a
2017-09-06|黑龙江恒事达建筑安装工程有限公司与呼伦贝尔友谊乳业（集团）有限责任公司建设工程施工合同纠纷再审民事裁定书|建设工程施工合同纠纷|申诉人-黑龙江恒事达建筑安装工程有限公司被申诉人-呼伦贝尔友谊乳业（集团）有限责任公司|（2017）内07民再7号|https://www.tianyancha.com/lawsuit/98cb0743994311e788a5008cfaf8725a
2017-07-01|天津物产鑫凯龙国际贸易有限公司与呼伦贝尔友谊乳业（集团）有限责任公司买卖合同纠纷一审民事判决书|买卖合同纠纷|原告-天津物产鑫凯龙国际贸易有限公司被告-呼伦贝尔友谊乳业（集团）有限责任公司|（2016）津0102民初5634号|https://www.tianyancha.com/lawsuit/2fe212e7a14511e788a5008cfaf8725a
2017-05-12|万正强犯玩忽职守罪刑事附带民事裁定书|玩忽职守罪|被上诉人-新大洲控股股份有限公司,呼伦贝尔友谊乳业（集团）有限责任公司|（2017）内71刑终2号|https://www.tianyancha.com/lawsuit/c2027065fc844c50b3e5901aaa3e36e4
2015-02-12|陈巴尔虎旗呼和诺尔镇白音布日德玉源牧民专业合作社与呼伦贝尔友谊乳业（集团）有限责任公司买卖合同纠纷一审民事判决书|买卖合同纠纷|原告-陈巴尔虎旗呼和诺尔镇白音布日德玉源牧民专业合作社被告-呼伦贝尔友谊乳业（集团）有限责任公司|（2014）牙民初字第2402号|https://www.tianyancha.com/lawsuit/79fa2ea10623465da13ec99bf1a79ba9