奈发改字〔2016〕316号 |关于内蒙古蒙东高新科技城有限公司蒙东科技城建设项目节能评估报告书的批复
|-|-|内蒙古自治区奈曼旗发展和改革局|你公司委托通辽市博远科技咨询中心编制的《内蒙古蒙东科技城建设项目节能评估报告书》等有关材料收悉。项目总占地面积1303.41亩，总建筑面积557735平方米，分三期建设，其中一期包括轻量化新材料孵化基地、电子商务区、文化创意区、O2O产品展示区；二期建设人才公寓；三期建设孵化毕业企业产业化园区。按照国家发展改革委《固定资产投资项目节能评估和审查暂行办法》（2010年第6号令）要求，我局组织相关技术人员对节能评估报告书中所述项目的能源消耗种类、能源消耗指标和节能效果等进行了审查，批复如下：
一、项目选址奈曼旗大沁他拉镇，总投资11.2亿元，建设期三年。项目主要消耗能源种类为电力、水和热力，年用电量3189.38万千瓦时、水17.52万吨、热力356360.38吉焦。项目综合能耗当量值为16078.76吨标准煤/年，等价值为27204.4吨标准煤/年。综合能耗对当地能源消费的影响不大，项目建设符合国家产业政策及相关法律、法规和标准，同意项目按报告书中所列节能技术及管理措施实施。
二、该项目运营中电力、热力及水消耗比较大，建议企业在生产过程中选用高性能的节能型变压器、加强建筑节能并采用节水器材设备，从而提高生产效率，降低能源消耗。
    三、项目用能工艺、设备及能源种类等建设内容发生重大变更或能源消耗总量超过节能审批能源消耗总量10%及以上时，应重新进行节能评估和审查。
    四、项目建设单位要严格按照节能评估报告书中所列节能措施及标准实施。项目竣工后，及时向我局申请节能验收，验收合格后方可正式运行。
    项目实施期间，节能评估审查批复执行情况的监督检查工作由奈曼旗节能监察中心负责。

150525201700003|建设用地规划许可|-|-|奈曼旗住房和城乡建设局|内蒙古蒙东科技城建设项目
150525201700001|建设用地规划许可|-|-|奈曼旗住房和城乡建设局|内蒙古蒙东科技城建设项目
150525201700023|建设工程规划许可|-|-|奈曼旗住房和城乡建设局|轻量化新材料孵化基地新建综合楼、中试车间
150525201704280201|施工许可|-|-|奈曼旗住房和城乡建设局|轻量化新材料孵化基地新建综合楼、中试车间
奈发改字〔2016〕338号|关于内蒙古蒙东高新科技城有限公司年产1万吨轻量化铝合金新材料建设项目节能评估报告表的批复
|-|-|内蒙古自治区奈曼旗发展和改革局|你单位委托通辽市博远科技咨询中心编制的《年产10000吨轻量化铝合金新材料建设项目节能评估报告表》等有关材料收悉。项目新建生产车间、生产用房和办公楼26000平方米，建设轻量化铝合金新材料生产线10条并完善相关附属设施，年产轻量化铝合金线束导体1万吨。按照国家发展改革委《固定资产投资项目节能评估和审查暂行办法》（2010年第6号令）要求，我局组织相关技术人员对节能评估报告表中所述项目的能源消耗种类、能源消耗指标和节能效果等进行了审查，批复如下：
一、项目选址奈曼旗大沁他拉镇，总投资13000万元。项目主要消耗能源种类为电力、热力、天然气和水，其中年用电量405.89万千瓦时、热力4267.93吉焦、天然气80万立方米、水2.4万吨。项目综合能耗当量值为1708.47吨标准煤/年，等价值为2851.49吨标准煤/年。项目综合能耗对全旗能源消费的影响不大，项目建设符合国家产业政策及相关法律、法规和标准，同意项目按报告表中所列节能技术及管理措施实施。
二、该项目建设过程中电力和天然气消耗比较大，建议项目实施单位全部使用节能产品并采取节气措施，从而提高自身效率，降低自身能源消耗，同时加强能源管理以及考核，确保过程节能。
三、项目用能设备及能源种类等建设内容发生重大变更或能源消耗总量超过节能审批能源消耗总量10%及以上时，应重新进行节能评估和审查。
四、项目建设单位要严格按照节能评估报告表中所列节能措施及标准实施。项目竣工后，及时向我局申请节能验收，验收合格后方可正式运行。
项目实施期间，节能评估审查批复执行情况的监督检查工作由奈曼旗节能监察中心负责。

150525201700002|建设用地规划许可|-|-|奈曼旗住房和城乡建设局|内蒙古蒙东科技城建设项目
奈环审字2016（68）号|内蒙古蒙东高新科技城有限公司内蒙古蒙东科技城建设项目环境影响报告表的审批意见|2016年10月14日|-|通辽市奈曼旗环境保护局|建设项目环境影响评价