判决揭露执行法官是如何腐败的：撤失信人名单，改调解书…（判决全文）|-|李国忠在其市中院办公室内收受陈某1送予的人民币20000元。 11、上海顺朝企业发展集团有限公司与内蒙古晶鼎聚龙技术服务集团有限公司、沧州中防地下空间投资有限公司、钱某、林某|-|微信公众号|-|10天前|-|https://news.tianyancha.com/detail/dfd892d19c234028897c0f786502aebd5352e223.html
五年受贿4百多万，多名律师涉案，中院执行庭长把办案当成了“提款机”|-|受陈某1的请托，2017年前后两次收受陈某1共计40000元。 11、上海顺朝企业发展集团有限公司与内蒙古晶鼎聚龙技术服务集团有限公司等联营合同纠纷执行一案和上海顺朝企业发展集团有限公司与内蒙古晶鼎聚|-|微信公众号|-|2019年05月28日|-|https://news.tianyancha.com/detail/95165c7ddafbb318880ac788d3ec81cf0f4caa88.html
观察|法官收钱收到手软，5年不收手！|-|受陈某1的请托，2017年前后两次收受陈某1共计40000元。 11、上海顺朝企业发展集团有限公司与内蒙古晶鼎聚龙技术服务集团有限公司等联营合同纠纷执行一案和上海顺朝企业发展集团有限公司与内蒙古晶鼎聚|-|微信公众号|-|2019年05月27日|-|https://news.tianyancha.com/detail/9018c8e601a507d2d072e6c502cc635e6ba3275d.html
法官李国忠的受贿清单：6年间插手30余桩案件受贿超400万元|-|李国忠在其市中院办公室内收受陈某1送予的人民币20000元。 11、上海顺朝企业发展集团有限公司与内蒙古晶鼎聚龙技术服务集团有限公司、沧州中防地下空间投资有限公司、钱某、林某|-|微信公众号|-|2019年05月19日|-|https://news.tianyancha.com/detail/f282d3c17a9bd8de129ff7a1f9e21b23f4b3efea.html
资本竞逐矿产资源|-|日前，中国环保能源发布公告称，北京华熙景豪美锦集团旗下太原美锦能源公司的全资子公司日前已与内蒙古晶鼎聚龙技术服务集团有限公司晶鼎聚龙多名股东签订收购意向书，拟购买晶鼎聚龙之51%股权。|-|中国产业经济信息网|-|2013年12月06日|-|https://news.tianyancha.com/detail/40bd7221683b67d6f207f3cc21e71b6960342091.html
十个月涨幅逾百倍，中国环保能源书写资本市场传奇|-|美锦集团向其披露，北京华熙景豪（美锦集团旗下太原美锦能源公司之全资子公司）于今年3月27日与内蒙古晶鼎聚龙技术服务集团有限公司（简称"晶鼎聚龙"）多名股东签订收购意向书|-|中国产业经济信息网|-|2013年05月10日|-|https://news.tianyancha.com/detail/b2c5e3744e6de21ba917ca4792e3a9e6e2bff349.html