-|其他|2010年08月03日|-|鄂尔多斯市杭锦旗住房和城乡规划建设局|允许开工建设
杭环评字 ﹝2016﹞1号|关于鄂尔多斯市兆丰粮油有限公司锡尼粮库仓储设施 扩建项目环境影响报告表的批复|2016年01月25日|-|鄂尔多斯市杭锦旗环境保护局|该项目为扩建项目，新建钢结构平房仓8栋，总建筑面积14472平方米；建设各类附属服务设施884.81平方米；新建消防水池450立方米；配套机械输送系统、轴流风机、测温系统等散粮仓储设备和相应的粮情检验化验设备，实现智能化、气调化和低温化储粮功能；硬化地坪及库房区间道路15000平方米，配套消防、供水、输变电、绿化等；使库区仓储容量增加6.18万吨，配送散粮6.18万吨。
-|其他|2016年04月01日|-|鄂尔多斯市杭锦旗住房和城乡规划建设局|允许开工建设
杭环验﹝2016﹞1号|环境保护竣工验收意见|2016年12月12日|-|鄂尔多斯市杭锦旗环境保护局|鄂尔多斯市兆丰粮油有限公司锡尼粮库仓储设施扩建项目，该项目按照环评及批复文件要求，基本落实了相关环保措施，经验收合格，同意通过环境保护竣工验收。
-|其他|2017年05月23日|-|杭锦旗规划事业服务中心|建设工程规划许可证
-|杭国税许准字（2017）57号|2017年06月26日|-|鄂尔多斯市杭锦旗国家税务局|核准增值税专用发票最高开票限额为一千万元
-|杭国税许准字（2017）80号|2017年09月20日|-|鄂尔多斯市杭锦旗国税局|核准增值税专用发票最高开票限额为一百万元
0930001|粮食收购许可证|2014年05月08日|-|杭锦旗粮食管理局|粮食收购资格