赤峰高铁宁城投资开发有限公司|肖振富|5666881|||宁城县天义镇长青路北段东侧金融街北（腾远商业综合办公楼十二层1#-1-1201室）|5000万|2017-03-01|存续|150429000040192|91150429MA0N58867A|MA0N58867|91150429MA0N58867A|其他有限责任公司(1190)|2017-03-01至无固定期限|商务服务业||2018-01-24|5000万|小于50人|10|宁城县市场监督管理局|||宁城县天义镇长青路北段东侧金融街北（腾远商业综合办公楼十二层1#-1-1201室）附近公司|许可经营项目：无 一般经营项目：高铁项目投资与经营管理|
宁城赋顺投资有限公司|阎凤芝|13404890799|||宁城县汐子镇汐子村十组|2000万|2013-07-25|存续|150429000020575|911504290725967394|072596739|911504290725967394|有限责任公司(自然人投资或控股)(1130)|2013-07-25至2033-07-24|商务服务业||2017-07-26|2000万|||宁城县市场监督管理局|||宁城县汐子镇汐子村十组附近公司|许可经营项目：无 一般经营项目：投资与资产管理|
宁城县八里罕镇基层供销合作社有限公司|南立志|13847685396|1140629095@qq.com||宁城县八里罕镇八里罕村|30万|2015-08-14|存续|150429000030525|91150429353079308L|353079308|91150429353079308L|其他有限责任公司(1190)|2015-08-14至无固定期限|零售业||2017-10-31||||宁城县市场监督管理局|||宁城县八里罕镇八里罕村附近公司|许可经营项目：无 一般经营项目：农作物种植、销售；农产品、蔬菜、水果、农副产品、废旧物资购销；化肥、农膜、农药、农业机械、饲料、温室大棚物资、五金建材、日用百货、日用杂品、家用电器、厨房用具、卫生用品、文体用品、化妆品、服装鞋帽、针纺织品、烟花爆竹销售；农机服务、仓储服务、空车配货、物流信息服务、托老服务；物业管理；职业技能培训；园林绿化工程施工；纸制品加工、销售|
内蒙古正基企业投资管理集团有限公司|周伟军|15848971455|sjm@nmzhengji.com||内蒙古自治区赤峰市宁城县天义镇长青路北段园林路东正基百货四楼|3030万|2012-04-23|存续|150400000027449|91150429594616610E|594616610|91150429594616610E|有限责任公司(自然人投资或控股)(1130)|2012-04-23至2032-04-22|商务服务业||2017-11-13||||宁城县市场监督管理局|内蒙古正基企业投资管理有限公司||内蒙古自治区赤峰市宁城县天义镇长青路北段园林路东正基百货四楼附近公司|企业投资与经营管理|
赤峰市卓伦拉锁式新型建材科技有限公司|刘宇辉|13701175785|||内蒙古自治区赤峰市宁城县天义镇大宁路B段东侧南环街北侧（温馨佳苑二期17-2-107室）|11000万|2018-01-19|存续|150429020254400|91150429MA0NRLK69G|MA0NRLK69|91150429MA0NRLK69G|有限责任公司(自然人投资或控股)(1130)|2018-01-19至2045-09-22|科技推广和应用服务业||2018-01-19||||宁城县市场监督管理局|||内蒙古自治区赤峰市宁城县天义镇大宁路B段东侧南环街北侧（温馨佳苑二期17-2-107室）附近公司|墙体材料部品与构件研发、生产、销售、安装；装配式房屋、被动式房屋制造、销售；墙体材料设备研发、加工、销售、服务；秸秆、非金属废料和碎屑收购、研发与利用；建筑材料销售；进出口贸易（国家禁止进出口的商品和技术除外）；专利技术推广。|
内蒙古科艺农业科技有限公司|林安诚|15049684333|377829121@qq.com||内蒙古自治区赤峰市宁城县天义镇（中京工业园区）|10000万|2018-02-11|存续|150429020305778|91150429MA0PQPMQ29|MA0PQPMQ2|91150429MA0PQPMQ29|有限责任公司(自然人独资)(1151)|2018-02-11至无固定期限|科技推广和应用服务业||2018-07-02||||宁城县市场监督管理局|||内蒙古自治区赤峰市宁城县天义镇（中京工业园区）附近公司|农作物、苗木、花卉种植、销售；新能源、新材料技术研发、技术推广、技术转让；秸秆、动物毛收购、加工；饲料、服装、纸制品、建筑材料、肥料、床上用品、食品、酒生产、销售；化肥、农药、农膜、日用百货、农业机械、种子、羽毛（绒）销售；农副产品、土特产品、粮食购销；农业科技研发、推广及应用；进出口贸易（国家禁止进出口的商品和技术除外）。|
宁城县国有资本投资运营有限公司|王刚|13847681999|||内蒙古自治区赤峰市宁城县天义镇哈河大街中段南侧（宁城县党政综合楼1507室）|10000万|2018-04-26|存续|150429020482894|91150429MA0PU6FY3W|MA0PU6FY3|91150429MA0PU6FY3W|有限责任公司(国有独资)(1110)|2018-04-26至无固定期限|商务服务业||2018-04-26|300万|||宁城县市场监督管理局|||内蒙古自治区赤峰市宁城县天义镇哈河大街中段南侧（宁城县党政综合楼1507室）附近公司|投资与资产经营管理；公共服务领域项目建设、棚户区改造项目建设、城市基础项目建设、园区基础设施建设、农村基础设施建设；房地产开发与经营、旅游景区开发与经营管理；餐饮服务、住宿服务、土地收购、储备、管理；汽车租赁、房屋租赁、物业管理；水利水电工程、市政公用工程、道路工程施工；土木工程建筑；办公设备、计算机及辅助设备、电子产品销售；信息系统集成服务。|
内蒙古宏旭新能源科技有限公司|柴子薪|18603316063|||宁城县天义镇大明镇五官营子村|10000万|2017-08-29|存续|150429000044469|91150429MA0NH65H86|MA0NH65H8|91150429MA0NH65H86|有限责任公司(自然人投资或控股)(1130)|2017-08-29至无固定期限|电力、热力生产和供应业||2018-11-02||||宁城县市场监督管理局|||宁城县天义镇大明镇五官营子村附近公司|许可经营项目：无 一般经营项目：太阳能发电；光伏发电设备研发、制造、销售、安装、维修；光伏发电工程施工；新能源技术研发及技术服务；合同能源管理|
敖汉旗老哈河水稻种植农民专业合作社|刘文彬||||内蒙古自治区赤峰市敖汉旗四道湾子镇下树林子村|360万|2009-10-16|存续|150430NA000115X|93150430MA0N2E5C7T|MA0N2E5C7|93150430MA0N2E5C7T|农民专业合作社(9100)||农业||2018-09-21||||赤峰敖汉旗四道湾子市场监督管理所|||内蒙古自治区赤峰市敖汉旗四道湾子镇下树林子村附近公司|许可经营项目：无 一般经营项目：水稻种植；稻草帘编织；组织采购本社社员所需的生产资料（需审批的除外）；销售本社社员生产的产品；信息咨询服务|
敖汉旗新惠鼎顺废旧资源寄卖行|赵洪利||||内蒙古自治区赤峰市敖汉旗新惠镇新中街鸿祥商厦二楼|100000万|2010-04-09|吊销|150430600130725||||个体户|2010-04-09至2014-04-08|零售业||2010-06-18||||敖汉旗市场监督管理局|||内蒙古自治区赤峰市敖汉旗新惠镇新中街鸿祥商厦二楼附近公司|许可经营项目：***一般经营项目：废旧资源寄卖（不含危险品和国家命令禁止个人经营的物品）*** (依法须经批准的项目，经相关部门批准后方可开展经营活动)|
敖汉旗新惠严氏大牧场风干肉绿食店|严冬建||||内蒙古自治区赤峰市敖汉旗新惠镇强盛花园一楼|50000万|2009-09-10|吊销|150430600105466||||个体户|2009-09-10至2013-09-09|批发业||2010-06-22||||敖汉旗市场监督管理局|||内蒙古自治区赤峰市敖汉旗新惠镇强盛花园一楼附近公司|批发兼零售预包装食品、散装食品（食品流通许可证有效期至2013年5月18日）*** (依法须经批准的项目，经相关部门批准后方可开展经营活动)|
敖汉旗新惠金九调料门市|齐军||||内蒙古自治区赤峰市敖汉旗新惠镇惠洲街理想家园7号楼|50000万|2012-06-15|吊销|150430600212160||||个体户|2012-06-15至2099-12-31|零售业||2012-06-15||||敖汉旗市场监督管理局|||内蒙古自治区赤峰市敖汉旗新惠镇惠洲街理想家园7号楼附近公司|许可经营项目：零售：预包装食品兼散装食品、不含乳制品（食品流通许可证有效期至2015年06月12日）。 一般经营项目：无 (依法须经批准的项目，经相关部门批准后方可开展经营活动)|
敖汉旗新惠蒙都牛肉干店|王旭东||||内蒙古自治区赤峰市敖汉旗新惠镇新中街新化小区对过|50000万|2011-06-03|吊销|150430600188729||||个体户|2011-06-03至2015-06-02|批发业||2011-06-03||||敖汉旗市场监督管理局|||内蒙古自治区赤峰市敖汉旗新惠镇新中街新化小区对过附近公司|许可经营项目：预包装食品、散装食品（食品流通许可证有效期至2014年05月31日）***一般经营项目：*** (依法须经批准的项目，经相关部门批准后方可开展经营活动)|
敖汉旗新惠达盛昌废旧资源寄卖行|张文达||||内蒙古自治区赤峰市敖汉旗新惠镇新中街交警队对过|50000万|2010-10-27|吊销|150430600154155||||个体户|2010-10-27至2014-10-26|零售业||2010-10-27||||敖汉旗市场监督管理局|||内蒙古自治区赤峰市敖汉旗新惠镇新中街交警队对过附近公司|许可经营项目：***一般经营项目：废旧资源寄卖（不含国家明令禁止个人自由买卖的物资、不含危险化学品、不含生产物资、不得开办地下钱庄）*** (依法须经批准的项目，经相关部门批准后方可开展经营活动)|
敖汉旗新惠芳华饺子馆|张凤华||||内蒙古自治区赤峰市敖汉旗新惠镇新中街三中门南|50000万|2011-04-26|吊销|150430600175119||||个体户|2011-04-26至2015-04-25|餐饮业||2011-04-26||||敖汉旗市场监督管理局|||内蒙古自治区赤峰市敖汉旗新惠镇新中街三中门南附近公司|许可经营项目：餐饮服务（不含凉菜、不含裱花蛋糕、不含生食海产品）（餐饮服务许可证有效期至2014年4月24日）***一般经营项目：*** (依法须经批准的项目，经相关部门批准后方可开展经营活动)|
敖汉旗新惠王金圆春饼铺|王金圆||||内蒙古自治区赤峰市敖汉旗新惠镇理想家园西门南20米|50000万|2011-04-28|吊销|150430600180950||||个体户|2011-04-28至2015-04-27|餐饮业||2011-04-28||||敖汉旗市场监督管理局|||内蒙古自治区赤峰市敖汉旗新惠镇理想家园西门南20米附近公司|许可经营项目：餐饮服务（不含凉菜、不含裱花蛋糕、不含生食海产品）（餐饮服务许可证有效期至2014年3月21日）***一般经营项目：*** (依法须经批准的项目，经相关部门批准后方可开展经营活动)|
赤峰市泽丰劳务分包有限公司|崔振学||||内蒙古自治区赤峰市敖汉旗新惠镇正大物流配送中心综合楼2楼1号厅|50000万|2018-10-18|存续||91150430MA13N04U8Q|MA13N04U8|91150430MA13N04U8Q|有限责任公司(自然人投资或控股)(1130)|2018-10-18至无固定期限|房屋建筑业||2018-10-18||||敖汉旗市场监督管理局|||内蒙古自治区赤峰市敖汉旗新惠镇正大物流配送中心综合楼2楼1号厅附近公司|建筑工程、公路工程、铁路工程、港口与航道工程、水利水电工程、电力工程、石油化工工程、通讯工程、市政工程、机电安装工程、电子与智能化工程、防水防腐保温工程、建筑装修装饰工程、建筑幕墙工程、古建筑工程、城市及道路照明工程、机场跑道工程、环保工程、特种工程施工；道路普通货物运输；机械设备租赁；建筑材料销售。|
敖汉旗众鑫矿业开发有限公司|王怀宇|18642177666|trcwb@126.com||内蒙古自治区赤峰市敖汉旗贝子府镇巨林营子村|100万|2010-01-19|存续|150430000012616|91150430699465353W|699465353|91150430699465353W|有限责任公司(自然人投资或控股)(1130)|2010-01-19至2020-01-18|黑色金属矿采选业||2017-08-23|100万|||赤峰敖汉旗贝子府市场监督管理所|||内蒙古自治区赤峰市敖汉旗贝子府镇巨林营子村附近公司|许可经营项目：无 一般经营项目：矿产品销售|
内蒙古金沟农业发展有限公司|张立恒|5902228|nmjg@nmjga.com|www.nmjga.com|内蒙古自治区赤峰市敖汉旗新惠镇工业园区|13000万|2005-01-10|存续|150430000004155|91150430767883312R|767883312|91150430767883312R|有限责任公司(自然人投资或控股)(1130)|2005-01-10至2035-01-09|畜牧业||2018-12-03||小于50人|21|敖汉旗市场监督管理局|内蒙古金沟生态养殖有限公司||内蒙古自治区赤峰市敖汉旗新惠镇工业园区附近公司|粮食购销；畜禽养殖；粪便处理；水产品养殖；禽蛋购售；农作物种植；水产品销售；饲料经销；农机具租赁、销售；杂粮加工、销售；粮食加工。|内蒙古金沟农业发展有限公司成立于2005年1月，注册资本为人民币3000万元，自治区级农牧业产业化重点龙头企业。公司地址位于内蒙古赤峰市敖汉旗新惠工业园区，总占地面积1700亩，公司现有在职员工116人，大专以上学历32人。凭借多年的探索与发展，公司正全力打造以蛋鸡孵化、养殖、饲料供给、有机肥加工、有机杂粮种植、有机杂粮精加工及深加工、鸡蛋深加工及休闲食品加工为一体的自动化程度较高、规模较大的国家级农牧业产业化重点龙头企业。　　在未来几年的发展中，公司将在国内形成以北京、上海、广东为核心辐射全国大中城市的高效农产品供应网络，为客户提供全程“一站式”服务。集中力量打造农业品牌。
内蒙古磊淼鑫建筑劳务工程有限公司|佟国涛|15304928977|slj4332995@163.com||内蒙古自治区赤峰市敖汉旗新惠镇新中街西新惠路（原百货公司院内一层1号）|30770万|2018-09-14|存续||91150430MA0Q11BK2A|MA0Q11BK2|91150430MA0Q11BK2A|有限责任公司(自然人独资)(1151)|2018-09-14至无固定期限|土木工程建筑业||2019-04-22||||敖汉旗市场监督管理局|||内蒙古自治区赤峰市敖汉旗新惠镇新中街西新惠路（原百货公司院内一层1号）附近公司|土石方工程、市政工程、公路工程、隧道工程、水电工程、钢结构工程、园林绿化工程、建筑安装工程施工；建筑工程设计、施工；室内装潢；普通货物道路输。|
敖汉旗贝子府蒙连烧烤店|李云福||||内蒙古自治区赤峰市敖汉旗贝子府镇广场东300米|30000万|2012-05-17|吊销|150430600206809||||个体户|2012-05-17至2099-12-31|餐饮业||2012-05-17||||敖汉旗市场监督管理局|||内蒙古自治区赤峰市敖汉旗贝子府镇广场东300米附近公司|许可经营项目：餐饮服务（单纯烧烤、不含凉菜、不含裱花蛋糕、不含生食海产品）*** 一般经营项目：无 (依法须经批准的项目，经相关部门批准后方可开展经营活动)|
敖汉旗贝子府天缘餐厅|姜俊英||||内蒙古自治区赤峰市敖汉旗贝子府镇玉龙家园楼下|30000万|2012-05-30|吊销|150430600209608||||个体户|2012-05-30至2099-12-31|餐饮业||2012-05-30||||敖汉旗市场监督管理局|||内蒙古自治区赤峰市敖汉旗贝子府镇玉龙家园楼下附近公司|许可经营项目：餐饮服务（不含凉菜、不含裱花蛋糕、不含生食海产品）*** 一般经营项目：无 (依法须经批准的项目，经相关部门批准后方可开展经营活动)|
内蒙古万强商运（集团）有限公司|胡玲玲|0476-5901444|||内蒙古自治区赤峰市敖汉旗新惠镇新惠路中段|3392万|1999-09-01|存续|150430000005922|91150430701290207K|701290207|91150430701290207K|有限责任公司(自然人投资或控股)(1130)|1999-09-01至无固定期限|道路运输业||2016-09-27|3392万|||赤峰敖汉旗新州市场监督管理所|敖汉旗万强商运有限责任公司|Aohan Qi Wanqiang Shangyun Co.,Ltd.|内蒙古自治区赤峰市敖汉旗新惠镇新惠路中段附近公司|许可经营项目：无 一般经营项目：农机配件、汽车配件、摩托车、润滑油、家用电器、五金交电、针织、百货销售；柜台出租；金银首饰销售|
敖汉旗新惠贵鹏蔬菜水果门市|马振贵||||内蒙古自治区赤峰市敖汉旗新惠镇滨河路兴宝家园2号楼一楼|20000万|2010-11-30|吊销|150430600157418||||个体户|2010-11-30至2014-11-29|零售业||2010-11-30||||敖汉旗市场监督管理局|||内蒙古自治区赤峰市敖汉旗新惠镇滨河路兴宝家园2号楼一楼附近公司|许可经营项目：零售预包装食品、散装食品（食品流通许可证有效期至2013年11月29日）***一般经营项目：日用百货、化妆品、针织品、五金、日杂、服装、鞋帽*** (依法须经批准的项目，经相关部门批准后方可开展经营活动)|
敖汉旗新惠蓝莓原汁副食批发部|李强||||内蒙古自治区赤峰市敖汉旗新惠镇银河花都院内|20000万|2010-05-11|吊销|150430600136672||||个体户|2010-05-11至2014-05-10|批发业||2010-05-11||||敖汉旗市场监督管理局|||内蒙古自治区赤峰市敖汉旗新惠镇银河花都院内附近公司|许可经营项目：批发兼零售预包装食品、散装食品（食品流通许可证有效期至2013年5月6日）***一般经营项目： (依法须经批准的项目，经相关部门批准后方可开展经营活动)|
内蒙古凰金谷旅游开发有限责任公司|李遇春|18904763732|||内蒙古赤峰市敖汉旗金厂沟梁镇下湾子村南|20000万|2017-09-05|存续|150430000031985|91150430MA0NHHP65L|MA0NHHP65|91150430MA0NHHP65L|有限责任公司(自然人投资或控股)(1130)|2017-09-05至无固定期限|娱乐业||2018-12-14||||敖汉旗市场监督管理局|内蒙古范家沟旅游开发有限责任公司||内蒙古赤峰市敖汉旗金厂沟梁镇下湾子村南附近公司|餐饮服务、洗浴服务、住宿服务；组织策划文艺活动；文艺演出；大型陆上游乐设施管理，水上游乐项目管理，冰雪嘉年华等娱乐项目。电子游戏（打斗机、模拟机）；4D电子娱乐；歌舞娱乐，文化传媒演艺；接待演出团体；组织展览展示活动；场地租赁、玩具设备租赁；图书销售，文化体育用品销售、服装鞋帽、烟草制品、日用百货、预包装食品、农副产品、土特产品、工艺品、礼品、饰品销售|
敖汉旗新惠波子自选商店|朱凤波||||内蒙古自治区赤峰市敖汉旗新惠镇河东新区兴隆佳苑十一号楼||2009-03-03|注销|150430600070062||||个体工商户||零售业||2019-01-04||||敖汉旗市场监督管理局|||内蒙古自治区赤峰市敖汉旗新惠镇河东新区兴隆佳苑十一号楼附近公司|预包装食品、蔬菜、调料销售（食品卫生许可证有效期至2013年2月23日）***|
敖汉旗汇鑫集群农业发展有限公司|李金鸣||||内蒙古自治区赤峰市敖汉旗新惠镇理想家园西门南侧第四门口|20000万|2018-02-13|存续|150430020310801|91150430MA0PQQR635|MA0PQQR63|91150430MA0PQQR635|有限责任公司(自然人独资)(1151)|2018-02-13至无固定期限|科技推广和应用服务业||2018-02-13||||敖汉旗市场监督管理局|||内蒙古自治区赤峰市敖汉旗新惠镇理想家园西门南侧第四门口附近公司|农业技术开发、技术咨询、技术服务、技术转让；休闲农业项目开发、运营、管理；初级农产品种植、加工、销售；化肥、农药、地膜、滴灌带及各种配件、农业机械销售；土地改良服务、农田水利工程施工；自营和代理各类商品和技术的进出口，但国家限定公司经营或禁止进出口的商品和技术除外。|
赤峰锟岳矿产品有限公司|高宏伟|15924560101|||内蒙古自治区赤峰市红山区东城办事处红山龙景小区西区2#楼05011号|610万|2012-05-02|注销|150401000003706||||有限责任公司(自然人投资或控股)(1130)|2012-05-02至2032-05-01|批发业||2015-08-04|610万|||赤峰市工商行政管理局红山区分局|||内蒙古自治区赤峰市红山区东城办事处红山龙景小区西区2#楼05011号附近公司|许可经营项目：无 一般经营项目：矿产品销售|
赤峰昊天运输有限公司|岳芳||||内蒙古自治区赤峰市红山物流园区1号楼01015（朝霞路中段路西）|100万人民币|2012-05-16|注销|150401000003851||||有限责任公司(自然人独资)|2012-05-16至无固定期限|道路运输业||2013-12-17||||赤峰市工商行政管理局经济开发区分局|||内蒙古自治区赤峰市红山物流园区1号楼01015（朝霞路中段路西）附近公司|许可经营项目：道路普通货物运输、大型物件运输（二类）（道路运输经营许可证有效期至2016年5月3日）。 一般经营项目：无 (依法须经批准的项目，经相关部门批准后方可开展经营活动)|
赤峰运联汽车救援有限责任公司|李树军||||红山区东城办事处红旗路居委会（远联钢铁厂北２００米）|100万人民币|2011-08-15|注销|150401000001831||||有限责任公司(自然人投资或控股)|2011-08-15至2031-08-14|道路运输业||2013-03-01||||赤峰市工商行政管理局经济开发区分局|||红山区东城办事处红旗路居委会（远联钢铁厂北２００米）附近公司|汽车救援服务。 (依法须经批准的项目，经相关部门批准后方可开展经营活动)|
红山经济开发区逯桂芝手机经销处|逯桂芝|13614866000|||红山区桥北唯美品格7号B-0212厅|1万人民币|2014-10-17|注销|150401600022519||||个体工商户||零售业||2018-06-27||||赤峰市工商行政管理局红山区分局|||红山区桥北唯美品格7号B-0212厅附近公司|许可经营项目：无 一般经营项目：手机、手机配件销售|
红山经济开发区尊雅家常美食城|李素令|18604768872|||赤峰市红山物流园区3号楼01011、01012（朝阳路中段路西千里马物流东侧）|80万人民币|2013-10-17|注销|150401600017787||||个体工商户||餐饮业||2016-09-02||||赤峰市工商行政管理局红山区分局|||赤峰市红山物流园区3号楼01011、01012（朝阳路中段路西千里马物流东侧）附近公司|许可经营项目：中型餐馆（不含凉菜、不含裱花蛋糕、不含生食海产品）（餐饮服务许可证有效期至2016年7月25日）（卫生许可证有效期至2017年7月25日）。 一般经营项目：无|
赤峰市品信投资咨询有限责任公司|杨洪广|13904766008|1810098608@qq.com||赤峰市红山区城郊乡东郊村三组东煤场南侧（金属公司墙东）|200万|2014-07-16|注销|150401000008366||||有限责任公司(自然人独资)(1151)|2014-07-16至无固定期限|商务服务业||2015-08-06||||赤峰市工商行政管理局红山区分局|||赤峰市红山区城郊乡东郊村三组东煤场南侧（金属公司墙东）附近公司|许可经营项目：无 一般经营项目：投资咨询、投资管理、信息咨询|
红山经济开发区永亮建材经销处|卞永亮||||赤峰市红山区小房村三组|1万人民币|2013-07-01|注销|150401600016341||||个体工商户||零售业||2014-03-24||||赤峰市工商行政管理局经济开发区分局|||赤峰市红山区小房村三组附近公司|许可经营项目：无 一般经营项目：建材销售|
赤峰华飞农机农民专业合作社|林梦华|15149098389|||赤峰市红山区红庙子镇郎家营子村五组21号|100万|2014-09-02|存续|150401NA000122X|93150402318423142F|318423142|93150402318423142F|农民专业合作社(9100)|2014-09-02至无固定期限|农、林、牧、渔服务业||2014-09-02||||赤峰市工商行政管理局红山区分局|||赤峰市红山区红庙子镇郎家营子村五组21号附近公司|许可经营项目：无 一般经营项目：组织购买销售农业机械；组织成员机械化生产、收割；为成员提供信息、技术、培训服务|
赤峰市弘驰汽车服务有限公司桥北分公司|张国明||||内蒙古自治区赤峰市红山物流园区汽配城４号楼０１０１４||2011-10-17|注销|150401000002019||||有限责任公司分公司(自然人独资)(2151)|2011-10-17至无固定期限|机动车、电子产品和日用产品修理业||2014-12-09||||赤峰市工商行政管理局经济开发区分局|||内蒙古自治区赤峰市红山物流园区汽配城４号楼０１０１４附近公司|许可经营项目：三类机动车维修（车身维修、涂漆）（道路运输经营许可证有效期至２０１５年９月１９日）。一般经营项目：|
赤峰泽隆投资管理有限责任公司|张艳华|13947620382|821444654@qq.com||赤峰市红山区桥北镇姚家洼居委会红山物流园区运通街北段路西（商贸城北）|570万|2014-06-11|注销|150401000008001||||有限责任公司(自然人投资或控股)(1130)|2014-06-11至无固定期限|商务服务业||2016-09-23||||赤峰市工商行政管理局红山区分局|||赤峰市红山区桥北镇姚家洼居委会红山物流园区运通街北段路西（商贸城北）附近公司|许可经营项目：无 一般经营项目：投资管理、投资信息咨询；风景园林建设工程专项设计；园林古建筑建设工程专业施工；装饰装修建设工程设计与施工，绿化养护；金属制品、机电设备批发、零售|赤峰泽隆投资管理有限责任公司成立于2014年06月11日，主要经营范围为许可经营项目：无一般经营项目：投资管理、投资信息咨询等。
