阿鲁科尔沁旗粮食总公司|徐钧|7213482|aqlsj2573@163.com||阿鲁科尔沁旗天山镇新区汉林西街路北|117万|1994-03-24|存续|150421000008839|911504217610831463|761083146|911504217610831463|全民所有制(3100)|1994-03-24至2024-03-24|批发业||2017-05-16||||阿鲁科尔沁旗工商行政管理局|||阿鲁科尔沁旗天山镇新区汉林西街路北附近公司|许可经营项目：无 一般经营项目：粮食及杂粮的收购|
内蒙古惠民畜牧科技有限公司|庄健|0476-7272600|jone_sm@qq.com||阿鲁科尔沁旗巴彦宝力格粮站后院|10000万|2012-02-08|存续|150421000024164|91150421MA0N303B3R|MA0N303B3|91150421MA0N303B3R|有限责任公司(自然人投资或控股)(1130)|2012-02-08至无固定期限|畜牧业||2017-08-09||||阿鲁科尔沁旗工商行政管理局|阿鲁科尔沁旗利贞肉食品加工有限公司||阿鲁科尔沁旗巴彦宝力格粮站后院附近公司|许可经营项目：无 一般经营项目：肉食品加工、销售；牛羊养殖、收购、销售；农产品种植购销；生态治理、农牧业科技研发、推广、应用；有机农牧业养殖、繁育；生态农牧业旅游开发；房地产开发建设；公司加农户的模式进行经营，精准扶贫|
内蒙古汉邦硒牧食品科技有限公司|郑宗玲|15947241579|||阿鲁科尔沁旗天山镇碧水佳苑|10000万|2017-07-11|存续|150421000044787|91150421MA0NETNQ21|MA0NETNQ2|91150421MA0NETNQ21|有限责任公司(自然人投资或控股)(1130)|2017-07-11至无固定期限|畜牧业||2018-04-26||||阿鲁科尔沁旗工商行政管理局|||阿鲁科尔沁旗天山镇碧水佳苑附近公司|饲料加工、生产、销售；生猪养殖、加工销售；富硒牛养殖、加工销售；食品制造、销售；水加工、销售|
赤峰润发驴业发展有限公司|常青林||||内蒙古自治区赤峰市阿鲁科尔沁旗天山镇太平庄呼和哈达村|10000万|2018-06-22|存续|150421020634262|91150421MA0PXBQM5W|MA0PXBQM5|91150421MA0PXBQM5W|有限责任公司(自然人独资)(1151)|2018-06-22至无固定期限|批发业||2018-06-22||||阿鲁科尔沁旗工商行政管理局|||内蒙古自治区赤峰市阿鲁科尔沁旗天山镇太平庄呼和哈达村附近公司|畜产品养殖|
内蒙古罕伦旅游文化有限公司|王国慧||||内蒙古自治区赤峰市阿鲁科尔沁旗巴彦花镇五一村|10000万|2019-01-25|存续||91150421MA0Q4YU22B|MA0Q4YU22|91150421MA0Q4YU22B|其他有限责任公司(1190)|2019-01-25至无固定期限|科技推广和应用服务业||2019-01-25||||阿鲁科尔沁旗工商行政管理局|||内蒙古自治区赤峰市阿鲁科尔沁旗巴彦花镇五一村附近公司|旅游项目开发、经营；旅游咨询；旅游项目策划服务；旅游管理服务；景区服务；会展服务；农业种植技术推广；餐饮、住宿服务；生物制品的研究、开发及技术转让、技术服务；养殖业投资；农业技术开发、转让；农副产品加工、技术开发、研究、转让；花卉、种子、肥料、农业机械、农具、农副产品销售；农业产业化示范种植；农业技术科技开发推广应用；观光农业开发；园林绿化；名贵树种苗木、花卉、草坪、盆景培育及销售；瓜果蔬菜、农作物的种植及销售；家禽养殖及销售|
阿鲁科尔沁旗米尔热力有限公司|陈继|010-80456069|||内蒙古自治区赤峰市阿鲁科尔沁旗天山路西南桥北|10000万|2018-07-09|存续|150421020672861|91150421MA0PXW9H38|MA0PXW9H3|91150421MA0PXW9H38|其他有限责任公司(1190)|2018-07-09至无固定期限|电力、热力生产和供应业||2019-03-18|180万|||阿鲁科尔沁旗工商行政管理局|||内蒙古自治区赤峰市阿鲁科尔沁旗天山路西南桥北附近公司|热力供应，天然气供暖服务，合同能源管理，电力供应，供暖设备销售，物业管理，城市生活垃圾清扫、收集、运输、处理；管道施工、管道维修、水暖管件销售。|
内蒙古国能矿业有限公司|李存生||||内蒙古自治区赤峰市阿鲁科尔沁旗巴彦温都尔苏木海拉苏嘎查|10000万|2019-05-30|存续||91150421MA0Q97DF40|MA0Q97DF4|91150421MA0Q97DF40|有限责任公司(自然人投资或控股)(1130)|2019-05-30至无固定期限|商务服务业||2019-05-30||||阿鲁科尔沁旗工商行政管理局|||内蒙古自治区赤峰市阿鲁科尔沁旗巴彦温都尔苏木海拉苏嘎查附近公司|矿业开发、企业营销与策划、资产管理。|
阿鲁科尔沁旗天山宾馆有限责任公司|付林|15149147776|123209910@qq.com||内蒙古赤峰市阿鲁科尔沁旗天山镇天元大街北罕乌拉西路西|1000万|2009-02-25|存续|150421000002510|9115042168343064XR|68343064X|9115042168343064XR|有限责任公司（非自然人投资或控股的法人独资）(1153)|2009-02-25至2029-02-25|住宿业||2019-02-26|1000万|||阿鲁科尔沁旗工商行政管理局|||内蒙古赤峰市阿鲁科尔沁旗天山镇天元大街北罕乌拉西路西附近公司|许可经营项目：餐饮、烟的销售、顾客住宿 一般经营项目：会议接待；出租车服务|
内蒙古原野集团现代农业科技有限公司|崔玉莲|15847499411|zl13704145600@163.com||阿旗天山镇敖木伦街西胜利路南|20000万|2010-08-17|存续|150421000005320|91150421558147976N|558147976|91150421558147976N|有限责任公司(自然人投资或控股)(1130)|2010-08-17至2030-08-16|零售业||2018-03-06|1200万|||阿鲁科尔沁旗工商行政管理局|内蒙古原野现代农业科技有限公司||阿旗天山镇敖木伦街西胜利路南附近公司|开采、加工及销售草炭土；自营和代理进出口商品和技术；普通道路交通运输；生产经营农林牧副渔产品及人类社会所需要产品生产、经营所需的各种生产资料；各种农牧副渔的深加工；绿化工程|
内蒙古泽瀚农畜科技发展有限公司|庄健|13804761921|1154140297@qq.com||阿鲁科尔沁旗巴彦温都尔苏木吉布图嘎查|10000万|2011-08-18|注销|150421000023934|91150421328966554P|328966554|91150421328966554P|有限责任公司(自然人投资或控股)(1130)|2011-08-18至无固定期限|畜牧业||2017-11-08||||阿鲁科尔沁旗工商行政管理局|阿鲁科尔沁旗巴彦包力格鲁香肉业有限公司["阿鲁科尔沁旗巴彦包力格鲁香肉业有限公司","内蒙古一木农畜科技发展有限公司"]查看更多||阿鲁科尔沁旗巴彦温都尔苏木吉布图嘎查附近公司|许可经营项目：无 一般经营项目：肉食品加工销售、牛羊收购销售；畜牧业科技研发推广、有机农牧业养殖繁育；生态农牧业旅游开发；房地产开发建设|
阿鲁科尔沁旗白吉拉养殖专业合作社|希尼巴雅尔|13847606176|||阿鲁科尔沁旗天山镇新城区天元大街南学苑路西赛罕小区楼下|1800万|2014-01-15|存续|150421NA000952X|93150421MA0MWQGN22|MA0MWQGN2|93150421MA0MWQGN22|农民专业合作社(9100)||畜牧业||2016-01-11||||阿鲁科尔沁旗工商行政管理局|||阿鲁科尔沁旗天山镇新城区天元大街南学苑路西赛罕小区楼下附近公司|许可经营项目：无 一般经营项目：培育速马及马奶、马血、马奶酒、民族马传统产业；旅游文化；畜牧业产业化经营、农机作业、农机服务、农产品种植购销|
赤峰市天山养殖专业联合社|秦东升|13694769888|||阿鲁科尔沁旗新民乡双山村|900万|2016-12-23|存续|150421NA001751X|93150421MA0N26MR65|MA0N26MR6|93150421MA0N26MR65|农民专业合作社(9100)||畜牧业||2016-12-23||||阿鲁科尔沁旗工商行政管理局|||阿鲁科尔沁旗新民乡双山村附近公司|牛羊养殖、畜牧产业化经营、育肥、改良协调、育肥牛羊销售；信息服务、饲草料经营、农产品种植加工销售；农机作业、农机服务；|
阿鲁科尔沁旗惠民合作社联合社|易国军||2912143351@qq.com||阿鲁科尔沁旗天山镇天元大街东段|1000万|2013-05-26|存续|150421NA001458X|93150421329109933U|329109933|93150421329109933U|农民专业合作社(9100)||农业||2016-04-13||||阿鲁科尔沁旗工商行政管理局|||阿鲁科尔沁旗天山镇天元大街东段附近公司|农产品种植、加工、购销；畜牧业产业化经营；农机作业、农机服务|
阿鲁科尔沁旗市政公用有限公司|马立钧|0476-7272211|406513159@qq.com||阿鲁科尔沁旗住房和城乡建设局办公楼四楼|8000万|2017-06-26|存续|150421000044504|91150421MA0NDYRR4E|MA0NDYRR4|91150421MA0NDYRR4E|有限责任公司(国有独资)(1110)|2017-06-26至无固定期限|公共设施管理业||2017-08-25|8000万|||阿鲁科尔沁旗工商行政管理局|||阿鲁科尔沁旗住房和城乡建设局办公楼四楼附近公司|供水、供热城市公用设施投资建设管理、棚户区改造保障性安居工程投资建设管理、市政基础设施投资建设管理、园林绿化工程建设管理、物业服务|
内蒙古旭阳光热发电有限公司|刘静静||||内蒙古自治区赤峰市阿鲁科尔沁旗巴拉奇如德苏木|8000万|2019-04-12|存续||91150421MA0Q78PJ5N|MA0Q78PJ5|91150421MA0Q78PJ5N|有限责任公司(自然人独资)(1151)|2019-04-12至无固定期限|电力、热力生产和供应业||2019-04-12||||阿鲁科尔沁旗工商行政管理局|||内蒙古自治区赤峰市阿鲁科尔沁旗巴拉奇如德苏木附近公司|光热发电生产、销售|
赤峰久源实业有限责任公司|斯琴|18704761599|425082340@qq.com||阿鲁科尔沁旗天山镇|2600万|2010-01-07|存续|150421000003998|91150421699455454W|699455454|91150421699455454W|有限责任公司(自然人投资或控股)(1130)|2010-01-07至2030-01-06|批发业||2017-02-07|2600万|||阿鲁科尔沁旗工商行政管理局|||阿鲁科尔沁旗天山镇附近公司|许可经营项目：一般经营项目：项目投资；建材销售|
阿鲁科尔沁旗天山口镇万华农牧机械专业合作社|王树海|13848877643|||阿鲁科尔沁旗天山口镇白城子村|4356.991万|2013-12-17|注销|150421NA000862X|931504210925956531|092595653|931504210925956531|农民专业合作社(9100)||农业||2019-03-15||||阿鲁科尔沁旗工商行政管理局|||阿鲁科尔沁旗天山口镇白城子村附近公司|农产品种植、农牧产品购销、畜牧产业化经营、农机作业、农机服务|
阿鲁科尔沁旗扎嘎斯台镇农牧专业合作社|图门乌力吉||||阿鲁科尔沁镇扎嘎斯台镇政府所在地|7650万|2017-07-31|存续|150421NA002130X|93150421MA0NFRU713|MA0NFRU71|93150421MA0NFRU713|农民专业合作社(9100)||畜牧业||2017-07-31||||阿鲁科尔沁旗工商行政管理局|||阿鲁科尔沁镇扎嘎斯台镇政府所在地附近公司|畜牧业产业化经营、农产品种植、购销、农机作业、农机服务|
巴林左旗普惠城乡统筹发展建设投资有限公司|李树清|13304765598|||巴林左旗林东西城区契丹大街路北隆昌路路西林业局西侧|10000万|2015-09-07|存续|150422000019841|91150422353125669Q|353125669|91150422353125669Q|有限责任公司（非自然人投资或控股的法人独资）(1153)|2015-09-07至无固定期限|商务服务业||2019-04-18|10000万|||巴林左旗市场监督管理局|||巴林左旗林东西城区契丹大街路北隆昌路路西林业局西侧附近公司|许可经营项目：无 一般经营项目：公共基础设施建设项目投资与经营管理、棚户区改造项目投资、环境治理项目投资与经营管理|
赤峰京都商贸有限公司|王军|18747186699|ziyouchenfei@foxmail.com||内蒙古自治区赤峰市巴林左旗林东西城区健元路中段路东|5000万|2010-01-25|存续|150422000009549|911504226994699526|699469952|911504226994699526|有限责任公司(自然人投资或控股)(1130)|2010-01-25至2040-01-24|批发业||2016-03-24|5000万|||巴林左旗市场监督管理局|||内蒙古自治区赤峰市巴林左旗林东西城区健元路中段路东附近公司|建材、矿产品、机械设备、五金、交电、电子产品、家用电器销售；住宿、正餐服务（分公司经营）|赤峰京都商贸有限公司成立于2010年01月25日，主要经营范围为建材、矿产品、机械设备、五金、交电、电子产品、家用电器销售等。
沈阳裕腾集团林东石油化工有限公司|马金宝||||内蒙古自治区赤峰市林东镇振兴大街西大桥路北|685万|1997-11-28|吊销|1504221000070||||有限责任公司|2001-11-28至2003-12-30|化学原料和化学制品制造业||2004-11-28||||巴林左旗市场监督管理局|||内蒙古自治区赤峰市林东镇振兴大街西大桥路北附近公司|热固性树脂制造销售＊＊＊ (依法须经批准的项目，经相关部门批准后方可开展经营活动)|
内蒙古林源鹿业有限责任公司|吴群利|18647602727|1015367805@qq.com||巴林左旗林东镇（赛林勿苏特色工业园区）|2000万|1999-11-24|存续|150422000003656|911504227012934085|701293408|911504227012934085|有限责任公司(自然人投资或控股)(1130)|1999-11-24至2029-11-23|畜牧业||2018-12-25||||巴林左旗市场监督管理局|赤峰市巴林左旗林源鹿业有限责任公司["赤峰市巴林左旗林源鹿业有限责任公司","赤峰市巴林左旗淋源鹿业有限责任公司"]查看更多|Linyuan Deer Industry Co.,Ltd.|巴林左旗林东镇（赛林勿苏特色工业园区）附近公司|许可经营项目：马鹿驯养； 一般经营项目：工艺品制造销售；农畜产品（不含粮食）购销；（以下分支机构经营）配制酒制造销售；鹿产品销售|
巴林左旗阿鲁召景区建设有限公司|徐伟杰|15847498898|||巴林左旗林东西城区滨河大街8号（翡翠尚景6号楼2单元1801厅）|6653.12万|2017-09-19|存续|150422000030304|91150422MA0NJCQ50T|MA0NJCQ50|91150422MA0NJCQ50T|其他有限责任公司(1190)|2017-09-19至无固定期限|商务服务业||2017-09-19|2200万|||巴林左旗市场监督管理局|||巴林左旗林东西城区滨河大街8号（翡翠尚景6号楼2单元1801厅）附近公司|许可经营项目：无 一般经营项目：古建筑工程服务；娱乐设施工程服务；园林绿化工程服务；房屋建筑；室外娱乐设施工程施工；景观和绿地设施工程施工；公园、园林土地平整；假山、假石人造景观及公园索道施工；旅行社管理服务；向旅客提供旅行、旅游、交通、住宿、餐饮代理服务；餐饮服务；度假村住宿服务；旅游饭店服务；酒吧服务；旅客票务代理；工艺品（不含文物）销售；国内旅游经营服务|
内蒙古契丹王朝文化产业有限公司|吴梦竹|0476-5811188|448265251@qq.com||巴林左旗林东西城区富河路6号(富河假日酒店后）|100万|2016-12-29|存续|150422000025991|91150422MA0N38KG45|MA0N38KG4|91150422MA0N38KG45|有限责任公司(国有控股)(1140)|2016-12-29至无固定期限|文化艺术业||2016-12-29||||巴林左旗市场监督管理局|||巴林左旗林东西城区富河路6号(富河假日酒店后）附近公司|许可经营项目：无 一般经营项目：文艺创作与表演；文化艺术产业投资活动；艺术培训；文化产品展览服务；文艺演出、艺术展览的经纪代理服务；旅游信息咨询服务；动漫产品设计服务；广告设计、制作、代理、发布；景区门票票务代理；商业用房、办公用房租赁；酒店管理、会议服务；工艺品零售|
内蒙古华宇矿业开发有限责任公司|王伟|0476-7892358|1043051041@qq.com||赤峰市巴林左旗林东镇二道街东段路北２９号|100万|2005-07-14|存续|150105000021844|911504227761298218|776129821|911504227761298218|有限责任公司(自然人投资或控股)(1130)|2005-07-14至2035-07-13|商务服务业||2015-11-30|100万|||巴林左旗市场监督管理局|||赤峰市巴林左旗林东镇二道街东段路北２９号附近公司|矿业开发咨询；矿产品销售|
赤峰金帆再生资源开发有限公司|耿兵|13947651818|||巴林左旗林东西城区契丹大街252号（工业园区管理办公室214至215室）|6000万|2017-06-30|存续|150422000029040|91150422MA0NEA028T|MA0NEA028|91150422MA0NEA028T|有限责任公司(自然人投资或控股)(1130)|2017-06-30至2037-06-29|废弃资源综合利用业||2017-06-30||||巴林左旗市场监督管理局|||巴林左旗林东西城区契丹大街252号（工业园区管理办公室214至215室）附近公司|许可经营项目：无 一般经营项目：有色金属废料和碎屑、废电池、非金属废料和碎屑加工、处理、销售；铅酸蓄电池加工、制造、销售|
赤峰市万行再生资源开发有限公司|孙凤阁|13947651818|||内蒙古自治区赤峰市巴林左旗林东西城契丹大街252号（工业园区办公室215室）|6000万|2018-12-07|存续||91150422MA0Q3K466G|MA0Q3K466|91150422MA0Q3K466G|有限责任公司(自然人独资)(1151)|2018-12-07至2038-12-06|废弃资源综合利用业||2018-12-07|6000万|||巴林左旗市场监督管理局|||内蒙古自治区赤峰市巴林左旗林东西城契丹大街252号（工业园区办公室215室）附近公司|金属废料和碎屑加工处理；非金属废料和碎屑加工处理；再生资源回收与批发（不含固体废物、危险废物、报废汽车等需经相关部门批准的项目）。|
赤峰鲁蒙特种水泥有限公司|周海|7785789|287261149@sian.com||巴林左旗白音勿拉苏木要尔亚嘎查258号|8000万|2005-10-17|存续|150422000006415|91150422779480166U|779480166|91150422779480166U|有限责任公司(自然人投资或控股的法人独资)(1152)|2005-10-17至2035-10-16|非金属矿物制品业||2019-05-15|5000万|||巴林左旗市场监督管理局|||巴林左旗白音勿拉苏木要尔亚嘎查258号附近公司|许可经营项目： 水泥制造、销售；石灰石开采销售，一般经营项目：水泥熟料销售；餐饮服务（单位食堂）。|赤峰鲁蒙特种水泥有限公司成立于2005年10月17日，主要经营范围为许可经营项目：水泥制造、销售等。
巴林左旗蔚然热力有限责任公司|杨秀钢|5619005|762938643@qq.com||内蒙古赤峰市巴林左旗林东镇东白音高洛村278号（303国道路北）|8000万|2017-03-22|存续|150422000027028|91150422MA0N6X9J3A|MA0N6X9J3|91150422MA0N6X9J3A|有限责任公司（非自然人投资或控股的法人独资）(1153)|2017-03-22至无固定期限|电力、热力生产和供应业||2018-12-18||||巴林左旗市场监督管理局|||内蒙古赤峰市巴林左旗林东镇东白音高洛村278号（303国道路北）附近公司|许可经营项目：无 一般经营项目：热力生产和供应|
内蒙古中金岭南有色金属有限公司|魏占泉|18604769656|2445530771@qq.com||巴林左旗林东东城区上京路中段(原经贸局)|88000万|2014-06-10|存续|150422000015936|91150422399332153D|399332153|91150422399332153D|有限责任公司（非自然人投资或控股的法人独资）(1153)|2014-06-10至2044-06-09|批发业||2017-12-27||||巴林左旗市场监督管理局|||巴林左旗林东东城区上京路中段(原经贸局)附近公司|许可经营项目：无 一般经营项目：矿产品、机械设备（不含品牌汽车）销售；矿业投资、矿业技术咨询服务；矿山机械出租|内蒙古中金岭南有色金属有限公司于2014年06月10日在巴林左旗工商行政管理局登记成立。法定代表人高杨，公司经营范围包括许可经营项目：无一般经营项目：矿产品、机械设备（不含品牌汽车）销售等。
巴林左旗农村信用合作联社|凌志勇|0476-7867819|||赤峰市巴林左旗林东西城区振兴大街西段(武装部西侧)|3231.3万|2007-08-25|存续|150422000001028|91150422814960692C|814960692|91150422814960692C|股份合作制(3400)|2007-08-25至无固定期限|货币金融服务||2016-04-28||100-499人|399|巴林左旗市场监督管理局||Balinzuo Rural Redit Cooperatives Union|赤峰市巴林左旗林东西城区振兴大街西段(武装部西侧)附近公司|许可经营项目：存款、贷款、票据贴现、国内结算业务；办理个人储蓄业务；代理其他银行的金融业务；代理收付款项及受托代办保险业务，买卖政府债券；代理发行、代理兑付、承销政府债券；提供保险箱业务；经中国银行业监督管理委员会批准的其他业务。 一般经营项目：无|
巴林左旗高力养殖专业合作社|贺什格||||巴林左旗查干哈达苏木高勒艾里嘎查|100万|2011-01-10|存续|150422NA000135X|93150422097816048U|097816048|93150422097816048U|农民专业合作社(9100)||畜牧业||2014-04-18||||巴林左旗市场监督管理局|||巴林左旗查干哈达苏木高勒艾里嘎查附近公司|许可经营项目：牛的饲养销售。 一般经营项目：无|
巴林左旗强民种植专业合作社|仝景玉|13171365467|419698748@qq.com||巴林左旗林东东城区东河路中段路西|20万|2010-11-15|存续|150422NA000124X|93150422570637142R|570637142|93150422570637142R|农民专业合作社(9100)|2010-11-15至无固定期限|农业||2019-01-30||||巴林左旗市场监督管理局|||巴林左旗林东东城区东河路中段路西附近公司|许可经营项目：无 一般经营项目：一般经营项目：谷物种植。（法律、行政法规、国务院决定规定应经许可的，未获许可不得生产经营）|
巴林左旗查干哈达苏木曙光养殖专业合作社|额尔得莫吐||||巴林左旗查干哈达苏木前召嘎查|23万|2011-04-20|注销|150422NA000141X|93150422MA0N2FR792|MA0N2FR79|93150422MA0N2FR792|农民专业合作社(9100)||畜牧业||2017-05-03||||巴林左旗市场监督管理局|||巴林左旗查干哈达苏木前召嘎查附近公司|许可经营项目：羊的饲养、销售； 一般经营项目：组织采购、供应成员所需的饲料|
巴林左旗金阳光煤炭销售有限公司|周环宇|13789696444|||内蒙古自治区赤峰市巴林左旗林东镇工业园区内|500万|2006-01-20|存续|150422000000531|91150422783021181R|783021181|91150422783021181R|有限责任公司(自然人独资)(1151)|2006-01-20至2026-01-19|批发业||2019-03-28||||巴林左旗市场监督管理局|||内蒙古自治区赤峰市巴林左旗林东镇工业园区内附近公司|许可经营项目：无 一般经营项目：煤炭、矿产品销售；建筑工程机械及设备租赁服务；房屋租赁服务|巴林左旗金阳光煤炭销售有限公司成立于2006年01月20日，主要经营范围为许可经营项目：煤炭销售（许可证有效期至2013年4月30日）销售等。
赤峰巨鹏房地产开发有限公司|张铠麟|13848065678|||内蒙古自治区赤峰市巴林左旗林东镇上京工业园区|2000万|2010-07-09|存续|150422000010029|91150422558113880R|558113880|91150422558113880R|有限责任公司(自然人投资或控股)(1130)|2010-07-09至2030-07-08|房地产业||2016-04-16|2000万|||巴林左旗市场监督管理局|巴林左旗金鼎房地产开发有限责任公司||内蒙古自治区赤峰市巴林左旗林东镇上京工业园区附近公司|许可经营项目：无 一般经营项目：房地产开发经营|赤峰巨鹏房地产开发有限公司成立于2010年07月09日，主要经营范围为许可经营项目：无一般经营项目：房地产开发经营等。
赤峰建青劳务分包有限公司|杨建英|13310393328|||巴林左旗林东西城振兴大街553-9号（新城雅居2幢）|5000万|2017-11-08|存续|150422000030976|91150422MA0NLRTB0R|MA0NLRTB0|91150422MA0NLRTB0R|有限责任公司(自然人独资)(1151)|2017-11-08至2037-11-07|房屋建筑业||2017-12-05||||巴林左旗市场监督管理局|||巴林左旗林东西城振兴大街553-9号（新城雅居2幢）附近公司|许可经营项目：无 一般经营项目：承担各类工程木工、砌筑、抹灰、石制、油漆、钢筋、混凝土、脚手架、模板、焊接、水暖电安装作业分包业务；园林绿化工程施工；土木工程建筑；室内、外装饰装修服务；旅游项目策划、咨询服务；公路工程建筑；土石方工程服务；普通货物道路运输活动；汽车检修服务。|
内蒙古焕然农产品销售有限公司|王焕然|15149098111|||巴林左旗林东镇东井沟村2队8号|5000万|2017-09-20|存续|150422000030345|91150422MA0NJETL6N|MA0NJETL6|91150422MA0NJETL6N|有限责任公司(自然人投资或控股)(1130)|2017-09-20至2037-09-19|批发业||2017-09-20||||巴林左旗市场监督管理局|||巴林左旗林东镇东井沟村2队8号附近公司|许可经营项目：无 一般经营项目：畜产品、农副产品、蔬菜、粮食收购、销售|
赤峰市巴林红惠牧草业有限公司|常立田|15032383888|406323629@qq.com||内蒙古自治区赤峰市巴林右旗巴彦塔拉苏木|1000万|2016-07-18|存续|150423000023117|91150423MA0MYDE238|MA0MYDE23|91150423MA0MYDE238|有限责任公司（非自然人投资或控股的法人独资）(1153)|2016-07-18至无固定期限|农、林、牧、渔服务业||2016-07-18||||巴林右旗工商行政管理局|||内蒙古自治区赤峰市巴林右旗巴彦塔拉苏木附近公司|牧草的种植、收购、加工、销售|
