内蒙古盛藏能源科技有限公司|王爱君|15647622999|||内蒙古自治区赤峰市巴林右旗大板镇查干沐沦街西街25-2号|12000万|2017-06-23|注销|150423000027241|91150423MA0NDT9PXY|MA0NDT9PX|91150423MA0NDT9PXY|有限责任公司(自然人投资或控股)(1130)|2017-06-23至无固定期限|电力、热力生产和供应业||2018-10-30||||巴林右旗工商行政管理局|||内蒙古自治区赤峰市巴林右旗大板镇查干沐沦街西街25-2号附近公司|光伏发电；光伏发电项目开发、设计、推广、收购、转让、合作；光伏技术和业务咨询服务|
巴林右旗祥达城市基础设施投资发展有限公司|萨日娜|0476-6220701|270792144@qq.com||内蒙古自治区赤峰市巴林右旗大板镇大板街罕山路西段南侧|13810万|2006-06-26|存续|150423000002951|911504237971529597|797152959|911504237971529597|有限责任公司(国有独资)(1110)|2006-06-26至2056-06-25|商务服务业||2019-04-10|13800万|小于50人|1|巴林右旗工商行政管理局|||内蒙古自治区赤峰市巴林右旗大板镇大板街罕山路西段南侧附近公司|许可经营项目：无 一般经营项目：投资与资产管理；城市基础建设资金的筹措；城市基础设施建设的投资、发展、经营管理；实施土地收购、储备及出让前期开发服务；河道采砂、河湖整理、建筑材料采购。|巴林右旗祥达城市基础设施投资发展有限公司成立于2006年06月26日，主要经营范围为许可经营项目：无一般经营项目：投资与资产管理等。
赤峰环连工贸有限公司|魏亮|13947613396|cfjtgs@163.com||赤峰市巴林右旗大板镇四区大板街北|400万|2009-09-17|存续|150402000020795|91150423692884416T|692884416|91150423692884416T|有限责任公司(自然人投资或控股)(1130)|2009-09-17至2029-12-31|批发业||2019-04-17||||巴林右旗工商行政管理局|||赤峰市巴林右旗大板镇四区大板街北附近公司|许可经营项目：无 一般经营项目：工业毛刷、纺织器材加工销售；建材、五金交电、土产日杂销售；荒山绿化；农作物种植；机械设备维修；土石方工程；矿产品开采、加工、销售（凭许可证有效期内经营）|赤峰环连工贸有限公司成立于2009年09月17日，主要经营范围为工业毛刷、纺织器材加工销售等。
巴林右旗恩泽农林科技发展有限公司|王彦斌|18847675200|||内蒙古自治区赤峰市巴林右旗大板镇四区查干沐沦街东段北侧|10000万|2017-09-21|存续|150423000028349|91150423MA0NJHH063|MA0NJHH06|91150423MA0NJHH063|一人有限责任公司(1150)|2017-09-21至无固定期限|科技推广和应用服务业||2018-09-03||||巴林右旗工商行政管理局|||内蒙古自治区赤峰市巴林右旗大板镇四区查干沐沦街东段北侧附近公司|林木育种和育苗、造林治沙、森林病虫害防治服务；农作物、蔬菜、水果、花、草、苗木种植销售；畜牧业养殖销售；农林产品开发及技术服务；农业科技技术咨询；文化艺术交流策划、会务服务、展览展示；广告设计、制作、代理、发布；商务信息咨询、投资信息咨询；自营和代理各类商品和技术的进出口|
内蒙古新征程农业有限公司|王爱军||||内蒙古自治区赤峰市巴林右旗大板镇五区益和诺儿街东段南侧|10000万|2018-03-28|存续||91150423MA0PRWCX0A|MA0PRWCX0|91150423MA0PRWCX0A|有限责任公司(自然人投资或控股的法人独资)(1152)|2018-03-28至无固定期限|商务服务业||2018-04-02||||巴林右旗工商行政管理局|||内蒙古自治区赤峰市巴林右旗大板镇五区益和诺儿街东段南侧附近公司|盐碱地改造、综合治理、开发；旅游景区开发、建设、经营；管理景区内相关配套服务、会议服务、旅游咨询服务、旅游项目策划服务、景区游览服务、旅游纪念品开发销售 ；畜禽良种繁育、养殖与销售、畜牧业技术咨询服务；地下温泉资源开发；盐碱地特色小镇建设。|
巴林右旗凌水温泉酒店有限责任公司|赵铁军||||内蒙古自治区赤峰市巴林右旗大板镇巴林路南段东侧|10000万|2018-04-28|存续|150423020489295|91150423MA0PU96KXX|MA0PU96KX|91150423MA0PU96KXX|有限责任公司（非自然人投资或控股的法人独资）(1153)|2018-04-28至无固定期限|餐饮业||2019-03-13||||巴林右旗工商行政管理局|||内蒙古自治区赤峰市巴林右旗大板镇巴林路南段东侧附近公司|住宿服务、餐饮服务、酒吧服务、茶吧服务、咖啡吧、KTV服务、洗浴服务、会议会展服务、理发美容服务、体育健身服务、商务庆典、婚庆礼仪服务、企业管理服务、停车场服务、文化活动组织策划；食品、饮料、烟酒、日用品、工艺品销售；旅游开发建设、旅游业服务、旅游纪念品销售。|
巴林右旗国有资本运营有限责任公司|李长春||||内蒙古自治区赤峰市巴林右旗索博日嘎街北投资促进服务中心3楼|10000万|2019-04-26|存续||91150423MA0Q7WTHXE|MA0Q7WTHX|91150423MA0Q7WTHXE|有限责任公司(国有独资)(1110)|2019-04-26至2039-04-25|商务服务业||2019-04-26||||巴林右旗工商行政管理局|||内蒙古自治区赤峰市巴林右旗索博日嘎街北投资促进服务中心3楼附近公司|城市基础设施项目投资、经营、管理；土地的收购、储备、管理；房地产开发与经营；房屋租赁；物业管理；实业投资、资产经营与管理、现代办公设备、计算机及相关产品销售与维修、计算机网络集成与维护、网络产品销售，文化、旅游、体育项目投资、建设、管理；景区建设、管理；旅游饭店建设、管理；旅游纪念品生产、销售，旅游培训、文艺演出；农产品生产、加工、销售；汽车租赁。|
巴林右旗巴林石集团有限责任公司|杨春广|0476-6222228|191358482@qq.com||内蒙古自治区赤峰市巴林右旗大板镇查干沐沦街中段|5000万|1998-07-16|存续|150423000002566|91150423114982874Q|114982874|91150423114982874Q|有限责任公司(自然人投资或控股)(1130)|1998-07-16至2048-07-15|文教、工美、体育和娱乐用品制造业||2015-11-09|5000万|||巴林右旗工商行政管理局|||内蒙古自治区赤峰市巴林右旗大板镇查干沐沦街中段附近公司|巴林石及工艺雕刻品、高岭土、重钙、硅藻土精加工|巴林右旗巴林石集团有限责任公司成立于1998年07月16日，主要经营范围为巴林石及工艺雕刻品、高岭土、重钙、硅藻土精加工等。
赤峰市巴林红食品有限公司|常立田|15032383888|406323629@qq.com||赤峰市巴林右旗巴彦塔拉苏木|5000万|2013-05-15|存续|150423000011108|911504230675322633|067532263|911504230675322633|有限责任公司(自然人独资)(1151)|2013-05-15至2033-05-14|食品制造业||2017-05-11|400万|小于50人|1|巴林右旗工商行政管理局|||赤峰市巴林右旗巴彦塔拉苏木附近公司|许可经营项目：无 一般经营项目：甜玉米、青豆、五谷杂粮、肉类加工、销售及冷冻、冷却、排酸；青储饲料收购、罐头产品、速冻产品、加工及销售|赤峰市巴林红食品有限公司成立于2013年05月15日，主要经营范围为许可经营项目：无一般经营项目：甜玉米加工、销售（凭许可证经营）等。
林西县兴旺种养殖农民专业合作社|赵江||||内蒙古自治区赤峰市林西县大营子乡和平村|100万|2017-12-19|存续||93150424MA0NPDRW36|MA0NPDRW3|93150424MA0NPDRW36|农民专业合作社(9100)||畜牧业||2017-12-19||||林西县市场监督管理局大营子乡市场监督管理所|||内蒙古自治区赤峰市林西县大营子乡和平村附近公司|组织成员开展规模化肉驴、肉牛、肉羊养殖销售。组织采购、供应成员所需的农机具产品。提供信息技术、维修、培训、咨询等服务，引进农机新技术 新品种开发技术与交流。组织成员开展规模化农作物种植；收购本社成员及同类生产者生产的产品，开展市场营销；采购供应成员所需生产资料、生活资料；引进新技术、新品种，开展技术培训、技术交流和咨询服务。|
林西北斗星科技有限公司|路春祥|15037712611|601534934@qq.com||内蒙古赤峰市林西县东台子工业园区|50000万|2017-11-06|存续|150424000023961|91150424MA0NLK1M31|MA0NLK1M3|91150424MA0NLK1M31|有限责任公司(自然人投资或控股)(1130)|2017-11-06至无固定期限|科技推广和应用服务业||2017-11-06|100万|||林西县市场监督管理局|||内蒙古赤峰市林西县东台子工业园区附近公司|许可经营项目：无 一般经营项目：大数据中心建设、资源整合、应用开发和运营、跨领域数据融合；数据采集、存储、开发、处理、服务和销售；信息系统集成服务、数据服务平台建设、电子商务信息服务；智慧农业建设方案定制、研发推广应用及技术咨询转让；数码园区建设、房屋土地开发建设、出租、设备转让；计算机培训、云计算工程；技术开发、技术转让、技术培训、技术服务、企业管理、企业咨询|
内蒙古吉强建筑工程有限公司|郑岁安|15800863587|||内蒙古自治区赤峰市林西县林西镇中昊物流园区6号楼9号厅|31000万|2018-02-05|存续|150424020292443|91150424MA0PQKR83D|MA0PQKR83|91150424MA0PQKR83D|有限责任公司(自然人投资或控股)(1130)|2018-02-05至2028-02-04|房屋建筑业||2018-02-05||||林西县市场监督管理局|||内蒙古自治区赤峰市林西县林西镇中昊物流园区6号楼9号厅附近公司|土石方工程；建筑劳务；园林绿化工程；建筑装饰装潢；钢结构；水利安装工程；道路运输；市政工程；机电设备安装工程；水电安装工程。|
内蒙古佰惠生股权投资管理中心（有限合伙）|宿彦良|15047609050|278628129@qq.com||林西县南门外工业园区冷山糖业有限责任公司办公楼内||2015-06-26|存续|150424000016405|911504243413091299|341309129|911504243413091299|有限合伙企业(4533)|2015-06-26至无固定期限|商务服务业||2016-07-06||||林西县市场监督管理局|||林西县南门外工业园区冷山糖业有限责任公司办公楼内附近公司|许可经营项目：无 一般经营项目：股权投资服务与管理|
林西华龙矿业有限公司|王彦军|15149091574|316117251@qq.com||林西县工业园区一号路北侧|10360万|2010-07-07|存续|150424000007413|911504245581107003|558110700|911504245581107003|有限责任公司(自然人独资)(1151)|2010-07-07至2030-07-06|批发业||2016-12-29|10360万|||林西县市场监督管理局|赤峰华龙矿业集团有限公司||林西县工业园区一号路北侧附近公司|许可经营项目：萤石（普通）开采；无水氟化氢及副产品生产、销售。 一般经营项目：萤石选矿、购销；煤炭购销|
内蒙古蒙美新材料有限公司|牛庆君|18699407766|||内蒙古自治区赤峰市林西县金鼎工业园区|20000万|2018-12-05|存续||91150424MA0Q3G2L5P|MA0Q3G2L5|91150424MA0Q3G2L5P|有限责任公司(自然人投资或控股)(1130)|2018-12-05至无固定期限|科技推广和应用服务业||2018-12-05||||林西县市场监督管理局|||内蒙古自治区赤峰市林西县金鼎工业园区附近公司|新材料技术研发、产品试验、生产、销售；技术服务与推广。|
林西县生态农业扶贫产业项目管理有限公司|倪培臣|18704743333|||内蒙古赤峰林西县金鼎工业园区|2000万|2017-03-16|存续|150424000021655|91150424MA0N6GFY87|MA0N6GFY8|91150424MA0N6GFY87|有限责任公司(自然人投资或控股的法人独资)(1152)|2017-03-16至无固定期限|商务服务业||2018-07-13|2000万|||林西县市场监督管理局|||内蒙古赤峰林西县金鼎工业园区附近公司|项目开发、运营服务；商业运营；公路建设；园林绿化施工、养护管理；仿古建筑工程施工。|
内蒙古萤镁化工科技有限公司|李丽||||内蒙古自治区赤峰市林西县东台子工业园区内|18000万|2018-12-10|存续||91150424MA0Q3L9J7G|MA0Q3L9J7|91150424MA0Q3L9J7G|一人有限责任公司(1150)|2018-12-10至无固定期限|批发业||2018-12-10||||林西县市场监督管理局|||内蒙古自治区赤峰市林西县东台子工业园区内附近公司|液体生物有机肥、固体生物有机镁肥；铅、锌、萤石分离浮选；萤石球制作；人工合成装饰板材；水泥制品、蛇纹石、萤石工艺品制作；物流配送。|
内蒙古三川绒业有限公司|崔杰||||内蒙古自治区赤峰市林西县赤峰市宏业羊绒纺纱有限责任公司院内|15000万|2018-06-26|存续|150424020640239|91150424MA0PXE9A7K|MA0PXE9A7|91150424MA0PXE9A7K|有限责任公司(自然人投资或控股)(1130)|2018-06-26至无固定期限|皮革、毛皮、羽毛及其制品和制鞋业||2018-06-26||||林西县市场监督管理局|||内蒙古自治区赤峰市林西县赤峰市宏业羊绒纺纱有限责任公司院内附近公司|各类绒毛、纺织制品、机织制品、针织制品生产加工、运输和销售。各类绒毛收购及企业所需的技术、机械设备零部件、原辅材料等进出口贸易。|
内蒙古统壹绒业控股有限公司|刘吉国|0476-5839113|tyjt_xzb@126.com||林西县宏林工业园区|5000万|2008-01-29|存续|150424000000952|91150424670666370G|670666370|91150424670666370G|有限责任公司(自然人投资或控股)(1130)|2008-01-29至无固定期限|皮革、毛皮、羽毛及其制品和制鞋业||2019-05-23|5000万|||林西县市场监督管理局|林西县统壹工贸有限责任公司["林西县统壹工贸有限责任公司","林西县统壹商贸有限责任公司"]查看更多||林西县宏林工业园区附近公司|许可经营项目：无 一般经营项目：各类绒毛收购，各类绒毛.纺织制品、机织制品、针织制品生产加工、销售及企业所需的技术、机械设备、零部件、原辅材料等进出口贸易；投资管理|
内蒙古天瑞峰新能源科技开发有限公司|黄鹏明||||内蒙古自治区赤峰市林西县东台子工业园区|13000万|2018-09-10|存续||91150424MA0Q0TGB1J|MA0Q0TGB1|91150424MA0Q0TGB1J|有限责任公司(自然人投资或控股)(1130)|2018-09-10至无固定期限|电力、热力生产和供应业||2018-09-10||||林西县市场监督管理局|||内蒙古自治区赤峰市林西县东台子工业园区附近公司|明渠流水循环发电；新型发电技术研发、咨询、转让；水利发电工程项目设计，电站工程施工，机电设备安装；发电设备制造、销售；其他新技术研发；新材料生产销售。|
内蒙古林西县亿万德实业有限责任公司|霍民|15849626733|||林西县东台子工业园区|16000万|2003-12-16|存续|150424000005594|91150424756662143T|756662143|91150424756662143T|有限责任公司(自然人投资或控股)(1130)|2003-12-16至2033-12-16|非金属矿物制品业||2016-06-13|16000万|||林西县市场监督管理局|||林西县东台子工业园区附近公司|法律、法规禁止的，不得经营；应经审批的，未获审批前不得经营；法律、法规未规定审批的，企业自主选择经营项目，开展经营活动＊＊|
林西县京华再生资源有限公司|高跃琴||||内蒙古自治区赤峰市林西县工业园区中区（冶金化工区）|12000万|2019-05-30|存续||91150424MA0Q968H60|MA0Q968H6|91150424MA0Q968H60|有限责任公司(自然人投资或控股)(1130)|2019-05-30至2039-05-29|废弃资源综合利用业||2019-05-30||||林西县市场监督管理局|||内蒙古自治区赤峰市林西县工业园区中区（冶金化工区）附近公司|再生资源回收、加工；有色金属废料和碎屑购销、加工处理、综合回收利用；有色金属产品销售。|
内蒙古银舟建筑工程有限公司|李吉明||||内蒙古自治区赤峰市林西县林西镇中昊物流园区二期6号楼7号厅|11000万|2018-03-07|存续|150424020330367|91150424MA0PR1HD4X|MA0PR1HD4|91150424MA0PR1HD4X|有限责任公司(自然人投资或控股)(1130)|2018-03-07至2028-03-06|房屋建筑业||2018-03-07||||林西县市场监督管理局|||内蒙古自治区赤峰市林西县林西镇中昊物流园区二期6号楼7号厅附近公司|土石方工程；建筑劳务；园林绿化工程；建筑装饰装潢；钢结构；水利安装工程；道路运输；市政工程；机电设备安装工程；水电安装工程。|
赤峰富尊环保科技有限公司|陈木兴|13951026076|1023136253@qq.com||内蒙古赤峰市林西县工业园区内冶金化工区|11000万|2017-08-31|存续|150424000023306|91150424MA0NHB887N|MA0NHB887|91150424MA0NHB887N|其他有限责任公司(1190)|2017-08-31至无固定期限|研究和试验发展||2017-08-31|100万|||林西县市场监督管理局|||内蒙古赤峰市林西县工业园区内冶金化工区附近公司|许可经营项目：无 一般经营项目：水污染、大气污染、固体废物（不含危险化学品）治理；冶炼渣料、烟尘综合回收利用，有色金属产品生产、销售；高新能源、高新材料、高新装备研发、制作、推广；有色领域工业技术实验，有色行业物料分析、检测、仲裁|
林西天一矿业开发有限公司|张春健|5311827|linxitianyikuangye@163.com||林西镇南门外工业园区|5000万|2006-04-07|存续|150424000000792|91150424787058360F|787058360|91150424787058360F|有限责任公司(自然人投资或控股)(1130)|2006-04-07至无固定期限|有色金属矿采选业||2019-02-21|5000万|||林西县市场监督管理局||Linxi Tianyi Mining Industry Development Co.,Ltd.|林西镇南门外工业园区附近公司|许可经营项目：无 一般经营项目：萤石采矿、选矿；氟化盐生产、销售；(凭许可证经营)锡、铜、铅、锌、焊锡合金加工；萤石、萤石粉、锡、铅、铜、锌、铁精矿购销。无水氟化氢、氟硅酸、氢氟酸、煤焦油|林西天一矿业开发有限公司是萤石块矿产品生产公司，拥有完整、科学的质量管理体系。林西天一矿业开发有限公司的诚信、实力和产品质量获得业界的认可。欢迎各界朋友莅临参观、指导和业务洽谈。
林西县凯牧农牧业有限责任公司|刘国军|15024726556|||内蒙古自治区赤峰市林西县林西镇常胜村|10000万|2017-12-04|存续|150424020135236|91150424MA0NN4WG9T|MA0NN4WG9|91150424MA0NN4WG9T|有限责任公司(自然人投资或控股)(1130)|2017-12-04至无固定期限|畜牧业||2018-11-01||||林西县市场监督管理局|||内蒙古自治区赤峰市林西县林西镇常胜村附近公司|畜牧养殖、家禽养殖、种牛、种羊繁殖；农作物、牧草种植销售。|
内蒙古昌敏建筑工程有限公司|徐昌敏||||内蒙古自治区赤峰市林西县林西镇中昊物流园区二期6号楼4号厅|10000万|2018-03-23|存续|150424020378452|91150424MA0PRMHN3L|MA0PRMHN3|91150424MA0PRMHN3L|有限责任公司(自然人投资或控股)(1130)|2018-03-23至2028-03-22|房屋建筑业||2018-03-23||||林西县市场监督管理局|||内蒙古自治区赤峰市林西县林西镇中昊物流园区二期6号楼4号厅附近公司|土石方工程；建筑劳务；园林绿化工程；建筑装饰装潢；钢结构；水利安装工程；道路运输；市政工程；机电设备安装工程；水电安装工程。|
林西县拓达矿业有限公司|李刚|15847614555|||内蒙古自治区赤峰市林西县十二吐乡西山根村|10000万|2018-04-20|存续|150424020464821|91150424MA0PTX9G6U|MA0PTX9G6|91150424MA0PTX9G6U|有限责任公司(自然人投资或控股)(1130)|2018-04-20至无固定期限|批发业||2018-04-20|8531万|||林西县市场监督管理局|||内蒙古自治区赤峰市林西县十二吐乡西山根村附近公司|探矿、矿产品购销、贵金属购销。|
林西县京蒙同兴实业有限公司|戴鹏飞|13901240297|||内蒙古自治区赤峰市林西县林西镇南门外村三组（林西铜都大街以南、兴林路以东）|10000万|2018-07-20|存续|150424020703206|91150424MA0PY9KFX9|MA0PY9KFX|91150424MA0PY9KFX9|其他有限责任公司(1190)|2018-07-20至无固定期限|零售业||2018-07-20||||林西县市场监督管理局|||内蒙古自治区赤峰市林西县林西镇南门外村三组（林西铜都大街以南、兴林路以东）附近公司|销售食品、食品加工销售、新鲜蔬菜、新鲜水果、水产品、鲜肉、鲜蛋、粮食、食品添加剂；日用品、机械设备、厨房及卫生间用具、针纺织品、文具用品、清洁用品、体育用品、服装鞋帽、家用电器、家具、自行车、五金交电、模具、计算机软件及辅助设备、通讯设备、建筑材料、化妆品、工艺品、刀具、计量器具、经济信息咨询、技术开发、技术服务、技术咨询、技术转让、技术推广、道路货物运输、餐饮服务、企业策划咨询、商务咨询、房地产信息咨询、房地产开发、物业管理、房屋租赁、酒店管理、仓储物流、冷库租赁、 技术培训、汽车销售、维修服务、影视制作。|
内蒙古赤峰抽水蓄能有限公司筹建处|张东|0476-8302202|||内蒙古赤峰市克什克腾旗经棚镇党政综合楼611办公室||2016-06-20|注销|150425000020263|91150425MA0MY5L42C|MA0MY5L42|91150425MA0MY5L42C|其他有限责任公司分公司(2190)||水的生产和供应业||2018-06-04||||克什克腾旗工商行政管理局|||内蒙古赤峰市克什克腾旗经棚镇党政综合楼611办公室附近公司|许可经营项目：无 一般经营项目：投资建设和经营抽水蓄能电站项目、新能源电站和再生能源项目；与上述业务相关的工程咨询、安装施工、检修、调试、技术咨询、技术监督、技术服务、科技开发、水工建筑物安全测试与维护、电力信息化建设与维护、电力工程监理|
克什克腾旗聚鑫农牧业农民专业合作社|李海红||||内蒙古自治区赤峰市克什克腾旗红山子乡天太永村|100万|2017-12-13|存续|150425020162139|93150425MA0NP07171|MA0NP0717|93150425MA0NP07171|农民专业合作社(9100)||畜牧业||2019-01-29||||克什克腾旗工商行政管理局|||内蒙古自治区赤峰市克什克腾旗红山子乡天太永村附近公司|组织成员养殖、育肥牛、羊，种植食用菌，销售成员的产品，开展成员所需的基础建设和饲草、饲料的运输、储藏服务，引进新技术、新品种，开展养殖、改良技术培训、技术交流和咨询服务。|
内蒙古大唐国际克什克腾煤制天然气有限责任公司|吴秀章|0476-5918023|||赤峰市克什克腾旗达日罕乌拉苏木|509097.4万|2010-12-10|存续|150425000007764|91150425564194197J|564194197|91150425564194197J|其他有限责任公司(1190)|2010-12-10至2060-12-09|燃气生产和供应业||2017-04-01|509097.4万|1000-4999人|1258|克什克腾旗浩来呼热市场监督管理所||Inner Mongolia Datang International Keshiketeng Coal Gas Co.,Ltd.|赤峰市克什克腾旗达日罕乌拉苏木附近公司|许可经营项目：煤制天然气及焦油、石脑油、粗酚、硫磺、硫铵、粉煤灰、炉渣、中水、蒸汽等副产品的生产、销售，煤化工技术咨询，设备检修 一般经营项目：无|
内蒙古赤峰抽水蓄能有限公司|王洪玉|0476-8302202|||内蒙古自治区赤峰市克什克腾旗芝瑞镇镇政府食堂二楼201办公室|166159万|2017-11-02|存续|150425000024131|91150425MA0NLF6G2N|MA0NLF6G2|91150425MA0NLF6G2N|其他有限责任公司(1190)|2017-11-02至无固定期限|电力、热力生产和供应业||2017-11-02|10000万|||克什克腾旗工商行政管理局|||内蒙古自治区赤峰市克什克腾旗芝瑞镇镇政府食堂二楼201办公室附近公司|许可经营项目：无 一般经营项目：电力电量生产、向电网销售电能、为电网提供服务、水电工程调试及检修、技术咨询、技术培训、旅游资源开发及运营|
华能赤峰新能源有限公司|文明刚|18548579614|591969751@qq.com||内蒙古赤峰市克什克腾旗盐业公司家属楼2单元402室|51616万|2014-04-24|存续|150400000030515|91150425097932153R|097932153|91150425097932153R|有限责任公司（非自然人投资或控股的法人独资）(1153)|2014-04-24至无固定期限|商务服务业||2018-05-10||小于50人|30|克什克腾旗工商行政管理局|||内蒙古赤峰市克什克腾旗盐业公司家属楼2单元402室附近公司|风力发电生产与销售；风力发电项目、太阳能发电项目以及其他新能源项目的投资与经营管理；电力技术的咨询服务；风电设备、太阳能设备和风电、太阳能发电线路的检修与维护；新能源科技研发。|
克什克腾旗金工国有资产经营有限公司|薛广林|0476-5226153|398530549@qq.com||内蒙古自治区赤峰市克什克腾旗人民政府党政综合楼|7500万|2010-10-20|存续|150425000007455|911504255612481538|561248153|911504255612481538|有限责任公司(国有独资)(1110)|2010-10-20至无固定期限|国家机构||2018-12-29|7500万|小于50人|2|克什克腾旗工商行政管理局|||内蒙古自治区赤峰市克什克腾旗人民政府党政综合楼附近公司|许可经营项目：无 一般经营项目：投资与经营管理。城市基础设施及市政工程建设。棚户区改造|
