2007-09-26|一种由栀子和三七制备的注射液的质量控制方法|CN03149527.3|CN100339706C|发明专利
2007-08-22|栀子药材和栀子半成品指纹图谱检测的质量控制方法|CN03146034.8|CN1333248C|发明专利
2006-06-07|治疗肠易激综合症的中药组合物及其制备方法|CN200410014704.0|CN1258372C|发明专利
2006-04-26|一种治疗中风病的中药组合物及其制备方法|CN03149526.5|CN1253169C|发明专利
2005-01-12|治疗肠易激综合症的中药组合物及其制备方法|CN200410014704.0|CN1562144A|发明专利
2004-07-21|一种治疗中风病的注射剂的质量控制方法|CN03149527.3|CN1514242A|发明专利
2004-02-25|一种治疗中风病的中药组合物及其制备方法|CN03149526.5|CN1476891A|发明专利
2004-02-18|一种中药质量控制方法|CN03146034.8|CN1475802A|发明专利
2003-03-26|输液瓶起盖机|CN02211742.3|CN2541423Y|实用新型