2019-01-09|中信银行股份有限公司东莞分行、东莞市泰成实业有限公司金融借款合同纠纷执行实施类执行裁定书|金融借款合同纠纷|申请执行人-中信银行股份有限公司东莞分行被执行人-东莞市泰成实业有限公司,东莞市盈和能源投资有限公司,东莞市志成实业投资有限公司,东莞市德成伟业投资有限公司,东莞市业成实业有限公司,东莞市德成新墙材料有限公司,鄂托克旗奋达煤焦建材有限责任公司,鄂托克旗盈和能源投资管理咨询服务有限责任公司,鄂托克旗汇富能源投资管理咨询服务有限责任公司|（2018）粤19执529号|https://www.tianyancha.com/lawsuit/f2b78b24147511e9a8b47cd30ae00894
2018-12-29|中信银行股份有限公司东莞分行、东莞市泰成实业有限公司金融借款合同纠纷执行实施类执行裁定书|金融借款合同纠纷|申请执行人-中信银行股份有限公司东莞分行被执行人-东莞市泰成实业有限公司,东莞市盈和能源投资有限公司,东莞市志成实业投资有限公司,东莞市德成伟业投资有限公司,东莞市业成实业有限公司,东莞市德成新墙材料有限公司,鄂托克旗奋达煤焦建材有限责任公司,鄂托克旗盈和能源投资管理咨询服务有限责任公司,鄂托克旗汇富能源投资管理咨询服务有限责任公司|（2018）粤19执528号|https://www.tianyancha.com/lawsuit/94460072137111e9a8b47cd30ae00894
2018-07-18|东莞市业成实业有限公司、中信银行股份有限公司东莞分行金融借款合同纠纷二审民事判决书|金融借款合同纠纷|上诉人-东莞市业成实业有限公司被上诉人-中信银行股份有限公司东莞分行,东莞市盈和能源投资有限公司,东莞市志成实业投资有限公司,东莞市德成伟业投资有限公司,东莞市泰成实业有限公司,东莞市德成新墙材料有限公司,鄂托克旗奋达煤焦建材有限责任公司,鄂托克旗盈和能源投资管理咨询服务有限责任公司,鄂托克旗汇富能源投资管理咨询服务有限责任公司|（2017）粤民终2918号|https://www.tianyancha.com/lawsuit/6807a4cf902411e8a8b47cd30ae00894
2018-04-03|东莞市业成实业有限公司、中信银行股份有限公司东莞分行金融借款合同纠纷二审民事判决书|金融借款合同纠纷|上诉人-东莞市业成实业有限公司被上诉人-中信银行股份有限公司东莞分行,东莞市盈和能源投资有限公司,东莞市志成实业投资有限公司,东莞市德成伟业投资有限公司,东莞市泰成实业有限公司,东莞市德成新墙材料有限公司,鄂托克旗奋达煤焦建材有限责任公司,鄂托克旗盈和能源投资管理咨询服务有限责任公司,鄂托克旗汇富能源投资管理咨询服务有限责任公司|（2017）粤民终2917号|https://www.tianyancha.com/lawsuit/b9d9d2cc952a11e8a8b47cd30ae00894
2018-04-03|东莞市业成实业有限公司、中信银行股份有限公司东莞分行金融借款合同纠纷二审民事判决书|金融借款合同纠纷|上诉人-东莞市业成实业有限公司被上诉人-中信银行股份有限公司东莞分行,东莞市泰成实业有限公司,东莞市盈和能源投资有限公司,东莞市志成实业投资有限公司,东莞市德成伟业投资有限公司,东莞市德成新墙材料有限公司,鄂托克旗奋达煤焦建材有限责任公司,鄂托克旗盈和能源投资管理咨询服务有限责任公司,鄂托克旗汇富能源投资管理咨询服务有限责任公司|（2017）粤民终2919号|https://www.tianyancha.com/lawsuit/ba06c1a6952a11e8a8b47cd30ae00894
2017-11-01|山东泰山天盾矿山机械股份有限公司与鄂托克旗奋达煤焦建材有限责任公司买卖合同纠纷执行裁定书|买卖合同纠纷|申请人-山东泰山天盾矿山机械股份有限公司被执行人-鄂托克旗奋达煤焦建材有限责任公司|（2015）鄂托执字第1331号|https://www.tianyancha.com/lawsuit/1ceb528d958111e8a8b47cd30ae00894
2017-11-01|山东泰山天盾矿山机械股份有限公司申请执行鄂托克旗奋达煤焦建材有限责任公司买卖合同纠纷执行裁定书|买卖合同纠纷|申请人-山东泰山天盾矿山机械股份有限公司被执行人-鄂托克旗奋达煤焦建材有限责任公司|（2015）鄂托执字第210号|https://www.tianyancha.com/lawsuit/1cebf850958111e8a8b47cd30ae00894
2016-02-26|山东泰山天盾矿山机械股份有限公司申请执行鄂托克旗奋达煤焦建材有限责任公司买卖合同纠纷执行裁定书|买卖合同纠纷|申请执行人-山东泰山天盾矿山机械股份有限公司被执行人-鄂托克旗奋达煤焦建材有限责任公司|（2015）鄂托执字第1331号|https://www.tianyancha.com/lawsuit/df69562baee645239cd65bc37a3c95ab
2014-11-23|山东泰山天盾矿山机械股份有限公司与鄂托克旗奋达煤焦建材有限责任公司买卖合同纠纷一审民事判决书|买卖合同纠纷|原告-山东泰山天盾矿山机械股份有限公司被告-鄂托克旗奋达煤焦建材有限责任公司|（2014）新商初字第1372号|https://www.tianyancha.com/lawsuit/3080eb911cb911e6b554008cfae40dc0