2018-02-01|赤峰市暖旭锅炉安装队与内蒙古丰信元工贸有限公司合同纠纷执行裁定书|合同纠纷|申请执行人-赤峰市暖旭锅炉安装队被执行人-内蒙古丰信元工贸有限公司|（2017）内0425执2148号|https://www.tianyancha.com/lawsuit/031ffcc40cb611e881ec008cfaf870e0
2018-02-01|克什克腾旗国土资源局与内蒙古丰信元工贸有限公司建设用地使用权出让合同纠纷一审民事判决书|建设用地使用权出让合同纠纷|被告-内蒙古丰信元工贸有限公司|（2017）内0425民初968号|https://www.tianyancha.com/lawsuit/fcbccf6d79ba11e8a8b47cd30ae00894
2017-07-25|赤峰永昊中小企业投资有限公司申请执行内蒙古丰信元工贸有限公司、赤峰恒德中小企业担保有限责任公司借款合同纠纷案执行裁定书|借款合同纠纷|申请执行人-赤峰永昊中小企业投资有限公司被执行人-内蒙古丰信元工贸有限公司,赤峰恒德中小企业担保有限责任公司|（2015）赤执字第12-5号|https://www.tianyancha.com/lawsuit/f6fb218e9b9a11e788a5008cfaf8725a
2017-07-25|赤峰永昊中小企业投资有限公司申请执行内蒙古丰信元工贸有限公司、赤峰恒德中小企业担保有限责任公司借款合同纠纷案执行裁定书|借款合同纠纷|申请执行人-赤峰永昊中小企业投资有限公司被执行人-内蒙古丰信元工贸有限公司,赤峰恒德中小企业担保有限责任公司|（2015）赤执字第12-4号|https://www.tianyancha.com/lawsuit/f71986799b9a11e788a5008cfaf8725a
2017-07-25|赤峰永昊中小企业投资有限公司申请执行内蒙古丰信元工贸有限公司、赤峰恒德中小企业担保有限责任公司借款合同纠纷案执行裁定书|借款合同纠纷|申请执行人-赤峰永昊中小企业投资有限公司被执行人-内蒙古丰信元工贸有限公司,赤峰恒德中小企业担保有限责任公司|（2015）赤执字第12-3号|https://www.tianyancha.com/lawsuit/f7380aa69b9a11e788a5008cfaf8725a
2017-07-10|赤峰市暖旭锅炉安装队与内蒙古丰信元工贸有限公司合同纠纷一审民事判决书|合同纠纷|原告-赤峰市暖旭锅炉安装队被告-内蒙古丰信元工贸有限公司|（2016）内0425民初3992号|https://www.tianyancha.com/lawsuit/250741adfc7d11e781ec008cfaf870e0