南京新街口金鹰火灾原因查明，5人被依法刑事拘留|-|直接经济损失929万元。 二不落实动火制度，不采取防护措施，违章作业 2015年7月5日，呼伦贝尔北方药业有限公司在冷凝水罐顶焊接作业时，未严格履行公司《动火作业安全管理规定》|-|微信公众号|-|11天前|-|https://news.tianyancha.com/detail/e5444b75669eda1df63fd7b48e4c218f0d88960b.html
南京新街口金鹰火灾原因查明，5人被依法刑事拘留|-|直接经济损失929万元。 二不落实动火制度，不采取防护措施，违章作业 2015年7月5日，呼伦贝尔北方药业有限公司在冷凝水罐顶焊接作业时，未严格履行公司《动火作业安全管理规定》|-|微信公众号|-|2019年05月26日|-|https://news.tianyancha.com/detail/d2ab4d3bbb2f669d33bdaa880b10122a3ef104f0.html
这些央企和上市公司缘何被点名？|-|集团）有限公司建设运行的嘉定区安亭生活垃圾处理厂渗滤液超标排入城市污水管网;呼伦贝尔北方药业有限公司异味扰民、超标排放|-|中国水网|-|2019年04月26日|-|https://news.tianyancha.com/detail/970f6d2795d8a5c52a674f3846b90249406f098a.html
这些央企和上市公司缘何被中央环保督察点名？|-|上海环保（集团）有限公司建设运行的嘉定区安亭生活垃圾处理厂渗滤液超标排入城市污水管网；呼伦贝尔北方药业有限公司异味扰民、超标排放、违规处置废物|-|微信公众号|-|2019年04月25日|-|https://news.tianyancha.com/detail/a3fb0aac087b08f02106d971aa71d36785e402e9.html
群众反映企业环境信息公开不及时，内蒙古环保厅居然……|-|鄂尔多斯| 114| 鄂尔多斯市君正能源化工有限公司（自备热电厂）| 否 呼伦贝尔| 119| 呼伦贝尔北方药业有限公司| 否 呼伦贝尔| 120| 呼伦贝尔安泰热电有限责任公司海拉尔热电厂||-|微信公众号|-|2017年06月21日|-|https://news.tianyancha.com/detail/7415e965edfa698f42e85348d139ab98f977830d.html
内蒙古的烟囱，春天里竟超标排放废气！|-|内蒙古大雁矿业集团有限责任公司雁南热电厂、乌海市广纳煤焦化有限公司、呼伦贝尔北方药业有限公司几家企业，近期，我们将计划进行实地调研，若有在地的伙伴愿意加入我们|-|微信公众号|-|2017年03月03日|-|https://news.tianyancha.com/detail/9a772467d5baf64d00580aa99afea9f3ca510ad5.html