国企|中煤集团招103人，已开始报名！|-|中煤西北能源有限公司隶属于中煤集团，位于鄂尔多斯市境内，地处呼包鄂“金三角”腹地，毗邻鄂尔多斯市政府，距鄂尔多斯飞机场10公里，包西铁路、包神铁路、东乌铁路、蒙华铁路|-|微信公众号|-|2019年04月15日|-|https://news.tianyancha.com/detail/e0f1960ba5910d7154eaf215e711a5923a895510.html
中煤西北能源有限公司，鄂尔多斯衡水实验中学招人啦！|-|康巴什交警」可快速关注 中西北能源有限公司 中煤西北能源有限公司隶属于中煤集团，位于鄂尔多斯市境内，地处呼包鄂“金三角”腹地，毗邻鄂尔多斯市政府，距鄂尔多斯飞机场10公里，包西铁路|-|微信公众号|-|2019年04月15日|-|https://news.tianyancha.com/detail/54289a871916f03335061a891251cfde86456475.html
多岗位|国企招366人，报名中|-|同等条件下优先录用，但报名及录用均须征得所在单位的同意。 二、公开招聘岗位 1.中煤西北能源有限公司销售中心招聘8人 2.中煤西北能源有限公司生产服务中心招聘专业技术人员10人|-|微信公众号|-|2019年04月15日|-|https://news.tianyancha.com/detail/c4dba61df7c183827b96e530d2af45100bb82e95.html
中煤西北能源有限公司，鄂尔多斯衡水实验中学招人啦！|-|中煤西北能源有限公司隶属于中煤集团，位于鄂尔多斯市境内，地处呼包鄂“金三角”腹地，毗邻鄂尔多斯市政府，距鄂尔多斯飞机场10公里，包西铁路、包神铁路、东乌铁路、蒙华铁路、包茂高速|-|微信公众号|-|2019年04月15日|-|https://news.tianyancha.com/detail/63674bcc0b83eca78558b6b6e059065d991024f5.html
【汇总】事业单位、银行、教师、国企等近期好工作都在这里！|-|查看详情 >> 中西北能源有限公司面向社会公开招聘103名员工 一* 岗位人数*** （一）中煤西北能源有限公司销售中心招聘 8 人 （二）中煤西北能源有限公司生产服务中心招聘专业技术人员|-|微信公众号|-|2019年04月14日|-|https://news.tianyancha.com/detail/707be96556a7544a2ce85bfb664fc8c1addc2efe.html
中煤西北能源有限公司招103人|-|中煤西北能源有限公司隶属于中煤集团，位于鄂尔多斯市境内，地处呼包鄂“金三角”腹地，毗邻鄂尔多斯市政府，距鄂尔多斯飞机场10公里，包西铁路、包神铁路、东乌铁路、蒙华铁路、包茂高速、荣乌高速穿越公司所属矿|-|微信公众号|-|2019年04月14日|-|https://news.tianyancha.com/detail/99cf586510ed6387699f9f4a65639eff711261ab.html
2019中煤西北能源有限公司招聘103人，五险一金|-|564039648 第时间获取招考信息 中煤西北能源有限公司隶属于中煤集团，位于鄂尔多斯市境内，地处呼包鄂“金三角”腹地，毗邻鄂尔多斯市政府，距鄂尔多斯飞机场10公里，包西铁路|-|微信公众号|-|2019年04月13日|-|https://news.tianyancha.com/detail/cd96d235055c312ca0e55e9df4d43e42722ee786.html
2019中煤西北能源有限公司招聘103人公告|-|中煤西北能源有限公司隶属于中煤集团，位于鄂尔多斯市境内，地处呼包鄂“金三角”腹地，毗邻鄂尔多斯市政府，距鄂尔多斯飞机场10公里，包西铁路、包神铁路、东乌铁路、蒙华铁路、包茂高速、荣乌高速穿越公司所属矿|-|微信公众号|-|2019年04月12日|-|https://news.tianyancha.com/detail/bcfa7ee917d11fffda68a39b31503f951feca999.html
中煤西北能源公司南梁煤矿顺利通过国家一级质量标准化矿井验收|-|从中煤西北能源有限公司传来喜讯，该公司所属南梁煤矿，顺利通过国家质量标准化验收团的考核，以91.25的高分顺利通过国家一级质量标准化矿井的验收。 西北能源公司南梁煤矿不断健全安全监控体系|-|能源界|-|2018年03月26日|-|https://news.tianyancha.com/detail/66d730739df050933ec5b13bf718d1fdcf62eec3.html