准环发〔2017〕60号|关于内蒙古华蒙泰不连沟煤业有限责任公司大路煤矸石热电厂启动锅炉工程（脱硫协同湿式除尘部环境影响报告表的批复分|-|-|准格尔旗环境保护局|环评审批许可
鄂环评字〔2016〕123号|鄂尔多斯市环境保护局关于内蒙古蒙泰不连沟煤业有限责任公司大路2×300MW煤矸石热电厂烟气超低排放工程环境影响报告表的批复|-|-|鄂尔多斯市环境保护局|同意内蒙古蒙泰不连沟煤业有限责任公司大路2×300MW煤矸石热电厂烟气超低排放工程
1527001300063	|爆破作业单位许可证|-|-|鄂尔多斯市公安局|非营业性爆破作业单位许可					
内国土预审字[2017]92号|内国土预审字[2017]92号|2017年11月15日|2020年11月15日|内蒙古自治区国土资源厅|建设用地预审
-|国家税务局批文|2018年01月15日|9999年12月31日|原鄂尔多斯市准格尔旗国家税务局办税服务厅|对纳税人延期申报的核准
准国 许受字 〔2018〕 第6 号|国家税务局批文|2018年01月15日|2099年12月31日|鄂尔多斯市准格尔旗国家税务局|对纳税人延期申报的核准
C1000002008111110001147|采矿许可证|2008年11月05日|-|中华人民共和国国土资源部|开采矿种：煤    开采方式：地下开采
（蒙）MK安许证字【2013KG012】|安全生产许可证|2016年10月26日|-|内蒙古煤矿安全监察局|煤炭开采（井工）