2018-10-16|内蒙古巨力实业集团有限责任公司、华宸信托有限责任公司与公司有关的纠纷二审民事判决书|与公司有关的纠纷|上诉人-内蒙古巨力实业集团有限责任公司被上诉人-华宸信托有限责任公司,鄂尔多斯市天泰房地产开发有限责任公司,巴彦淖尔市巨力城市建设开发有限公司,巴彦淖尔市宏远投资咨询有限公司,巴彦淖尔市兴园物流产业发展有限公司,巴彦淖尔市兴园农牧园林科技开发有限公司|（2017）最高法民终290号|https://www.tianyancha.com/lawsuit/89abf9fdd99111e8a8b47cd30ae00894
2018-04-16|贾宽荣与巴彦淖尔市兴园物流产业发展有限公司建设用地使用权转让合同纠纷一审民事判决书|建设用地使用权转让合同纠纷|被告-巴彦淖尔市兴园物流产业发展有限公司|（2017）内0802民初5341号|https://www.tianyancha.com/lawsuit/68a1915b952d11e8a8b47cd30ae00894
2015-11-03|白永建设工程施工合同纠纷执行案裁定书|建设工程施工合同纠纷|被执行人-鄂尔多斯市荣凯路桥工程有限公司,巴彦淖尔市兴园物流产业发展有限公司|（2015）临法执字第1462号|https://www.tianyancha.com/lawsuit/5703c19c14084bfa9ef7aa4d2ad9674e
2015-05-20|巴彦淖尔市三鑫小额贷款有限责任公司执行案裁定书|-|申请执行人-巴彦淖尔市三鑫小额贷款有限责任公司被执行人-巴彦淖尔市兴园物流产业发展有限公司,内蒙古巨力实业集团有限责任公司|（2015）临执异字第34号|https://www.tianyancha.com/lawsuit/8087b8a6b9f84545b09d1f38aadf6907
2015-05-20|巴彦淖尔市三鑫小额贷款有限责任公司执行案裁定书|-|申请执行人-巴彦淖尔市三鑫小额贷款有限责任公司被执行人-巴彦淖尔市兴园物流产业发展有限公司,内蒙古巨力实业集团有限责任公司|（2015）临执异字第33号|https://www.tianyancha.com/lawsuit/51ff5db4a561443ea28099bc0c71aee9
2014-12-09|华宸信托有限责任公司与张义林、内蒙古巨力实业集团有限责任公司等管辖裁定书|-|上诉人-张义林被告-白乌仁,华宸信托有限责任公司,巴彦淖尔市宏远投资咨询有限公司,鄂尔多斯市天泰房地产开发有限责任公司,陈洁,刘巧云,张满仓,郑春霞,巴彦淖尔市兴园农牧园林科技开发有限公司,巴彦淖尔市巨力城市建设开发有限公司,内蒙古巨力实业集团有限责任公司,巴彦淖尔市兴园物流产业发展有限公司|（2014）民二终字第97号|https://www.tianyancha.com/lawsuit/827086201cb711e6b554008cfae40dc0
2014-05-20|任长利与高步华、鄂尔多斯市荣凯路桥工程有限公司等民间借贷纠纷一审民事判决书|民间借贷纠纷|被告-鄂尔多斯市荣凯路桥工程有限公司,巴彦淖尔市兴园物流产业发展有限公司|（2013）临民初字第3453号|https://www.tianyancha.com/lawsuit/919397e81cba11e6b554008cfae40dc0