2018-12-20|杭锦旗国土资源局申请执行鄂尔多斯市中盛光伏有限公司建设用地使用权纠纷终本裁定书|建设用地使用权纠纷|被执行人-鄂尔多斯市中盛光伏有限公司|（2018）内0625执698号|https://www.tianyancha.com/lawsuit/4cf89f43071311e9a8b47cd30ae00894
2018-10-24|鄂尔多斯市和泰电力勘测设计有限责任公司与鄂尔多斯市中盛光伏有限公司建设工程设计合同纠纷终结执行裁定书|建设工程设计合同纠纷|申请执行人-鄂尔多斯市和泰电力勘测设计有限责任公司被执行人-鄂尔多斯市中盛光伏有限公司|（2017）内0625执1180号|https://www.tianyancha.com/lawsuit/b795fefeeace11e8a8b47cd30ae00894
2017-11-28|鄂尔多斯市中盛光伏有限公司与鄂尔多斯市和泰电力勘测设计有限责任公司房屋买卖合同纠纷二审民事判决书|房屋买卖合同纠纷|上诉人-鄂尔多斯市中盛光伏有限公司被上诉人-鄂尔多斯市和泰电力勘测设计有限责任公司|（2017）内06民终867号|https://www.tianyancha.com/lawsuit/3a73fcdbfd3c11e781ec008cfaf870e0
2017-08-01|鄂尔多斯市和泰电力勘测设计有限责任公司与鄂尔多斯市中盛光伏有限公司合同纠纷一审民事裁定书|合同纠纷|原告-鄂尔多斯市和泰电力勘测设计有限责任公司被告-鄂尔多斯市中盛光伏有限公司|（2016）内0625民初610号|https://www.tianyancha.com/lawsuit/1b3caba53cda11e8b0207cd30ae00c08
2016-08-18|原告鄂尔多斯市和泰电力勘测设计有限责任公司诉被告鄂尔多斯市中盛光伏有限公司合同纠纷撤诉裁定书|合同纠纷|原告-鄂尔多斯市和泰电力勘测设计有限责任公司被告-鄂尔多斯市中盛光伏有限公司|（2016）内0625民初610号|https://www.tianyancha.com/lawsuit/bd4a0dc135a447d4b26e1838a465196c
2016-01-08|江苏南通二建集团有限公司与陈新、蔡成建、郑金芳民间借贷纠纷再审上诉民事判决书|民间借贷纠纷|上诉人-江苏南通二建集团有限公司被上诉人-鄂尔多斯市中盛光伏有限公司|（2015）内民再一终字第00009号|https://www.tianyancha.com/lawsuit/70ef4ebc90a54aa4be4f2f39011cfdbd