2019-03-26|内蒙古盐湖镁钾有限责任公司合同纠纷一审民事裁定书|合同纠纷|申请人-苏州天沃科技股份有限公司被申请人-内蒙古盐湖镁钾有限责任公司|（2018）苏0582民初9743号之二|https://www.tianyancha.com/lawsuit/b9d3113703b8463e8f25f5522d126f5b
2019-03-15|苏州天沃科技股份有限公司与内蒙古盐湖镁钾有限责任公司买卖合同纠纷一审民事判决书|买卖合同纠纷|原告-苏州天沃科技股份有限公司被告-内蒙古盐湖镁钾有限责任公司|（2018）苏0582民初9743号|https://www.tianyancha.com/lawsuit/b138835d3b584d30bb0f9d80a9c0e568
2019-02-12|苏州天沃科技股份有限公司与内蒙古盐湖镁钾有限责任公司合同纠纷一审民事裁定书|合同纠纷|申请人-苏州天沃科技股份有限公司被申请人-内蒙古盐湖镁钾有限责任公司|（2018）苏0582民初9743号|https://www.tianyancha.com/lawsuit/831674c53c4b460e8e973bb941a077b3
2019-01-02|苏州天沃科技股份有限公司合同纠纷执行裁定书|合同纠纷|原告-苏州天沃科技股份有限公司异议人-内蒙古盐湖镁钾有限责任公司|（2018）苏0582执异113号|https://www.tianyancha.com/lawsuit/574c5d300f2011e9a8b47cd30ae00894
2018-12-28|内蒙古盐湖镁钾有限责任公司合同纠纷一审民事裁定书|合同纠纷|申请人-苏州天沃科技股份有限公司被申请人-内蒙古盐湖镁钾有限责任公司|（2018）苏0582民初9743号之一|https://www.tianyancha.com/lawsuit/de374fc50ce211e9a8b47cd30ae00894
2016-07-29|原告苏州天沃科技股份有限公司诉被告额济纳旗三和化工有限责任公司买卖合同纠纷一审民事裁定书|买卖合同纠纷|原告-苏州天沃科技股份有限公司被告-额济纳旗三和化工有限责任公司|（2016）内2923民初207号|https://www.tianyancha.com/lawsuit/ad88d536f00d49ac9a7a6784c455b998
2015-10-23|额济纳旗三和化工有限责任公司与烟台恒邦集团有限公司买卖合同纠纷二审民事判决书|买卖合同纠纷|上诉人-额济纳旗三和化工有限责任公司被上诉人-烟台恒邦集团有限公司|（2015）阿商终字第22号|https://www.tianyancha.com/lawsuit/d56693f814394964836d2cef5513e42a
2015-05-27|原告烟台恒邦集团有限公司诉被告额济纳旗三和化工有限责任公司买卖合同纠纷一审民事判决书|买卖合同纠纷|原告-烟台恒邦集团有限公司被告-额济纳旗三和化工有限责任公司|（2014）额商初字第16号|https://www.tianyancha.com/lawsuit/449cb921270a4d9f86d873ddad9131f0
2014-06-17|张军、额济纳旗三和化工有限责任公司、济宁迪尔安装有限公司与梁邦丽、曹克昌承揽合同纠纷二审民事判决书|承揽合同纠纷|上诉人-额济纳旗三和化工有限责任公司,济宁迪尔安装有限公司|（2014）阿民一终字第113号|https://www.tianyancha.com/lawsuit/e474483d1cb911e6b554008cfae40dc0