2018-12-31|内蒙古太仆寺旗草原酿酒有限责任公司与国家工商行政管理总局商标评审委员会一审行政判决书|-|原告-内蒙古太仆寺旗草原酿酒有限责任公司|（2017）京73行初4714号|https://www.tianyancha.com/lawsuit/a19048e80d7011e9a8b47cd30ae00894
2016-09-01|包头市黑土地酒业销售部诉国家工商行政管理总局商标评审委员会其他一案|-|原告-包头市黑土地酒业销售部|（2015）京知行初字第4315号|https://www.tianyancha.com/lawsuit/34337feba5e74afeb343cc5465f4b508
2016-08-30|包头市黑土地酒业销售部与国家工商行政管理总局商标评审委员会其他一审行政判决书|-|原告-包头市黑土地酒业销售部|2015年京知行初字第04315号|https://www.tianyancha.com/lawsuit/8d0fec77b07b412fb5d9831c598f6cf5
2016-03-25|内蒙古太仆寺旗草原酿酒有限责任公司与内蒙古草原王酒业有限公司、卓资县新区兴胜河套酒业门市纠纷一审民事判决书|-|原告-内蒙古太仆寺旗草原酿酒有限责任公司被告-内蒙古草原王酒业有限公司,卓资县新区兴胜河套酒业门市|（2015）乌民初字第2号|https://www.tianyancha.com/lawsuit/fbd68852b56e4e3dbb2809e0c8b5deea
2015-06-01|内蒙古草原王酒业有限公司与内蒙古太仆寺旗草原酿酒有限责任公司、内蒙古卓资县新区兴胜河套酒业门市侵害商标专用权纠纷一案再审审查裁定书|-|上诉人-内蒙古草原王酒业有限公司被上诉人-内蒙古太仆寺旗草原酿酒有限责任公司,卓资县新区兴胜河套酒业门市|（2015）内民知终字第00032号|https://www.tianyancha.com/lawsuit/aff5380c1cb511e6b554008cfae40dc0
2015-06-01|内蒙古草原王酒业有限公司与内蒙古太仆寺旗草原酿酒有限责任公司、内蒙古卓资县新区兴胜河套酒业门市侵害商标专用权纠纷一案二审民事裁定书|-|上诉人-内蒙古草原王酒业有限公司被上诉人-内蒙古太仆寺旗草原酿酒有限责任公司,卓资县新区兴胜河套酒业门市|（2015）内民知终字第00032号|https://www.tianyancha.com/lawsuit/edab7517a991461d82ec873fb3d2139c