赤环审字[2015]45号|关于林西县富强金属有限公司冶炼烟灰综合回收利用项目环境影响报告书的批复|-|-|赤峰市环境保护局|林西县富强金属有限公司冶炼烟灰综合回收利用项目环境影响评价文件报批许可
建字第1504242016GG012|建设工程规划许可证|-|-|林西县规划局|林西县富强金属有限公司冶炼烟灰综合回收利用项目（一期）地上总建筑面积27274.06平方米
赤经信投资字〔2017〕197号|政府主管部门批文|2017年07月05日|2019年07月05日|赤峰市经济和信息化委员会|关于同意林西县富强金属有限公司年处理15万吨有色金属废料综合回收利用项目备案的通知
1504241901141001|食品经营许可证|2019年01月14日|-|林西县市场监督管理局|热食类食品制售
1504240078|危险废物经营许可证|2018年09月20日|-|内蒙古自治区环境保厅|核准经营方式：收集、贮存、利用
核准经营危险废物类别HW22(304-001-22、321-101-22、321-102-22、)、HW23(336-103-23、900-021-23)、HW31(304-002-31、312-001-31、384-004-31、243-001-31、421-001-31、900-025-31)、HW48(091-001-48、321-002-48、321-003-48、321-004-48、321-005-48、321-006-48、321-007-48、321-008-48、321-009-48、321-010-48、321-011-48、321-012-48、321-013-48、321-014-48、321-016-48、321-017-48、321-018-48、321-019-48、321-020-48、321-021-48、321-022-48、321-027-48、321-028-48、321-029-48)、HW49（900-044-49）
核准经营规模：10万吨/年