“巴彦淖尔好人榜”5月候选人名单公示|-|在领导同事们面前成为一名工作得力的好助手。 杨慧，女，汉族，1964年11月出生，巴彦淖尔市市政环境发展有限公司公厕保洁员。今年55岁的杨慧|-|微信公众号|-|11天前|-|https://news.tianyancha.com/detail/e6c8adda2711e4b3971238f4fc1054159086d852.html
4月“巴彦淖尔好人榜”候选人名单公示|-|建设系统优秀共产党员等。 徐向荣，男，汉族，1974年12月出生，临河区政协委员，现任巴彦淖尔市市政环境发展有限公司市政管理部排水站站长。他参加工作以来，始终坚守在市政设施维护工作一线|-|微信公众号|-|2019年04月30日|-|https://news.tianyancha.com/detail/5ab1d30ad7f419e56a8b8412f8c6c49b5ae2ebb3.html
打造宜居城市，临河14条路9个广场公园将维修改造|-|对14条路、9个广场和公园的路面、给水、排水管网及检查井等进行维修改造。这是记者4月25日从巴彦淖尔市市政环境发展有限公司了解到的。 为了给城郊居民区群众提供更加方便的出行条件|-|微信公众号|-|2019年04月30日|-|https://news.tianyancha.com/detail/d4156ac4dbf29140a5ae4fb9740bad949d565713.html
“五一”表彰||巴彦淖尔市3个单位8个集体6名个人，有你认识的吗？|-|三瑞农业科技股份有限公司 内蒙古鲜农农牧业科技有限公司 内古自治区工人先锋号 （个） 巴彦淖尔市市政环境发展有限公司环卫部机动队 五原县环境卫生管理所清扫队|-|微信公众号|-|2019年04月29日|-|https://news.tianyancha.com/detail/ebe73dd1fe5ef2e494aeea1e2614a1e80c98142f.html
临河新添25处环卫工人爱心驿站|-|心 临新添25处环卫工人爱心驿站 妈妈 4月14日，记者从巴彦淖尔市市政环境发展有限公司了解到，今年，该公司在临河城区内新建25处环卫工人爱心驿站，全部工程将于本月下旬完工。|-|微信公众号|-|2019年04月15日|-|https://news.tianyancha.com/detail/7692ce2a8ca2b95609aea0c97c16ba17918b7aef.html
@所有巴彦淖尔人：这里有一份清明节文明祭扫倡议书，请您查收|-|大力维护优美整洁的城乡环境，为建设文明、秀美、和谐、幸福的巴彦淖尔贡献自己的一份力量！ 巴彦淖尔市市政环境发展有限公司 2019年4月2日 每“祭节” 环卫工人劳动量陡增5倍 在我国|-|微信公众号|-|2019年04月03日|-|https://news.tianyancha.com/detail/35e7c8e69deb6c61d0d91349d18c2aeca355d6aa.html
巴彦淖尔市21500多盏钠灯、节能灯“变身”LED灯|-|内蒙古自治区巴彦淖尔市市政环境发展有限公司将52条主次干道21500多盏钠灯及节能灯全部更换为LED灯，不仅美化亮化了城市，还节约了能源。 临河区城区路灯使用年代久远、工艺落后、光源衰退|-|维科网|-|2018年08月29日|-|https://news.tianyancha.com/detail/4ffa0d80fb5943d257d85986836a6d65b46919da.html
巴彦淖尔市7月7日招聘信息|-| 联系电话： 王女士：0478-7900333 张女士：15047286662 巴彦淖尔市市政环境发展有限公司招聘信息 招聘： 网络管理员 要求： 1、通信、电子工程、自动化|-|微信公众号|-|2017年07月08日|-|https://news.tianyancha.com/detail/a6d8e74b19f6e19affe1ce53e3bde80c9a2a5b5f.html