内国土资采划字[2016]095号|划定矿区范围批复|-|-|内蒙古自治区国土资源厅|采矿权划定矿区范围申请
T15420090902034822|勘查许可证|-|-|内蒙古自治区国土资源厅|盟市探矿权保留申请
bg-1432523470692|取水许可证|-|-|突泉县水务局|取用地下水
内国土资采划字[2017]060号|划定矿区范围批复|-|-|内蒙古自治区国土资源厅|采矿权划定矿区范围申请
C1500002010123120092417|采矿许可证|2018年07月21日|2019年07月21日|内蒙古自治区国土资源厅|采矿权延续申请2018
-|采矿许可证|2018年07月21日|-|兴安盟国土资源局|采矿权延续
152224000005613|营业执照|2001年12月25日|-|内蒙古自治区突泉县工商行政管理局|有色金属矿（铜、银）采选
（蒙）FM安许证字（2013）000247号|安全生产许可证|2013年05月13日|-|内蒙古自治区安全生产监督管理局|铜矿地下开采
C1500002010123120092417|采矿许可证|2014年09月01日|-|内蒙古自治区国土资源厅|铜矿、银