突环审字[2015]40号|环保验收|-|-|突泉县环保局|突泉县鑫光热力有限责任公司第二热源厂锅炉脱硫脱硝技改工程
兴环审﹝2016）38号|内蒙古突泉县突泉镇城镇集中供热改扩建工程环境影响报告书批复|-|-|兴安盟环境保护局|同意内蒙古突泉县突泉镇城镇集中供热改扩建工程
yx-1423471264872|取水许可证|-|-|突泉县水务局|取用地下水
突环验[2016]18号|环评验收|-|-|突泉县环保局|突泉县鑫光热力有限责任公司第二热源厂锅炉脱硫脱硝技改工程
兴水保【2016】35号|兴安盟水务局关于突泉县生物质资源综合利用项目2x15mw机组66千伏联网工程水土保持方案的批复|-|-|兴安盟水务局|水保投资53.67万元，补偿费5.1万元，防治责任面积3.83平方千米
突经投规字〔2016〕4号|项目备案|-|-|突泉县经济和信息化局|锅炉脱硫脱硝除尘技术改造
-|关于内蒙古鑫泰集团突泉县鑫光热力有限责任公司生物质资源综合利用２×１５MW项目66KV接网送出工程核准的批复|2017年06月20日|-|兴安盟发展和改革委员会|新建两台15MW机接入厂内升压站，升压站新建2条单回66KV线路至突泉220KV变电站66KV侧运行，导线型号及长度JL/G1A-300/25、鑫光Ⅰ3.67Km、鑫光Ⅱ3.66Km，突泉220KV变电站需扩建2个66Kv间隔。