2019-01-11|李银华与赤峰元易生物质科技有限责任公司委托理财合同纠纷其他民事裁定书|委托理财合同纠纷|被申请人-赤峰元易生物质科技有限责任公司|（2019）内0402财保20号|https://www.tianyancha.com/lawsuit/5f9e3279121a4d57a8e850685f31ce02
2018-10-01|河北恒源泵业有限公司与赤峰元易生物质科技有限责任公司买卖合同纠纷一审民事裁定书|买卖合同纠纷|原告-河北恒源泵业有限公司被告-赤峰元易生物质科技有限责任公司|（2018）冀0637民初740号|https://www.tianyancha.com/lawsuit/5f8f682dd4cf11e8a8b47cd30ae00894
2018-09-07|河北恒源泵业有限公司、赤峰元易生物质科技有限责任公司执行实施类执行裁定书|-|申请执行人-河北恒源泵业有限公司被申请执行人-赤峰元易生物质科技有限责任公司|（2018）冀0637执保104号|https://www.tianyancha.com/lawsuit/628e3fdfd4cf11e8a8b47cd30ae00894
2017-12-31|辛某与赤峰元易生物质科技有限责任公司劳动争议一审民事裁定书|劳动争议|被告-赤峰元易生物质科技有限责任公司|（2016）内0421民初1371号|https://www.tianyancha.com/lawsuit/d0d36c602c3311e8bc346c92bf3bac55
2017-03-20|李艳华、张超诉中国人寿保险股份有限公司阿鲁科尔沁旗支公司、赤峰元易生物质科技有限责任公司机动车交通事故责任纠纷一审民事裁定书|机动车交通事故责任纠纷|被告-中国人寿保险股份有限公司阿鲁科尔沁旗支公司,赤峰元易生物质科技有限责任公司|（2017）内0523民初1712号|https://www.tianyancha.com/lawsuit/b99b3ebdc15747e4ba1e7b7ca6c0665f
2015-03-12|李春艳诉赤峰元易生物质科技有限责任公司、张玉民、中国平安财产保险股份有限公司赤峰中心支公司机动车交通事故责任纠纷一审民事判决书|机动车交通事故责任纠纷|被告-中国平安财产保险股份有限公司赤峰中心支公司,赤峰元易生物质科技有限责任公司|（2014）阿鲁民初字第5714号|https://www.tianyancha.com/lawsuit/acd7c16c1cba11e6b554008cfae40dc0